,type,created_at,repo_id,repo_name,actor_id,actor_login,org_id,org_login,pr_review_comment_action,pr_review_comment_id,pr_review_comment_commit_id,pr_review_comment_site_admin,pr_review_comment_body,pr_review_comment_author_association,pr_number,pr_review_comment_reactions
5278,PullRequestReviewCommentEvent,2017-12-12 22:00:16+00:00,46388888,genialis/resolwe-bio,1026716,mstajdohar,2120224,genialis,created,82997938,272b006c8097d4128a8941efa890b7a56870ee99,False,"> He suggests thatwe modify frontend call to this process in way that is is able to accomodate other inputs or get them from configuration.

This would take too long. We either put this in Docker or write a DSS process that calls this and inserts the logo and template in the inputs. The DSS process would get the logo and template by slug. I do not believe there is and advantage of writing a DSS process over having the logo and template in the Docker.",OWNER,435,{}
5283,PullRequestReviewCommentEvent,2017-07-26 08:32:19+00:00,46388888,genialis/resolwe-bio,1026716,mstajdohar,2120224,genialis,created,52289432,3a1d806eb87d00f5bab4aa354998fb699053b4b5,False,Visibility of this field could depend on the value of the `ordering` field.,,315,{}
5284,PullRequestReviewCommentEvent,2017-07-26 13:35:25+00:00,46388888,genialis/resolwe-bio,1026716,mstajdohar,2120224,genialis,created,52359239,fa4e615075fb2d45c4f7b7efb52891e00e59618d,False,"cc @dblenkus, @jberci You'll love this fix. ;)",,317,{}
5285,PullRequestReviewCommentEvent,2018-03-07 13:57:58+00:00,46388888,genialis/resolwe-bio,26635159,mzganec,2120224,genialis,created,101918917,c2c3e7474aded7a2e9c4495dc6e97630ad9962fd,False,Why?,CONTRIBUTOR,464,{}
5286,PullRequestReviewCommentEvent,2017-03-02 23:43:32+00:00,46388888,genialis/resolwe-bio,2518544,tjanez,2120224,genialis,created,24794784,9b6c02b8557604f5614071cc4fd6c7dddf570207,False,"As described above, use single quotes for everything in the lines below.",,223,{}
5288,PullRequestReviewCommentEvent,2018-05-25 06:17:32+00:00,46388888,genialis/resolwe-bio,9283107,JenkoB,2120224,genialis,created,123254213,cf118128d93b479fce709c09f3225dad6d399ceb,False,For now I will leave only these 4 points as Checklist and the others as Guidelines. If we will notice this is not the optimal solution we can change it.,CONTRIBUTOR,554,{}
5311,PullRequestReviewCommentEvent,2018-05-04 19:37:32+00:00,81612762,trailofbits/manticore,470008,dwhjames,2314423,trailofbits,created,117736592,63efc4fb384bdd36f3e54d614b1c5e5625098f14,False,fixed in https://github.com/trailofbits/manticore/pull/875/commits/63efc4fb384bdd36f3e54d614b1c5e5625098f14,CONTRIBUTOR,875,{}
5338,PullRequestReviewCommentEvent,2016-01-18 22:25:52+00:00,6248645,ARM-DOE/pyart,1863738,nguy,2540600,ARM-DOE,created,,ceee1f8934a2a6c2f358bb91b593a471716cef70,False,"Sorry, I don't follow this comment. Which names are you referring to here?",,453,{}
5339,PullRequestReviewCommentEvent,2015-04-03 14:59:21+00:00,6248645,ARM-DOE/pyart,1050278,jjhelmus,2540600,ARM-DOE,created,,51540745dc55924db64308079171c26789258e7f,False,pyart.common.get_metadata,,271,{}
5382,PullRequestReviewCommentEvent,2018-07-11 23:58:07+00:00,68423917,adobe-type-tools/psautohint,2119742,miguelsousa,2768660,adobe-type-tools,created,136462738,748e81421a877871c8217891bce4fba1f7afe906,False,typo,MEMBER,64,{}
5392,PullRequestReviewCommentEvent,2017-02-02 14:20:26+00:00,70260962,Tubular/sparkly,1926182,drudim,2808498,Tubular,created,19793296,dc0b9c52447ba4336c41c0d78d2e3744f9180fb1,False,was trying to be consistent with `sqlalchemy`,,35,{}
5397,PullRequestReviewCommentEvent,2016-03-29 17:20:00+00:00,16316451,GoogleCloudPlatform/gcloud-python,520669,dhermes,2810941,GoogleCloudPlatform,created,,21cfae62a130f9206da3223a06e2e3befc78c826,False,Ditto on constants.,,1654,{}
5400,PullRequestReviewCommentEvent,2016-03-25 21:31:24+00:00,16316451,GoogleCloudPlatform/gcloud-python,520669,dhermes,2810941,GoogleCloudPlatform,created,,2de3e0a2c8590a74d7c4f8ff91e210d93e153642,False,Gotcha. Can you say that in the docstring?,,1661,{}
5403,PullRequestReviewCommentEvent,2016-07-05 20:24:49+00:00,16316451,GoogleCloudPlatform/gcloud-python,242750,tseaver,2810941,GoogleCloudPlatform,created,,ac6bd5c8f85c5f7a93c712d472ebe311a5a89f48,False,"Hmm, maybe this should have a `continue`, too.",,1952,{}
5415,PullRequestReviewCommentEvent,2015-08-08 00:15:41+00:00,16316451,GoogleCloudPlatform/gcloud-python,520669,dhermes,2810941,GoogleCloudPlatform,created,,e409492842094bf541777b455ad27305b78696b8,False,Pubsub,,1045,{}
5416,PullRequestReviewCommentEvent,2016-05-18 18:32:24+00:00,16316451,GoogleCloudPlatform/gcloud-python,913439,jerjou,2810941,GoogleCloudPlatform,created,,f43179d44311300acb2b2fe55126b2601cd73b70,False,"Can probably omit setting the project explicitly, since it was recommended above to set the `GCLOUD_PROJECT` environment variable. Also makes it easier to copy/paste the sample code, since you won't have to hand-edit to delete ""my-project-name"" and add your own",,1809,{}
5418,PullRequestReviewCommentEvent,2016-08-18 01:02:40+00:00,16316451,GoogleCloudPlatform/gcloud-python,360806,rimey,2810941,GoogleCloudPlatform,created,,808a102598c38661e2d3bc3568d1a21da8606872,False,"It's hard to judge how this will look when formatted, but maybe drop the words ""represented by"".",,2071,{}
5421,PullRequestReviewCommentEvent,2016-08-17 00:59:06+00:00,16316451,GoogleCloudPlatform/gcloud-python,360806,rimey,2810941,GoogleCloudPlatform,created,,c9ea77d709645aeec4143f4a680b71ec1aade57a,False,"We should use the correct terminology, which is ""monitored resource"".

However, it would be nice to come up with a better phrasing than ""Construct a monitored resource object.""",,2071,{}
5422,PullRequestReviewCommentEvent,2015-08-14 15:43:30+00:00,16316451,GoogleCloudPlatform/gcloud-python,242750,tseaver,2810941,GoogleCloudPlatform,created,,f9d4e326a1d6d38622da9bd3cd021a91604358c8,False,"I just tried it out. I don't think it makes things any clearer, so I reverted it.",,1056,{}
5424,PullRequestReviewCommentEvent,2016-08-25 21:40:15+00:00,16316451,GoogleCloudPlatform/gcloud-python,242750,tseaver,2810941,GoogleCloudPlatform,created,,976e8ed939c2e4ba7f60f27dd4c4e4a2fb8f1da8,False,">  I guess I'm not sure why I thought it had to be a JSON string that was returned

You were probably led astray by some of the connection(?) testing shims which dance around the serialized/deserialized forms.",,2179,{}
5428,PullRequestReviewCommentEvent,2015-08-27 13:15:11+00:00,16316451,GoogleCloudPlatform/gcloud-python,112928,jgeewax,2810941,GoogleCloudPlatform,created,,0cc3a192a6ed2a8a0ec97c9d706a3fae47a34d3e,False,Looks good :) thanks,,1090,{}
5429,PullRequestReviewCommentEvent,2015-06-23 18:46:26+00:00,16316451,GoogleCloudPlatform/gcloud-python,520669,dhermes,2810941,GoogleCloudPlatform,created,,5456bfb580b54743ea0ab2ac03154d55216d808b,False,Shouldn't we indicate that no name has been set?,,933,{}
5436,PullRequestReviewCommentEvent,2016-08-01 22:57:14+00:00,16316451,GoogleCloudPlatform/gcloud-python,11726936,supriyagarg,2810941,GoogleCloudPlatform,created,,f1a533fc41877fce9b7289be83a46a5d6a234769,False,"The idea is to have clean code, that will work on both versions of Python. The output looking slightly different is fine.",,2035,{}
5450,PullRequestReviewCommentEvent,2017-07-20 16:57:18+00:00,16316451,GoogleCloudPlatform/google-cloud-python,4346,lukesneeringer,2810941,GoogleCloudPlatform,created,51265562,9a6b7cba8c7d7f1515709afc096851064e891dbd,False,"Someone could mistakenly make a new `BatchSettings` object on the client, which the batch would not pick up.",,3463,{}
5455,PullRequestReviewCommentEvent,2016-10-05 04:06:02+00:00,16316451,GoogleCloudPlatform/google-cloud-python,520669,dhermes,2810941,GoogleCloudPlatform,created,2843722,a4874a79c5cd6660e6d3a6c1b9d496da3cd0aa9d,False,Didn't know it existed,,2499,{}
5463,PullRequestReviewCommentEvent,2017-07-21 18:32:56+00:00,16316451,GoogleCloudPlatform/google-cloud-python,250995,jonparrott,2810941,GoogleCloudPlatform,created,51552122,8ee3af266d7202ca9dc0361e38bd1c23954eea14,False,Do I need to pass in the `error_info` in that case?,,3626,{}
5464,PullRequestReviewCommentEvent,2017-07-19 21:56:23+00:00,16316451,GoogleCloudPlatform/google-cloud-python,250995,jonparrott,2810941,GoogleCloudPlatform,created,51053279,26bdbc5bd095a37e200054ec22227d179b89f0aa,False,"```
$ find ~/.pyenv/versions/3.6.0/lib/python3.6/ -name ""*.py"" | xargs grep ""\*\*kwargs\>"" | wc -l
1671
```

Plus, pylint probably doesn't like `kw`.",,3615,{}
5465,PullRequestReviewCommentEvent,2018-02-22 18:31:23+00:00,16316451,GoogleCloudPlatform/google-cloud-python,242750,tseaver,2810941,GoogleCloudPlatform,created,98678393,00dfef0a38fd740473ca58b723623232105380a6,False,"Hmm, I guess that does the Right Thing(TM) when the value passed in is `None`?",MEMBER,4757,{}
5468,PullRequestReviewCommentEvent,2017-07-18 19:35:14+00:00,16316451,GoogleCloudPlatform/google-cloud-python,520669,dhermes,2810941,GoogleCloudPlatform,created,50717957,f3e8d41b1a3df325b72b28744ad4fa07b3ef5f63,False,Does this support jitter? (It needs to.),,3618,{}
5481,PullRequestReviewCommentEvent,2016-10-18 00:00:18+00:00,16316451,GoogleCloudPlatform/google-cloud-python,1075173,waprin,2810941,GoogleCloudPlatform,created,4581767,fceaacfaf0bcb036fe68fa75a2c7ce087be7ba3b,False,gah fixed,,2553,{}
5482,PullRequestReviewCommentEvent,2018-07-03 15:34:39+00:00,16316451,GoogleCloudPlatform/google-cloud-python,99305,sduskis,2810941,GoogleCloudPlatform,created,134054079,a3216d1c35e25a80d4bd08fffbdf484af86a06aa,False,"This should be a type in enums, and not a string.",CONTRIBUTOR,5561,{}
5486,PullRequestReviewCommentEvent,2018-08-14 05:38:45+00:00,16316451,GoogleCloudPlatform/google-cloud-python,7764119,AVaksman,2810941,GoogleCloudPlatform,created,145914170,2e418e7a786c71bc980729335f8ee1c39f44fbae,False,Please rename this into `def test_get_cluster_states(self)` and remove the reference [below ](https://github.com/GoogleCloudPlatform/google-cloud-python/pull/5790/files#diff-d495c61ac7ca28885a9cb09130c527c1R462),CONTRIBUTOR,5790,{}
5487,PullRequestReviewCommentEvent,2018-07-02 17:55:50+00:00,16316451,GoogleCloudPlatform/google-cloud-python,99305,sduskis,2810941,GoogleCloudPlatform,created,133701619,1087c362a49adb54029e63881e263669e957b8a5,False,@aneepct ping,CONTRIBUTOR,5417,{}
5489,PullRequestReviewCommentEvent,2016-10-25 14:42:25+00:00,16316451,GoogleCloudPlatform/google-cloud-python,242750,tseaver,2810941,GoogleCloudPlatform,created,5662937,f757733b7a5f932ee7d7ff7e196d52c0c03c8dd2,False,Why not use the `_consume_toipcs` helper here?,,2602,{}
5490,PullRequestReviewCommentEvent,2016-10-25 21:36:10+00:00,16316451,GoogleCloudPlatform/google-cloud-python,192456,daspecster,2810941,GoogleCloudPlatform,created,5749201,72835543b676c5d204e21a20ea4b07e231d78049,False,I'm guessing I was trying to get the search to work on the github UI editor. :/ *facepalm*,,2611,{}
5635,PullRequestReviewCommentEvent,2018-08-01 23:25:07+00:00,7209075,pantsbuild/pants,14852634,Eric-Arellano,3065172,pantsbuild,created,142599177,93672e206791833a5869d248e9c09dce153d9f67,False,`six.StringIO` is not safe. It has different semantics in Py2. We'll need to strip all remaining instances.,CONTRIBUTOR,6290,{}
5645,PullRequestReviewCommentEvent,2018-04-17 10:38:35+00:00,7209075,pantsbuild/pants,1131704,illicitonion,3065172,pantsbuild,created,112753845,aef0301e5a3037e24fb3c82777fe8625d9da314a,False,"Rather than making separate scopes within the one test, let's just make these two separate tests",CONTRIBUTOR,5714,{}
5650,PullRequestReviewCommentEvent,2018-03-28 19:51:14+00:00,7209075,pantsbuild/pants,46740,stuhood,3065172,pantsbuild,created,107825038,afa2a28c0bef6314781e0b127169e2bef59953f6,False,"Ooh, right. :thumbsup:",OWNER,5618,{}
5653,PullRequestReviewCommentEvent,2018-01-10 20:10:46+00:00,7209075,pantsbuild/pants,12532471,CMLivingston,3065172,pantsbuild,created,87965402,90b599216b83f3005b53cda6ea9833d322a89c7e,False,"Not sure at the moment, and this will likely be a follow up concern after this PR has landed.",CONTRIBUTOR,5141,{}
5670,PullRequestReviewCommentEvent,2018-07-27 00:47:03+00:00,7209075,pantsbuild/pants,157586,jsirois,3065172,pantsbuild,created,140955178,661a7f2b5c0a2befdc28cdfa7b9e7d09294bc04c,False,Exactly.,MEMBER,6246,{}
5673,PullRequestReviewCommentEvent,2018-06-26 08:57:55+00:00,7209075,pantsbuild/pants,1131704,illicitonion,3065172,pantsbuild,created,131917102,be11338b60836b30984a15da752049790ba67812,False,"I have a personal style preference that if a function needs to own some data, it should take an owned version of it, rather than taking a reference and cloning it, because that's more upfront about the cost. So personally I would change this function signature to take a `PathBuf` instead of a `&Path`, rather than doing the cloning here. In this case, it avoids the clone entirely, because the caller is actually doing: `work_dir_buf.to_os_string().as_ref()`, so rather than doing `work_dir_buf.to_os_string().as_ref().clone().to_path_buf()` we should end up just doing `PathBuf::from(work_dir_buf.to_os_string())` and being happy.

(Also, I think `work_dir.clone().to_path_buf()` could be re-written as just `work_dir.to_path_buf()`, but the above is probably better :))",CONTRIBUTOR,6023,{}
5674,PullRequestReviewCommentEvent,2018-08-29 22:56:09+00:00,7209075,pantsbuild/pants,1305167,cosmicexplorer,3065172,pantsbuild,created,150785308,1b37c9d2b5202aee84b2a88cf3874fb618af08ee,False,"In the `fingerprint` method in `options_fingerprinter.py`, every input is wrapped in a list if it's not already. This implementation assumes that -- John left some comments below on how to make this more general, which I think addresses your concern specifically, but I think the correct solution is to not wrap everything in a list in `fingerprint`.",CONTRIBUTOR,6413,{}
5680,PullRequestReviewCommentEvent,2018-05-09 17:40:59+00:00,7209075,pantsbuild/pants,512764,benjyw,3065172,pantsbuild,created,118834040,98fe262bf5be96dde627d67c1264bd9dbc7ec180,False,Seems arbitrary that this is the only tool we register here whose name is in a symbolic constant.,CONTRIBUTOR,4729,{}
5700,PullRequestReviewCommentEvent,2017-11-03 18:57:37+00:00,7209075,pantsbuild/pants,596358,wisechengyi,3065172,pantsbuild,created,74159311,9e215ed1800aefb99915cbbc71bd1296e3b0a8cd,False,"buildozer works without `//`, so you can directly pass `address.spec`",CONTRIBUTOR,5023,{}
5703,PullRequestReviewCommentEvent,2017-03-06 22:01:10+00:00,7209075,pantsbuild/pants,512764,benjyw,3065172,pantsbuild,created,25376702,fb3eb89ca600d6c96b13f7e2198ca69608d397c2,False,D'oh! Sucking at copypasta is a rare achievement indeed... :),,4308,{}
5721,PullRequestReviewCommentEvent,2018-08-27 21:36:31+00:00,109059493,awslabs/keras-apache-mxnet,8022184,roywei,3299148,awslabs,created,149892129,687c7a158d8e94015ed20fc023d9f90019676647,False,"Same as above, add `assert is_sparse`",COLLABORATOR,159,{}
5732,PullRequestReviewCommentEvent,2018-01-10 02:27:49+00:00,70530854,awslabs/serverless-application-model,28720070,georgmao,3299148,awslabs,created,87717884,4a5d8dffcd11ee0d56f22490835859d1ddbd56a5,False,Done. Policies added.,CONTRIBUTOR,246,{}
5752,PullRequestReviewCommentEvent,2018-07-12 09:31:39+00:00,30618733,prometheus/client_python,7115638,brian-brazil,3380462,prometheus,created,136571670,b95fc8350a70683fee938137be596ff7acb75430,False,"My point is that `id(self)` doesn't help, as you wouldn't be seeing a race in the first place if that worked. So this doesn't fix reentrancy. We may need a stack here.",MEMBER,288,{}
5818,PullRequestReviewCommentEvent,2016-09-18 23:57:33+00:00,8763405,SoCo/SoCo,618191,americanwookie,3826649,SoCo,created,,63137a3dec1371dbb1ac858a19c59941371ab5eb,False,"Wait! As I read your comment two steps down, I realize, now I know how you're thinking this can be restructured . . . lemme know what you think.",,413,{}
5831,PullRequestReviewCommentEvent,2016-04-25 16:57:10+00:00,49976939,learningequality/kolibri,8888020,MCGallaspy,3926525,learningequality,created,,1be54c212ed4fd45a13559e8a9e69adfec50171b,False,I wanted to be able to distinguish between fields which should be displayed on a creation form vs fields that should be editable in the parent CrudView's config options -- hence `create` vs the implied `edit`. But perhaps better would be `creatable` & `editable` (or `creatable_fields` & `editable_fields`).,,61,{}
5839,PullRequestReviewCommentEvent,2017-03-27 22:15:58+00:00,49976939,learningequality/kolibri,9877852,DXCanas,3926525,learningequality,created,29316654,130df11a0a7e9054a39d32f267c9ededdd43c6e4,False,"@christianmemije iirc, the modal doesn't exist until it's called? If that understanding is correct, there would be code to create a modal inside of each row, but it wouldn't impede on performance (if that's what you're arguing for).

But I am a little conflicted regarding whether we should keep it outside or not because of where the call to open the modal happens",,1117,{}
5843,PullRequestReviewCommentEvent,2017-11-10 00:52:51+00:00,49976939,learningequality/kolibri,10248067,jonboiser,3926525,learningequality,created,75636940,2341775b1a0ee47f87204d7f84180a08a03bc084,False,flake8 warning here: only one line between methods.,CONTRIBUTOR,2566,{}
5848,PullRequestReviewCommentEvent,2016-02-02 01:35:00+00:00,49976939,learningequality/kolibri,374612,benjaoming,3926525,learningequality,created,,9759789a131e3c196191a98463f775f672904d77,False,Could probably reset migrations? :),,12,{}
5851,PullRequestReviewCommentEvent,2017-01-22 17:34:15+00:00,49976939,learningequality/kolibri,1680573,rtibbles,3926525,learningequality,created,17833413,5d7bb3c19d5eb47fce227737afea4c5da8dd19c2,False,"Hrm, if there is an error, do we want to wipe out any existing data?",,827,{}
5856,PullRequestReviewCommentEvent,2017-04-07 18:02:27+00:00,49976939,learningequality/kolibri,10248067,jonboiser,3926525,learningequality,created,31626071,b79f49912ee9f257d7f430297b11a495b3437aae,False,"Exams are not transformed to proper format for pageState. Need to figure out the actual payload from api is,  and how to get it to format expected by view.",,1203,{}
5865,PullRequestReviewCommentEvent,2016-09-19 19:37:19+00:00,49976939,learningequality/kolibri,2367265,indirectlylit,3926525,learningequality,created,,b82eaca946f62feca48d76ec404f6cb79ab822ba,False,sounds good,,513,{}
5913,PullRequestReviewCommentEvent,2015-07-15 07:22:19+00:00,11681402,aldryn/aldryn-people,366813,vxsx,4201738,aldryn,created,,3389388f338d88de4482885a7cdc127d3f8b2a11,False,what's meta?,,41,{}
5919,PullRequestReviewCommentEvent,2016-06-23 08:29:55+00:00,27823188,aldryn/aldryn-newsblog,14330,stefanfoulis,4201738,aldryn,created,,98e9c6ed7d7afcb3bd2bb9e511b9e4f47c2e340f,False,"I would have written ``Autoren automatisch erstellen?``
But I'm no expert :-)",,408,{}
5924,PullRequestReviewCommentEvent,2017-07-06 19:56:45+00:00,23127861,nylas/nylas-python,728526,pfista,4219865,nylas,created,48446056,fdcd2146b361c2b24f7ff1d7c03d6ceece5f2f12,False,"We shouldn't remove the state param yet, so we could just pass an empty string for now until we add support for the argument in a future PR. ",,53,{}
5951,PullRequestReviewCommentEvent,2015-11-09 10:44:22+00:00,10475661,onespacemedia/cms,1781176,danielsamuels,4577273,onespacemedia,created,,498eae5043803cfca355a60f80597278deca1e8c,False,Might not need these any more?,,85,{}
5961,PullRequestReviewCommentEvent,2017-11-24 17:29:40+00:00,58479957,juju/python-libjuju,66491,rogpeppe,4604548,juju,created,78964427,79e2fd9f32d7a4790d354719157e1297c5a67df1,False,"We also use it to call other methods such as Model._connect_direct, which wouldn't work with that change.
It can also be useful for debugging - I think it's probably reasonable as is.",OWNER,187,{}
5990,PullRequestReviewCommentEvent,2016-06-24 17:37:55+00:00,41820544,databricks/spark-sklearn,7594753,thunterdb,4998052,databricks,created,,52fad18554af8ed6ad48d4e4ad649149c78e33b1,False,list comp please,,25,{}
5991,PullRequestReviewCommentEvent,2018-07-13 20:24:17+00:00,93211371,databricks/databricks-cli,19397936,xuanwang14,4998052,databricks,created,137176666,aefd6dbdaf6b270b6884ec8e74a274793935115f,False,Why does this method need to know `resource_id`,NONE,137,{}
5994,PullRequestReviewCommentEvent,2018-07-30 20:38:42+00:00,93211371,databricks/databricks-cli,4492809,andrewmchen,4998052,databricks,created,141706680,4657b7478f2ef74fac9faec9a80cb46bed13b993,False,we should check this in the validation logic right?,MEMBER,149,{}
5995,PullRequestReviewCommentEvent,2017-11-01 20:12:09+00:00,93211371,databricks/databricks-cli,4492809,andrewmchen,4998052,databricks,created,73603126,006402a596d4992d8f5e92c9264913c71eaa8c87,False,It is supported and we'll add it to the API doc this release.,MEMBER,30,{}
6021,PullRequestReviewCommentEvent,2016-10-25 12:45:55+00:00,19141770,etalab/udata-gouvfr,3556,davidbgk,5313610,etalab,created,5640958,a2bf81d62ca03affb70b5565f7816cf3e3d5c2ed,False,"Both work, to be removed? ;)",,131,{}
6088,PullRequestReviewCommentEvent,2015-06-02 09:27:05+00:00,12968651,pgmpy/pgmpy,1461453,ankurankan,5500131,pgmpy,created,,2cac0fc3f0160378cf0d2340250b94e7fe66e2e4,False,"@vivek425ster It returns a dict. So, change this to something like: `dict: dict of type {node: xml}`",,401,{}
6102,PullRequestReviewCommentEvent,2016-04-18 09:57:14+00:00,41092776,superdesk/superdesk-core,180617,vied12,5527298,superdesk,created,,cc22b24a26375341a72a31ac6fb6afdd77e19974,False,Is there anything to do for embedded images too ?,,304,{}
6113,PullRequestReviewCommentEvent,2017-06-21 21:49:13+00:00,41092776,superdesk/superdesk-core,8636746,akintolga,5527298,superdesk,created,45572777,8a8674b360bfd2dfc0eebf510f2e63087af5f274,False,Remove,,957,{}
6142,PullRequestReviewCommentEvent,2017-12-15 17:24:28+00:00,91020334,ni/nimi-python,11483903,texasaggie97,5598284,ni,created,83872985,6477c4d12718615d3630f1a35055a3f53117eec7,False,Okay.,COLLABORATOR,684,{}
6148,PullRequestReviewCommentEvent,2017-10-26 19:04:29+00:00,91020334,ni/nimi-python,11483903,texasaggie97,5598284,ni,created,72306705,706461935f7dc5c1769acd122d37b66a2e7031cf,False,Fixed,COLLABORATOR,530,{}
6178,PullRequestReviewCommentEvent,2017-10-18 17:32:14+00:00,91356408,allenai/allennlp,16001974,DeNeutoy,5667695,allenai,created,70293983,905ba09af059c4fc797e8a07f8dac76f5b4397e0,False,"We do that for the tokenisers because we might load many instances of the class though right? Doesn't seem applicable here - the service only ever loads a single `Predictor` per model, and `predict` can't really cache spacy in memory because it's a command line tool and it only predicts on a single model at a time.",CONTRIBUTOR,412,{}
6180,PullRequestReviewCommentEvent,2018-03-20 23:14:44+00:00,91356408,allenai/allennlp,3291951,matt-gardner,5667695,allenai,created,105569829,ca9f4ebb99c0bc0fb3444f7d4c9fbdd6c45ce451,False,"Because it's not really feasible to swap out different trainers.  Taking these dependencies as inputs instead of instantiating them directly in the model is only useful when there are multiple valid alternatives and we want to experiment with them.  That's not true of our `DecoderTrainers`, and it's not clear to me that it will ever be true.  Also, because `DecoderTrainer` is generic over the supervision type, it only really makes sense to allow `DecoderTrainers` that match the supervision type that your model has, and we can't enforce that with our dependency injection.

If you find yourself wanting to try a few different training options, you'll first have to make sure that your model has the right supervision available for all of them.  Then you can add some flags to switch between them, but I'd still just instantiate them directly here.  _Maybe_ there will be a day when we have enough options and a very flexible model, and it will make sense to allow this dependency to be injected again.  But for now, it's just added complexity that isn't necessary.",MEMBER,986,{}
6184,PullRequestReviewCommentEvent,2018-08-16 21:00:07+00:00,91356408,allenai/allennlp,16001974,DeNeutoy,5667695,allenai,created,147022029,82506a074d276200091fd4235fdf1f7a38294426,False,"Basically, there was a problem when I masked out the scores per tag for the root node. The edge weights for the MST are just the max over the labels, but for actually choosing a label, we just take the argmax from over the labels for the given arc - so for the word which is the root of the tree (i.e has the root as it's parent), all of the label scores were zero - so it was arbitrarily picking the first one. I needed to separate the choosing of the labels to use the original unmasked scores, and only use the masked scores for decoding the arcs. Can I make that comment better?",CONTRIBUTOR,1619,{}
6187,PullRequestReviewCommentEvent,2018-08-22 09:05:21+00:00,91356408,allenai/allennlp,6792642,sebastianruder,5667695,allenai,created,148392489,c08fe9cc8f33261b9444c67fb6036c90217cbca7,False,Done.,NONE,1636,{}
6189,PullRequestReviewCommentEvent,2018-03-30 21:06:00+00:00,91356408,allenai/allennlp,16001974,DeNeutoy,5667695,allenai,created,108437193,57af1186c6bcee8c8ba874112ceba9f435bf7628,False,"This isn't necessary - just add an `if self._num_labels is not None:` block in `index`, because then you could also pass the number of labels if you know it.",CONTRIBUTOR,1054,{}
6216,PullRequestReviewCommentEvent,2015-01-09 21:56:25+00:00,4744355,soft-matter/trackpy,2985325,nkeim,5857177,soft-matter,created,,fa3915411815abdd1c2e7fb04f069dda502419e5,False,"These collections have to be mutable, and in Python 3 they are not unless I do something like this.",,192,{}
6233,PullRequestReviewCommentEvent,2016-12-14 12:39:44+00:00,21839884,a10networks/a10-neutron-lbaas,1644042,Cedev,5942705,a10networks,created,12897515,4155dddf09bdd919e28467a445d5e3cc906a624b,False,"`if bindings` is too late to do any good, it was already iterated in `unbound = ...`",,382,{}
