,type,created_at,repo_id,repo_name,actor_id,actor_login,org_id,org_login,pr_review_comment_action,pr_review_comment_id,pr_review_comment_commit_id,pr_review_comment_site_admin,pr_review_comment_body,pr_review_comment_author_association,pr_number,pr_review_comment_reactions
699,PullRequestReviewCommentEvent,2016-12-15 14:53:12+00:00,24005390,tBuLi/symfit,2188968,tBuLi,,,created,13130178,73adff8f2eb0079731fd40d60af370a5b1b100ad,False,"I think `Derivative(y, x) in self.model` will suffice, right?",,33,{}
772,PullRequestReviewCommentEvent,2016-09-10 05:13:02+00:00,18313451,dsoprea/PySvn,715626,dsoprea,,,created,,e2face79318f8cf6589a9786da47070ec1716f93,False,Undo this.,,48,{}
990,PullRequestReviewCommentEvent,2016-08-24 09:24:21+00:00,15938073,JelteF/PyLaTeX,1162278,JelteF,,,created,,63409f606ef387f2503c097192b4fee1c1f62b5e,False,"If you add the following in between these lines Sphinx error should be gone (add a newline before and after):
```rst

.. code-block:: latex

```

Is a special package needed for the textcolor command.",,126,{}
1097,PullRequestReviewCommentEvent,2016-03-13 01:22:00+00:00,6982384,cdown/tzupdate,660663,cdown,,,created,,4aedc0321bea31b1df7c468ac8a21b743541d92f,False,Are you running with `tox -e quick`? It runs E2E tests fine for me.,,12,{}
1137,PullRequestReviewCommentEvent,2016-07-27 10:35:26+00:00,16331291,davisking/dlib,6259399,davisking,,,created,,71ab04f7bcff6917d0804625ad39a44a9f364607,False,"Sounds good.  I wager the best thing to do is to scale it to [0,255].   :)",,170,{}
1141,PullRequestReviewCommentEvent,2017-09-10 13:30:11+00:00,16331291,davisking/dlib,2297572,reunanen,,,created,61684730,90da2bbc0b2f42a4b0420c6cefd34437e209b165,False,"Sorry. :)

I guess I just wanted to keep the constness.

Fixed.",CONTRIBUTOR,809,{}
1266,PullRequestReviewCommentEvent,2015-10-10 05:47:54+00:00,17308448,jquast/blessed,972584,jquast,,,created,,48ae54f2202384bdc7eb38ae981229230391f74a,False,man... lot of mojo here without any test cases !,,32,{}
1341,PullRequestReviewCommentEvent,2016-09-07 15:11:44+00:00,50450913,peterbe/hashin,413772,graingert,,,created,,99b3de50110c7d104fa143ec8714ba3906164a16,False,"that's generally when you want to run these, it just creates an object it doesn't parse any arguments.",,21,{}
1403,PullRequestReviewCommentEvent,2018-02-02 08:47:29+00:00,47562322,thouska/spotpy,7271807,havanagrawal,,,created,93551110,61f881912b275ad6a14716adb33c136bd4003987,False,"This test was incorrect. Since `save` is called only once, ideally, it should have had only one record in the database, but because it used to make an entry even during initialization, it would have 2 records. Issue #106 ",CONTRIBUTOR,105,{}
1445,PullRequestReviewCommentEvent,2017-07-07 21:49:28+00:00,56257335,Rambatino/CHAID,3631109,Rambatino,,,created,48726274,0e53de8732dda8b53a3280f8f7e92c371c6a5e93,False,"This is kinda gross. Will need to discuss this with you @xulaus, it's logic that seems to be the best in a given situation, but isn't foolproof. Actually, I don't think this can every go into prod.",,73,{}
1559,PullRequestReviewCommentEvent,2016-12-20 11:52:22+00:00,54787116,guyzmo/git-repo,254441,guyzmo,,,created,13743824,5275eef601bba27c342a6524a93dc628565130da,False,"This feature is being implemented [in another pull request](https://github.com/guyzmo/git-repo/pull/76/files), which is ready and will be released along the next release (which is due relatively soon, it's mostly depending on Gitlab to merge a patch I made).

So I'm merging that PR into devel (I actually thought I already did), so you can rebase your branch and use `self.insecure` instead of verify.",,82,{}
1663,PullRequestReviewCommentEvent,2017-11-20 13:10:07+00:00,55500071,lgiordani/punch,14644,Daenyth,,,created,77776229,e1129c7d8b4f5bb8b913f8a9d2d9c3b46456522c,False,👎  `no cover` only helps if you want 100% coverage as a vanity metric; better that it's honestly lower than papered over.,NONE,26,{}
1712,PullRequestReviewCommentEvent,2018-05-10 17:51:10+00:00,53418103,minrk/wurlitzer,5440856,gidim,,,created,119182020,ad7c6be7fdea63ba587627e1959a59aac5f81bfa,False,Why did you change self.flush_interval to flush_interval?,NONE,16,{}
1929,PullRequestReviewCommentEvent,2016-07-21 09:23:02+00:00,11929631,craffel/mir_eval,6766142,ErikJohnsonCU,,,created,,42f03a03c5b430fc2dfea45995dc423802adc6df,False,That is exactly what it does! I guess I should have read the documentation more carefully for that function... Thanks!,,207,{}
1932,PullRequestReviewCommentEvent,2016-06-17 15:36:33+00:00,11929631,craffel/mir_eval,1190540,bmcfee,,,created,,435094dbc33f51db207e4439c9b5ac2cbb7b1cd4,False,"Doublederp on me for not regression testing against librosa's converter.

Fixing and updating tests now.",,196,{}
2039,PullRequestReviewCommentEvent,2016-07-21 23:16:17+00:00,20101515,giampaolo/psutil,681260,giampaolo,,,created,,e83c0fb9ccaa369bc281bf9ffe6d2a01dbace02a,False,just dedent this by 4 spaces and it's good to be merged,,865,{}
2048,PullRequestReviewCommentEvent,2016-01-02 21:58:58+00:00,20101515,giampaolo/psutil,2221844,0-wiz-0,,,created,,7e98e0b9ba6426be86dfcea02c9d2ef18d3554b5,False,Done.,,557,{}
2070,PullRequestReviewCommentEvent,2017-12-15 08:06:51+00:00,23076316,horazont/aioxmpp,271710,horazont,,,created,83737508,d94ab0efb3b2c1af07367f7cd97e98ed983bc4dd,False,"Ejabberd would have to be able to work with that, it’s not the clients fault in that case (if they need special casing, they should negotiate that feature).

I don’t have strong opinions either way, in any case we’ll just enable it in JabberCat.",OWNER,165,{}
2072,PullRequestReviewCommentEvent,2017-12-14 18:28:35+00:00,23076316,horazont/aioxmpp,271710,horazont,,,created,83600367,d94ab0efb3b2c1af07367f7cd97e98ed983bc4dd,False,"Right, good point. In that case, we need to try both, so using asyncio.gather/asyncio.wait seems reasonable.",OWNER,165,{}
2144,PullRequestReviewCommentEvent,2015-08-23 01:28:15+00:00,2420190,myusuf3/delorean,156825,myusuf3,,,created,,922eb86a06c6af39100aee5a83302aec50cdebfd,False,"Nice :100:
",,73,{}
2279,PullRequestReviewCommentEvent,2018-03-30 14:20:18+00:00,58374888,wkentaro/labelme,4310419,wkentaro,,,created,108342451,a82fe58befe2723c2d55f3a6d70a9d5d0f343d06,False,"I think keeping the previous label is a good idea.
However, how can it be achieved?
Where do you keep the previous label?",OWNER,96,{}
2295,PullRequestReviewCommentEvent,2015-02-01 03:30:33+00:00,1998014,Diaoul/subliminal,850374,caronc,,,created,,1b7291e45c6f9b5404a743e222cd6d3739168dc0,False,"This way it doesn't change for the entire instance your using it.  I wouldn't want 1 request to come from what appears to be 1 browser, and the second from another.  A random one is chosen at the start and remains so until the actions you issued are complete.  It was kind of my intentions. Did you want me to change this then to be at runtime instead?",,404,{}
2298,PullRequestReviewCommentEvent,2016-02-01 12:28:39+00:00,1998014,Diaoul/subliminal,319220,Diaoul,,,created,,c97f02498599a1268d4938bf9e0682be95104b97,False,"I meant can you get rid of `name_matches` and use `sanitized_string_equal` instead? For your examples you can just `s/[SE]\d{2}//g` and send the result to `sanitized_string_equal`. I'd prefer have only one function that does the string match, if need be it can be improved to fit your use case.
I may need to add parameterized unittests to `sanitized_string_equal`",,513,{}
2307,PullRequestReviewCommentEvent,2015-12-23 22:54:13+00:00,41179827,Rapptz/discord.py,5514447,SamSchlegel,,,created,,1bff1f533d200c52db4991928069a79b7f547197,False,Didn't add myself to this but I can if you want,,64,{}
2463,PullRequestReviewCommentEvent,2016-06-13 04:18:38+00:00,20283850,dsoprea/PyInotify,715626,dsoprea,,,created,,754d49c3bbf05880de8c7cf8b9d8bf53ddefa8e0,False,"It's better to always use a tuple with `%`, though it looks a little nicer to use format() with the exception messages.",,10,{}
2594,PullRequestReviewCommentEvent,2015-05-02 11:17:30+00:00,30484966,michael-lazar/rtv,4593141,arnoutpierre,,,created,,f3f9fc265c6be4029d485b7dd364eff761a333a3,False,"I chose `parser` for instance of `configparser.ConfigParser`, this is more accurate and avoid lot of `conf*` variables",,97,{}
2600,PullRequestReviewCommentEvent,2015-05-02 02:14:06+00:00,30484966,michael-lazar/rtv,5026795,michael-lazar,,,created,,0817dd28b5a4b7db984ebcf5f93907374260d4cc,False,"I would say rename this `config` to something else e.g.
```python
conf = configparser.ConfigParser()
```
That way you won't have to use a special import
```
from . import config as rtvconfig
```",,97,{}
2623,PullRequestReviewCommentEvent,2017-06-21 13:50:19+00:00,69458400,mosquito/aio-pika,160652,connec,,,created,45437965,7f44c9a29deb057620c356e6f3d0ac17f3c234a4,False,"Yes, it's server-side state that gets returned with every `queue-ok` response from the AMQP server.

It does seem a bit odd putting it on `Queue` (since it will be out-of-date as soon as it's used), but it's the easiest thing to do.

An alternative would be to expose the underlying `Queue.declare` future somehow. Obviously it would be possible to 'manually' call `Queue.declare` but then you also have to manually take care of all the [setup in Channel](https://github.com/mosquito/aio-pika/blob/master/aio_pika/channel.py#L195).",,38,{}
2624,PullRequestReviewCommentEvent,2017-06-21 13:57:12+00:00,69458400,mosquito/aio-pika,160652,connec,,,created,45440224,7f44c9a29deb057620c356e6f3d0ac17f3c234a4,False,"Actually, given the attempt of the library to have a `Queue` abstraction I think storing them on the `Queue` makes the most sense (especially since there's no way of creating a `Queue` except by `channel.declare_queue`). They could perhaps be renamed to `last_message_count`/`last_consumer_count` or something, to make it clear that the values may be out of date.",,38,{}
2759,PullRequestReviewCommentEvent,2016-12-29 09:39:58+00:00,13423891,softvar/json2html,3378634,muellermichel,,,created,14647796,e265e921f59d00382588e6799b118232843e387d,False,Fine by me ;),,21,{}
2848,PullRequestReviewCommentEvent,2016-11-16 12:26:28+00:00,1938370,Mottie/tablesorter,136959,Mottie,,,created,8804620,b01a0368c075268068cf180043f4b21663dda9d7,False,This needs to be changed to `if ( lockHead && primaryRow ) {`,,1312,{}
2903,PullRequestReviewCommentEvent,2015-05-18 11:20:41+00:00,5879214,berkerpeksag/astor,26338,berkerpeksag,,,created,,ea91154693853940a31387a7a501f02fd57d3f58,False,"Just a style suggestion:

```py
self.indentation -= 1  # add a space before ""1""
```",,32,{}
2906,PullRequestReviewCommentEvent,2018-05-14 05:45:28+00:00,5879214,berkerpeksag/astor,4988740,radomirbosak,,,created,119699071,1ea4e13d713255453afcafcd62a83807f15ad339,False,That sounds useful. What should be the function's name?,CONTRIBUTOR,102,{}
2932,PullRequestReviewCommentEvent,2015-12-03 21:07:36+00:00,14006067,darcymason/pydicom,51059,cancan101,,,created,,bfcc2e7e1d5e5286687acc13ee4ba41f4ee157d3,False,"This part sounds odd to me:
>This requires us to know the original encoding of the file, which we can only guess, as far as I am aware. This is why we need to try a bunch of codecs. Ideally we would be able to slecet the appropriate codec directly, but I don't know how to do that.

>We also need to specify the special surrogate error handler since some bytes have no corresponding unicode character and this would result in an exception under normal conditions.

Is there no way to get the swagger wrapper to return a byte array on python3?",,232,{}
3161,PullRequestReviewCommentEvent,2018-05-21 19:55:07+00:00,56998522,skorokithakis/catt,297498,marcosdiez,,,created,121925380,9a87bae123a2417a532be458d0c054f2e16d53b4,False,I did not like the change either on `CastStatusListener` but either we leave things as is or we patch `DashCast` to behave as expected. Race conditions are must always be avoided because debugging them is a *real* pain. My vote is to do nothing and push the merge button.,CONTRIBUTOR,102,{}
3191,PullRequestReviewCommentEvent,2018-08-26 21:16:24+00:00,8292338,ultrabug/py3status,1177900,maximbaz,,,created,149550735,35c5933e4f36131c8874b90c00f4be01cacf9dd2,False,"Exactly, yeah that's what I wanted, thanks",CONTRIBUTOR,1458,{}
3205,PullRequestReviewCommentEvent,2018-03-17 15:50:59+00:00,8292338,ultrabug/py3status,852504,lasers,,,created,104770058,f4245722ca29ea966d4371324ca1188432f61a6b,False,Now we know this. We can keep this as-is. :-) ,CONTRIBUTOR,1310,{}
3206,PullRequestReviewCommentEvent,2017-10-10 05:22:27+00:00,8292338,ultrabug/py3status,17767357,igorgrebenkov,,,created,68169255,a5e18d838a3620fcb6a2be947247fd72e54896a1,False,Done. ,NONE,1068,{}
3213,PullRequestReviewCommentEvent,2017-10-22 12:19:29+00:00,8292338,ultrabug/py3status,474389,ultrabug,,,created,71031614,f422e7c96a96706e78356f7247ce65db934884c0,False,"we expect files here but we give folders as examples, please adjust this",OWNER,1068,{}
3215,PullRequestReviewCommentEvent,2018-02-08 16:08:01+00:00,8292338,ultrabug/py3status,10179652,AnwariasEu,,,created,95131992,39b222861653a6b6ff2a6959cf01c220bbfec6bb,False,Addressed in 53afb9b.,CONTRIBUTOR,1275,{}
3225,PullRequestReviewCommentEvent,2016-05-09 08:59:00+00:00,8292338,ultrabug/py3status,56311,tobes,,,created,,91b080ed502d104076162795432b4e89ae958d0e,False,This should be either a) removed or b) reworded and moved into the main body of the docstring.,,292,{}
3237,PullRequestReviewCommentEvent,2016-03-18 13:43:23+00:00,8292338,ultrabug/py3status,474389,ultrabug,,,created,,3ea249bd09d2e1780133a3149db7b3bf97faefab,False,"okay, it sounds reasonable, thanks",,203,{}
3434,PullRequestReviewCommentEvent,2018-08-20 11:17:19+00:00,27930623,dgasmith/opt_einsum,8982598,jcmgray,,,created,147600035,560726e17da36cfb80cad355860fe876faa7ee8a,False,Could these just be explicit ``global`` variables? Or does the list functionality enable nested ``sharing`` with different caches or something?,COLLABORATOR,43,{}
3435,PullRequestReviewCommentEvent,2018-08-20 18:54:59+00:00,27930623,dgasmith/opt_einsum,8982598,jcmgray,,,created,147776795,560726e17da36cfb80cad355860fe876faa7ee8a,False,Ah ok! I hadn't realised that about ``id``.,COLLABORATOR,43,{}
3464,PullRequestReviewCommentEvent,2016-03-08 02:43:57+00:00,49332088,guykisel/inline-plz,6760519,guykisel,,,created,,10a0cc718762e8789d5a7ebefbe7e5567fbdb800,False,maybe only run this if `self.prefix` is truthy? (in case someone wants to disable prefixes entirely),,98,{}
3481,PullRequestReviewCommentEvent,2018-05-02 19:30:43+00:00,106929485,ikalchev/HAP-python,25887324,ikalchev,,,created,117036694,a9867056fbea86e761988068d2da616c371188f1,False,"Okay, then I am merging this and will try to test the backwards compatibility.",OWNER,102,{}
3487,PullRequestReviewCommentEvent,2018-06-12 17:48:19+00:00,66575381,jamiebull1/geomeppy,5149279,lymereJ,,,created,128077277,06b75b1c17448f92bc2a64cfb114f9d4c2e654ae,False,Will do!,NONE,31,{}
3534,PullRequestReviewCommentEvent,2017-11-11 17:21:22+00:00,67834502,lk-geimfari/mimesis,11466676,faheel,,,created,75937093,42542027bab41b1b16cc3a543c8437e123e85cd8,False,"Instead of checking whether every number in the returned list is a prime, this simply checks that the size of the list = number of primes in the given range (which is 1-999 by default).",CONTRIBUTOR,282,{}
3626,PullRequestReviewCommentEvent,2016-02-20 11:59:53+00:00,7379566,picklepete/pyicloud,6997994,vjgaero,,,created,,1885b220e1918c97e46ba87a9c17aab226aef59e,False,what feature are you talking about? I downloaded this version and was able to pull all image names fine.,,59,{}
3737,PullRequestReviewCommentEvent,2015-09-30 18:32:01+00:00,8685799,DRMacIver/hypothesis,785983,kxepal,,,created,,e8aac4587a937f83f33394bf4153e98769bdc89b,False,"No, they are not implied, but applicable.",,155,{}
3831,PullRequestReviewCommentEvent,2016-08-26 13:13:37+00:00,3727523,cyberdelia/metrology,453110,misiek08,,,created,,395e05e0ba22d4d01c55eb7201be3ee357bed80e,False,I don't understand this question. If you ask why I import all instruments - it's because reporter gets all data as instruments objects and reporter class need to know what are they and extract values from them correctly.,,26,{}
3886,PullRequestReviewCommentEvent,2017-07-19 15:18:35+00:00,35960513,fabianvf/python-rake,19422700,justinkterry,,,created,50943119,14ef7d0f1e2c01008b70fad1535e2c88e9b5ee8b,False,done,,13,{}
3916,PullRequestReviewCommentEvent,2018-07-25 08:16:09+00:00,84045805,jendrikseipp/vulture,213955,jendrikseipp,,,created,140205063,68e6b379e78b5a70302d54ae7018958cc291b286,False,"Can you split this into four tests, please?",OWNER,142,{}
3919,PullRequestReviewCommentEvent,2017-06-14 09:14:03+00:00,84045805,jendrikseipp/vulture,213955,jendrikseipp,,,created,43959342,1d89db0bcf4161196bc2682e89fe52ef29af1db0,False,"I think we need to change the way vulture is installed. Currently, only the main script is installed. Since no directory is created for vulture, we can't add the stdlib.py file anywhere. I'm not sure what the best solution is to this problem. I'll do some reading, maybe you have an idea?

https://docs.python.org/3/distutils/setupscript.html#installing-package-data
https://docs.python.org/3/library/pkgutil.html#pkgutil.get_data
https://stackoverflow.com/a/5899643",,50,{}
4038,PullRequestReviewCommentEvent,2018-06-02 02:11:43+00:00,70314805,kyuupichan/electrumx,3319176,kyuupichan,,,created,125351891,4602dc47e42e9f61606e21e6f906e266eef640c2,False,"I assume this means an empty array?  Or does it mean missing?  Or does it mean either?  Please clarify.

Please refer to the parameter as ""payees"" as that is what you named it, not ""payee"".",OWNER,474,{}
4271,PullRequestReviewCommentEvent,2016-09-28 06:47:18+00:00,776374,alecthomas/voluptuous,2357025,tusharmakkar08,,,created,1875810,e6b1b31a90ea5bf37ed46d1ef497b02c590166e4,False,"@nareshnootoo  Let's add a flag which tells what to yield, where default being the string since we are giving input as string only. ",,207,{}
4402,PullRequestReviewCommentEvent,2015-12-01 01:05:20+00:00,24561828,gunthercox/ChatterBot,2030578,gunthercox,,,created,,f3ce77be4781c37b48566fe381b2ff8d92c50ae9,False,@DarkmatterVale I agree with kevin on this.,,80,{}
4520,PullRequestReviewCommentEvent,2018-03-30 06:04:18+00:00,83989500,rytilahti/python-miio,6697940,houndci-bot,,,created,108268838,6c18e73d5167a4c2f61c40952fcd5f89006858db,False,line too long (189 > 100 characters),NONE,287,{}
4665,PullRequestReviewCommentEvent,2016-04-27 10:25:47+00:00,39780739,adamchainz/pretty-cron,857609,adamchainz,,,created,,7bc465aa8ff19aaab5fb7ae512fff8e0cde04c35,False,ditto plz remove,,15,{}
4766,PullRequestReviewCommentEvent,2015-06-03 14:36:47+00:00,10102813,lepture/flask-oauthlib,290496,lepture,,,created,,5f70d04510c0d3573107506989c0e18fe78c8333,False,Actually you should use a list.,,207,{}
4890,PullRequestReviewCommentEvent,2018-05-27 12:00:39+00:00,30379674,adamchainz/django-mysql,857609,adamchainz,,,created,123581605,54ffd053c0b81b749b2ad8f47956d3668696ae29,False,needs a rebase,OWNER,479,{}
4913,PullRequestReviewCommentEvent,2016-09-07 07:58:00+00:00,403432,batiste/django-page-cms,1388,greut,,,created,,4f16c6bd49137a75846016fa990b2853a42a4c91,False,`import pages` from `setup.py` won't work because you're trying to install `pages`. It's a 🐔 and 🍳 issue.,,151,{}
4981,PullRequestReviewCommentEvent,2018-07-25 12:55:42+00:00,139454635,hill-a/stable-baselines,1973948,araffin,,,created,140297127,9eb98e913846873c09df22b16789334fea140cb3,False,To be changed before PR to OpenAI,COLLABORATOR,1,{}
5024,PullRequestReviewCommentEvent,2018-08-12 02:38:42+00:00,143541475,kylebarron/stata_kernel,15164633,kylebarron,,,created,145461561,732d65bfddb8535909fa674b455618c3374f4a32,False,Ah yes of course.,OWNER,49,{}
5025,PullRequestReviewCommentEvent,2018-08-21 02:53:38+00:00,143541475,kylebarron/stata_kernel,4219197,mcaceresb,,,created,147889450,7688cd23a0fa86a64c35fdbdf3cd9d6c9b31d2ea,False,"Removes a config option. Namely I use it to remove graph_width and graph_height, which in effect resets them to their defaults.

As the function name implies, it is unsafe in that it does not check for whether the config should be removed. Careful internal use only!  ",CONTRIBUTOR,73,{}
5217,PullRequestReviewCommentEvent,2016-09-29 04:44:47+00:00,51859514,The-Compiler/pytest-xvfb,10521687,mandeep,,,created,2071656,eb8f9b40f78a3bb89d318645fc9bb867560fbe5d,False,"Good points. I agree with the warning statement change, and I completely forgot about other operating systems so I'll add a condition with sys.platform. Should I also remove the warning for unset displays since the tests will fail anyway? Regarding --no-xvfb, the warning does not print if --no-xvfb is given as a flag as it's captured by the first if statement.",,8,{}
5235,PullRequestReviewCommentEvent,2017-10-25 12:32:15+00:00,70442036,aurzenligl/pytest-logger,2393555,farquet,,,created,71841617,666aa669bfaec4833c92e99503d33590bfff73ce,False,Positional arg since 666aa66. Assuming it has been properly instantiated beforehand.,NONE,8,{}
5265,PullRequestReviewCommentEvent,2017-02-17 13:44:54+00:00,53352663,ecederstrand/exchangelib,8534419,vikramarsid,,,created,22497396,c4486efcf8d943f16caa82d37cd7ce8b9df1a969,False,Excellent!! Thank you.,,76,{}
5363,PullRequestReviewCommentEvent,2016-06-26 19:50:20+00:00,36460783,nitmir/django-cas-server,19940114,codacy-bot,,,created,,2fac47f0b178a7faf2eb039c9c5aecb45eaafb2f,False,![Codacy](https://www.codacy.com/assets/images/favicon.png) Issue found: [Missing class docstring](https://www.codacy.com/app/valentin-samir/django-cas-server/file/2843158151/issues/source?bid=3379014&fileBranchId=3386616#l208),,4,{}
5647,PullRequestReviewCommentEvent,2018-03-22 18:36:40+00:00,77063495,maartenbreddels/ipyvolume,1765949,maartenbreddels,,,created,106249571,c573d410132c2852fa201de20836b457da1a8774,False,gl_Position is set again on line 109 as is vertex_position and vertex_uv.,OWNER,123,{}
5716,PullRequestReviewCommentEvent,2016-06-17 17:35:12+00:00,4479494,serge-sans-paille/pythran,1872390,pbrunet,,,created,,bcd0d3b3fb3c233ca77f2d14f2983c56bc47d26f,False,haha indeed I was the one introducing this struct :) but not in this commit.,,579,{}
5717,PullRequestReviewCommentEvent,2015-12-30 20:40:29+00:00,4479494,serge-sans-paille/pythran,1872390,pbrunet,,,created,,60ab4628f4ea345a6bfbdd30de7d5342192839d5,False,This one is still valid no?,,517,{}
5724,PullRequestReviewCommentEvent,2016-01-04 18:14:36+00:00,4479494,serge-sans-paille/pythran,1872390,pbrunet,,,created,,fcfc2d2a4020aab1bcd264632d1b7ee979641db0,False,Nice trick to save value without attributs :-),,517,{}
5758,PullRequestReviewCommentEvent,2015-03-01 18:23:24+00:00,12420595,CamDavidsonPilon/lifelines,884032,CamDavidsonPilon,,,created,,b2f10be6c698ce717eadb9586eddd1e58c147a70,False,"`iloc` is more defensive than `ix`. If an input duration had `-1`, this value would be in the index, and potentially fail. ",,135,{}
5766,PullRequestReviewCommentEvent,2018-04-17 01:26:33+00:00,28577939,CamDavidsonPilon/lifetimes,884032,CamDavidsonPilon,,,created,112640625,e8d7098edb2b19a5117dc9bedcf1a883f213e585,False,this is a better docstring than the one above - want to copy this up there too?,OWNER,181,{}
5768,PullRequestReviewCommentEvent,2016-04-25 02:29:03+00:00,28577939,CamDavidsonPilon/lifetimes,884032,CamDavidsonPilon,,,created,,0b980dace9e20b41f0bc40afbf441e498a29a308,False,"ditto above, can you avoid `len` here?",,57,{}
5785,PullRequestReviewCommentEvent,2016-09-15 10:55:11+00:00,38002454,SpotlightKid/python-rtmidi,5719151,SpotlightKid,,,created,,80b450706ad6f1ada8bc51404b8364a458b2084c,False,"I admit that I've broken a few PEP-8 rules here myself.

Normally in projects I have flake8/pycodestyle intergrated into tox, but unfortunately not in this project, since the main part of the code is not Python but Cython code. I'll have to configure flake8 in `setup.cfg` to check only the correct files. I'll open another ticket for this.",,9,{}
5805,PullRequestReviewCommentEvent,2016-03-08 06:39:29+00:00,48640313,codalab/codalab-worksheets,435384,percyliang,,,created,,923bd43afc7872b9c811a9b84b6aab7822d86132,False,fix indentation,,115,{}
5814,PullRequestReviewCommentEvent,2015-12-12 19:02:12+00:00,27728976,eisensheng/pytest-catchlog,300048,s0undt3ch,,,created,,d679d9f82940956be7a283519c13ae9342de18df,False,"Sure, I'll rename.",,20,{}
6002,PullRequestReviewCommentEvent,2017-10-08 13:42:40+00:00,56568022,eht16/python-logstash-async,617017,eht16,,,created,67857553,7835aa0b6683d15c3adb8414064b2e73e909be61,False,"Correct me if I'm wrong: I think here is the pending_delete marker missing, like `event['pending_delete'] = True`, otherwise events will never be marked as pending_delete.

While this marker is less relevant for the in-memory cache, I think it would make sense to maintain it here anyway since also the rest of the in-memory cache maintains it as well and it should not be that relevant on performance.",OWNER,12,{}
6020,PullRequestReviewCommentEvent,2018-01-25 20:19:50+00:00,9051843,linsomniac/python-memcached,59039,cactus,,,created,91658124,e1f72daabc011b83a8debb86e9e2b7ff6307a41c,False,"Note that adding this new flag breaks environments where 1.58 and 1.59 are running mixed (accidentally or otherwise). Might have been nice to point this out in the release notes, or maybe even bump the major version.",CONTRIBUTOR,135,{}
6046,PullRequestReviewCommentEvent,2017-12-13 09:00:26+00:00,68146968,vimalloc/flask-jwt-extended,425499,beenje,,,created,83097882,bfb1bc0a5aa4c88d190758d575ea34727b901606,False,"Yes that might be more intuitive.
JWT_ACCESS_TOKEN_EXPIRES currently must be a datetime.timedelta: https://github.com/vimalloc/flask-jwt-extended/blob/master/flask_jwt_extended/config.py#L154 
So there is some code impact, but that should be minor.
",NONE,106,{}
