,type,created_at,repo_id,repo_name,actor_id,actor_login,org_id,org_login,pr_review_comment_action,pr_review_comment_id,pr_review_comment_commit_id,pr_review_comment_site_admin,pr_review_comment_body,pr_review_comment_author_association,pr_number,pr_review_comment_reactions
5181,PullRequestReviewCommentEvent,2018-07-26 09:45:17+00:00,61572326,DataDog/dd-trace-py,1560405,palazzem,365230,DataDog,created,140651565,6a4cf39c37b34d0e8f73da8398c3a311be925556,False,I don't think we need this level of indirection. Let's move it in `_cmd` because it's not used in other parts.,MEMBER,511,{}
5194,PullRequestReviewCommentEvent,2015-08-03 12:23:36+00:00,23924195,Lasagne/Lasagne,629706,f0k,11752110,Lasagne,created,,739dfef1c7f4534cbafce51a4f284e33f41f6290,False,"Yes! (And I don't plan to change that as part of this PR, sorry... it's already taking too long.)",,344,{}
5199,PullRequestReviewCommentEvent,2015-08-13 10:46:52+00:00,23924195,Lasagne/Lasagne,629706,f0k,11752110,Lasagne,created,,adda16bd52fa5aac0d1dbe34b9bb4fc89def0626,False,"You removed an empty line here, please add it back for consistency!",,373,{}
5249,PullRequestReviewCommentEvent,2017-07-07 06:56:19+00:00,70260962,Tubular/sparkly,7946540,mantzouratos,2808498,Tubular,created,48531447,3a87f101ba72291f25b5c598ff7f604e6012ec9d,False,"changed it quite a bit, and added more explanations. hopefully it's cleaner now!",,45,{}
5263,PullRequestReviewCommentEvent,2017-11-23 16:12:32+00:00,91356408,allenai/allennlp,3508113,pdasigi,5667695,allenai,created,78761231,9fee3d0c3f3ba0b6f3eb070dcd3c70e8f26667f6,False,Done.,CONTRIBUTOR,515,{}
5267,PullRequestReviewCommentEvent,2017-11-13 00:21:27+00:00,91356408,allenai/allennlp,16001974,DeNeutoy,5667695,allenai,created,75978362,e7ff586b474ea4194a34dc6b4ee3b059e752c1aa,False,"Unfortunately we can't distribute this data. I've modified the paths in the same way as we have done for the SRL model though, so we can add some instructions on the website.",CONTRIBUTOR,465,{}
5269,PullRequestReviewCommentEvent,2018-02-20 17:25:47+00:00,91356408,allenai/allennlp,16001974,DeNeutoy,5667695,allenai,created,97916015,8b93ee4e3c252e7582b7309c78b657a17bca4d8b,False,Oh yeah.... I was wondering about this from your comment in the previous PR which I ignored because I hadn't thought of this. ,CONTRIBUTOR,895,{}
5273,PullRequestReviewCommentEvent,2017-10-10 13:33:52+00:00,91356408,allenai/allennlp,3508113,pdasigi,5667695,allenai,created,68280858,ebcc8a503b65215d249111c0b832ebff945614fc,False,"`ModelTestCase.setUpModel` expects this field to be set: https://github.com/allenai/allennlp/blob/master/allennlp/common/testing/model_test_case.py#L30

Also, I thought it would be nice to keep things consistent across dataset readers.",NONE,366,{}
5277,PullRequestReviewCommentEvent,2018-01-04 21:26:23+00:00,91356408,allenai/allennlp,1308313,joelgrus,5667695,allenai,created,86763294,6533209e70479748f7117683788e98152072ff31,False,that's a good idea,CONTRIBUTOR,660,{}
5279,PullRequestReviewCommentEvent,2017-08-03 17:56:18+00:00,91356408,allenai/allennlp,16001974,DeNeutoy,5667695,allenai,created,54173417,d1b6b57db8e70a8fccb3286e03395606283da11d,False,Is there a need for these to be in the global scope? Can they be class variables?,,75,{}
5285,PullRequestReviewCommentEvent,2018-06-19 21:30:02+00:00,91356408,allenai/allennlp,7272031,nelson-liu,5667695,allenai,created,130167431,681e126f8d1a78619ecf8c538fa44968910748fa,False,"I'm pretty sure `in` on a `list` is linear time --- if we're doing this anyway, it might be helpful to just iterate through the lines explicitly and point out the specific line a user might want to look at?",MEMBER,1397,{}
5286,PullRequestReviewCommentEvent,2018-01-29 21:55:08+00:00,91356408,allenai/allennlp,3291951,matt-gardner,5667695,allenai,created,92371448,43325169f0a44481b3cf5d31d66ae38426864f5c,False,Done.,MEMBER,724,{}
5298,PullRequestReviewCommentEvent,2018-01-11 16:19:33+00:00,35690635,astropy/regions,143715,keflavich,847984,astropy,created,88217981,c2756145086503d32a08d8d1946a3573cb3cfea6,False,"yeah, that was wasteful.  New version is much more concise.",COLLABORATOR,100,{}
5309,PullRequestReviewCommentEvent,2016-06-20 15:29:27+00:00,2640766,astropy/photutils,498688,hamogu,847984,astropy,created,,94142524a16148532723a192e9944f66a4039e8f,False,There is some stuff in here that's left over form a git merge.,,358,{}
5323,PullRequestReviewCommentEvent,2017-07-13 08:45:24+00:00,93721432,awslabs/sockeye,683589,davvil,3299148,awslabs,created,49714152,6ba62f096ca5598726257188ce9514d8387061b3,False,"Wrt. 2. If I understand it correctly, this not really a new encoder but a new ""embedding"" if you want. I.e. we could apply it to RNNs, transformers or other architectures.",,67,{}
5325,PullRequestReviewCommentEvent,2017-12-05 12:20:46+00:00,93721432,awslabs/sockeye,2027990,fhieber,3299148,awslabs,created,81159724,9688991193b4e7086aacea1fa414dd836fb10493,False,"scores_accumulated is `(batch*beam,)`; why do you need the second dimension here?",CONTRIBUTOR,230,{}
5326,PullRequestReviewCommentEvent,2018-08-30 14:54:37+00:00,93721432,awslabs/sockeye,2027990,fhieber,3299148,awslabs,created,151035747,b6fc030f0051d68530a89adb003036836ba3ac23,False,"- trailing comma
- return type value of inits should be `-> None`",CONTRIBUTOR,518,{}
5327,PullRequestReviewCommentEvent,2017-08-25 12:52:47+00:00,93721432,awslabs/sockeye,2027990,fhieber,3299148,awslabs,created,58642681,081555dc1463b49bbf54e177cd8e7aa14048d360,False,"would remove ""for how""",,120,{}
5334,PullRequestReviewCommentEvent,2018-06-27 14:13:01+00:00,93721432,awslabs/sockeye,2027990,fhieber,3299148,awslabs,created,132451987,3eb79fad9f349edf1b5c444c11b62322f0195890,False,either way there has to be at least one casting because lengths is used as int type and as float type when computing the length penalty.,CONTRIBUTOR,435,{}
5346,PullRequestReviewCommentEvent,2018-05-17 19:32:29+00:00,109059493,awslabs/keras-apache-mxnet,5974205,aaronmarkham,3299148,awslabs,created,121184987,6ea8cea1e416555794437b38c5ff7a0ff2c80956,False,"This is left for the reader's interpretation, and I'm not sure what to think about it. No commentary to assist?",NONE,82,{}
5347,PullRequestReviewCommentEvent,2018-05-15 04:22:48+00:00,109059493,awslabs/keras-apache-mxnet,5974205,aaronmarkham,3299148,awslabs,created,120075555,3c8d340b20730332d454f0b2f2424d24401eb4a4,False,"...format, set the `input_shape` parameter as follows:",NONE,82,{}
5348,PullRequestReviewCommentEvent,2018-03-04 20:05:44+00:00,105830539,awslabs/mxnet-model-server,3403674,sandeep-krishnamurthy,3299148,awslabs,created,101016953,45ae5514c133e57aefbc01cff142144af2058a82,False,should go before checking startswith('['),CONTRIBUTOR,333,{}
5350,PullRequestReviewCommentEvent,2018-04-02 23:21:10+00:00,105830539,awslabs/mxnet-model-server,36211508,vdantu,3299148,awslabs,created,108763691,1533a59fc36c06d1210ec9aff2537f7b4b311687,False,Done,COLLABORATOR,353,{}
5351,PullRequestReviewCommentEvent,2018-03-06 02:07:03+00:00,105830539,awslabs/mxnet-model-server,505258,jesterhazy,3299148,awslabs,created,101397561,9d160902d7c0720f154bdc9632f4884418a8d419,False,Dockerfile.*gpu* ?,CONTRIBUTOR,334,{}
5353,PullRequestReviewCommentEvent,2018-03-06 03:15:57+00:00,105830539,awslabs/mxnet-model-server,36211508,vdantu,3299148,awslabs,created,101407465,9d160902d7c0720f154bdc9632f4884418a8d419,False,Changed this to MXNET_MODEL_SERVER_HOST,COLLABORATOR,334,{}
5360,PullRequestReviewCommentEvent,2017-01-09 19:04:22+00:00,70530854,awslabs/serverless-application-model,22755571,sanathkr,3299148,awslabs,created,15771148,31fb8ba741b1209360d94a47c25960a76b29b4a9,False,"Cool, will change",,44,{}
5376,PullRequestReviewCommentEvent,2018-08-01 13:31:32+00:00,26516210,certbot/certbot,5235109,joohoi,17889013,certbot,created,142376316,ee86019d2a15f4c2b4c284b5050f06ebf3addfa7,False,"Yes, not adding the path to `existing_paths` is the reason. And you are right, it is a bug in our TLS-SNI validation. However I'm pretty confident that it doesn't manifest itself in any way in case of TLS-SNI, as the validation `ServerName` is very unlikely matching anything we search.",MEMBER,6268,{}
5506,PullRequestReviewCommentEvent,2016-02-02 20:56:54+00:00,33653601,jupyter/notebook,151929,minrk,7388996,jupyter,created,,bb50a2182f8d9cb1cebee008173822c5bee69944,False,"these duplicate blocks can be removed by making the function a variable:

```python
install = install_nbextension_python if self.python else install_nbextension
```",,879,{}
5508,PullRequestReviewCommentEvent,2015-12-11 17:42:25+00:00,33653601,jupyter/notebook,335567,Carreau,7388996,jupyter,created,,5a266cd845adddc384d03509a2eede3149fac651,False,done.,,841,{}
5513,PullRequestReviewCommentEvent,2015-05-23 17:19:56+00:00,33653601,jupyter/notebook,3292874,jdfreder,7388996,jupyter,created,,30102f278072179225244a742c7296c995593600,False,Unused,,60,{}
5533,PullRequestReviewCommentEvent,2017-02-02 00:47:54+00:00,33653601,jupyter/notebook,2096628,blink1073,7388996,jupyter,created,19694801,fde1c6e26b14dc000ccf41d8099749a05195270e,False,User*,,2108,{}
5566,PullRequestReviewCommentEvent,2016-08-23 15:39:20+00:00,40684033,mozilla/sops,45590,oremj,131524,mozilla,created,,a53bfab82a494a653c8c120750e48ee12499eb1f,False,"I did this in decrypt to go, so I could convert map[interface{}]interface{} in to a struct, without manually assigning the fields. It was more of a quick hack.",,82,{}
5569,PullRequestReviewCommentEvent,2016-08-23 01:07:12+00:00,40684033,mozilla/sops,415617,jvehent,131524,mozilla,created,,c522a7e93f4b231185918b27cfe442a656c2f55f,False,"I must be missing something... why don't you just assign `data = encoded[""sops""]` ?",,82,{}
5610,PullRequestReviewCommentEvent,2016-04-20 00:21:42+00:00,8463294,mozilla/treeherder,419924,camd,131524,mozilla,created,,7d8f86942521e80d83388b5c9b5db517b04fde1b,False,but SOOO much better with the angular usage!  Thank you!!  :),,1374,{}
5619,PullRequestReviewCommentEvent,2017-02-23 16:28:14+00:00,8463294,mozilla/treeherder,20569,wlach,131524,mozilla,created,23520566,e46a2731bac46f5f7b3c474998d1a4be1ab42a89,False,"LOL no, let's not add this monster back. ;)",,2089,{}
5635,PullRequestReviewCommentEvent,2015-07-23 17:52:12+00:00,8463294,mozilla/treeherder,20569,wlach,131524,mozilla,created,,ea7195e3d33dde7fa8dcc0e5473edb15818fb236,False,Remove this line.,,792,{}
5638,PullRequestReviewCommentEvent,2018-07-02 10:44:25+00:00,8463294,mozilla/treeherder,501702,edmorley,131524,mozilla,created,133577004,59ee1e76fe90903ced5e40163e51f442d86360e5,False,"This comment need to be slightly higher up, above the `security.W019` line and combined with the comment there.",MEMBER,3684,{}
5640,PullRequestReviewCommentEvent,2015-06-12 16:43:29+00:00,8463294,mozilla/treeherder,3660661,tojonmz,131524,mozilla,created,,baf75b65ff2661fe8bcf0e026926d1b4ff883024,False,I wonder if we should use `thDateFormat` similar to what we do [here](https://github.com/mozilla/treeherder/blob/29a704cc907ec8a64be02dc38d6bff5f555b5771/ui/plugins/controller.js#L223-L231) so the format is consistent with the rest of treeherder.,,624,{}
5643,PullRequestReviewCommentEvent,2017-12-12 21:32:47+00:00,8463294,mozilla/treeherder,3660661,tojon,131524,mozilla,created,82989852,43989e4411eda8fdf10b70f4ab7ee900cc3c994d,False,`auto` and `initial` also work if you have a preference.,CONTRIBUTOR,3033,{}
5650,PullRequestReviewCommentEvent,2018-04-18 19:35:44+00:00,70578420,mozilla/mozilla-django-oidc,26739,peterbe,131524,mozilla,created,113362209,12fdf269be54dcd32b9c529fb8d00280f9477a5d,False,nit: The sentence ends with a ` ...` instead of a regular `.`.,COLLABORATOR,179,{}
5670,PullRequestReviewCommentEvent,2017-11-30 22:58:06+00:00,37496521,nteract/nteract,836375,rgbkrk,12401040,nteract,created,80359268,8c31ce544db11ccbcbd04925dfcb74300e5cbf8e,False,This should be deleted.,OWNER,2119,{}
5676,PullRequestReviewCommentEvent,2016-12-26 21:06:43+00:00,37496521,nteract/nteract,13285808,lgeiger,12401040,nteract,created,14417070,7c3dafd25e0a6636331566ad43f5f77f567751bc,False,"I'm not sure if we really need them for nteract.
I guess these are the dependencies for `canvas`. Since `canvas` is a optional dependency it only generates a warning that can be safely ignored.",,1299,{}
5682,PullRequestReviewCommentEvent,2016-12-26 21:27:52+00:00,37496521,nteract/nteract,13285808,lgeiger,12401040,nteract,created,14417496,7c3dafd25e0a6636331566ad43f5f77f567751bc,False,"I guess the maintainer field only supports strings.

You could use `nteract <nteract@sharklasers.com>` instead of the full object here.",,1299,{}
5686,PullRequestReviewCommentEvent,2018-03-13 16:36:16+00:00,37496521,nteract/nteract,836375,rgbkrk,12401040,nteract,created,103512786,4648c611714c4b098e16c6a716a2be469356e3fa,False,"Now that we have dedicated content refs and know that if we're working on a notebook document that the focused cell is unique to that notebook document. Since there are so many occurrences where the callee to an action creator was getting the focused cell then dispatching an action, I'd really like to simplify this to state the intent as -- if the id isn't set, assume it's the focused cell.",OWNER,2673,{}
5687,PullRequestReviewCommentEvent,2017-02-20 06:13:50+00:00,37496521,nteract/nteract,1857993,captainsafia,12401040,nteract,created,22693550,4972a5d1f71be7058c2f244552e5f0d67fbab656,False,It was both ExecuteResult and DisplayData.,,1489,{}
5702,PullRequestReviewCommentEvent,2017-02-08 05:27:41+00:00,37496521,nteract/nteract,836375,rgbkrk,12401040,nteract,created,20685336,d3bbd73e1405d497c1458c1e2720e95a3448c9d8,False,Yeah I was thinking that since we're doing webpack anyways we could make sure the base assets are loaded first. The ones that are gunked up in the little prototype I showed was only the theme css (which can change).,,1432,{}
5714,PullRequestReviewCommentEvent,2017-06-03 01:17:45+00:00,37496521,nteract/nteract,13285808,lgeiger,12401040,nteract,created,41909389,03689a64bddcb1ad2d2acefa68dd8dfeb7f72c83,False,I though about using ES6 Maps here but decided it would be best to use objects since the kernels also send objects instead of Maps. This way we can get rid of one extra conversion/parsing step in commutable.,,1726,{}
5720,PullRequestReviewCommentEvent,2018-05-12 14:07:40+00:00,96454557,nteract/papermill,1863892,MSeal,12401040,nteract,created,119627330,a23c769dcc74544aad792e894b83db0bd0c1a9c3,False,"Yep. I don't know if we use it much, but in theory you could read another notebook and see how it got parameterized easily this way",CONTRIBUTOR,137,{}
5724,PullRequestReviewCommentEvent,2017-09-27 18:34:47+00:00,96454557,nteract/papermill,836375,rgbkrk,12401040,nteract,created,65643685,9da06a6df77f5c4a3b23bf76970eab1038c3418e,False,Classic indents,OWNER,41,{}
5725,PullRequestReviewCommentEvent,2018-01-10 22:03:24+00:00,96454557,nteract/papermill,836375,rgbkrk,12401040,nteract,created,87995629,789b9f210c7e457bb46a3730a9969186233d0988,False,"Side note, since codecov shows me coverage info inline on GitHub -- this section of code is not covered. May want some basic tests here.",OWNER,83,{}
5732,PullRequestReviewCommentEvent,2015-10-20 23:11:32+00:00,9252533,numenta/nupic,2166111,breznak,1039191,numenta,created,,16683bbf2b713c66f1ee63561f789494c0db6984,False,it's a TEMP change to see if the tests are passing. I've mentioned that in a comment. Waiting if Scott can help with CAPNP for the Boosting class,,2620,{}
5737,PullRequestReviewCommentEvent,2016-04-21 23:04:24+00:00,9252533,numenta/nupic,326528,oxtopus,1039191,numenta,created,,81611c59aa8449f9a53901083a3b47ce040b1f9f,False,"What is this function, and why is it implemented as `pass`.",,3095,{}
5763,PullRequestReviewCommentEvent,2017-04-11 18:41:40+00:00,16366081,numenta/nupic.core,2166111,breznak,1039191,numenta,created,32191277,85fe8c12a2667822451c4cff3db2ba9c81e990ba,False,TODO please review after me,,1268,{}
5764,PullRequestReviewCommentEvent,2017-03-03 20:42:46+00:00,16366081,numenta/nupic.core,1441066,vitaly-krugl,1039191,numenta,created,25065934,c4742481389d02e7095049b8ae403c8dae879ba7,False,"Why do we need `PyArray_ITEMSIZE(x) != sizeof(float)` in addition to `PyArray_ISFLOAT`? I expected `PyArray_ISFLOAT` to be sufficient.

Also,  the message below is `Expected x_vector dtype to be numpy.float32`, but the check `PyArray_ITEMSIZE(x) != sizeof(float)` seems to be against the plain C float, not ""numpy.float32"". What guarantee is there that `sizeof(float)` on a particular architecture matches size of ""numpy.float32""?",,1238,{}
5774,PullRequestReviewCommentEvent,2016-04-30 00:17:29+00:00,16366081,numenta/nupic.core,239726,scottpurdy,1039191,numenta,created,,75a182132f9c223bdca5f7611b4ef1caa7817e73,False,Oops we were talking about two different things I think. If you want to keep the README from the csv project then put it in the same directory as the `csv.h` file. I was thinking of just having `external/common/includes/README.md` be a file that we write that says where `csv.h` came from (with a URL). But I think you are right that the csv.h README.md would be good to keep since it has usage info and such so `external/common/includes/fast_cpp_csv_parser/README.md` would be a good spot for that.,,890,{}
5827,PullRequestReviewCommentEvent,2017-11-06 15:23:27+00:00,73328905,pytorch/vision,687194,alykhantejani,21003710,pytorch,created,74449710,3c25008ca7b43438f4d467d228a601fdc07f19c0,False,"can you remove the ""translate it by"" part from the docstring?",COLLABORATOR,303,{}
5834,PullRequestReviewCommentEvent,2018-03-21 08:44:24+00:00,51397392,pytroll/satpy,16011037,stickler-ci,13004956,pytroll,created,105635805,7a7b66639f11b44e8a73df9a36cb4796b2b693d0,False,E127 continuation line over-indented for visual indent,NONE,237,{}
5880,PullRequestReviewCommentEvent,2015-03-06 12:14:22+00:00,5888353,spotify/luigi,4609807,gpoulin,251374,spotify,created,,0eaa7854e1d2ea1f518d4ac7a89ca02a5e6117da,False,Can you put the `url_prefix argument` after `connect_timeout` to be backward compatible.,,820,{}
5885,PullRequestReviewCommentEvent,2016-03-31 02:48:10+00:00,5888353,spotify/luigi,294349,Tarrasch,251374,spotify,created,,54181db1e5aa042f7383716ef52b2aea33f45258,False,Can you add a `#`-comment of when this  code path is supposed to happen?,,1614,{}
5893,PullRequestReviewCommentEvent,2017-02-15 13:32:44+00:00,5888353,spotify/luigi,7432199,dlstadther,251374,spotify,created,21998752,c5d156aa58a31a0ddcf00608700cb258b25ccf42,False,"`lib/URI/1.18.2/URI.js`

one too many `/`",,2033,{}
5917,PullRequestReviewCommentEvent,2018-05-16 18:59:15+00:00,115427246,spotify/gordon-gcp,3641660,ocsw,251374,spotify,created,120776271,fe15ae7508382ef5941d3be19d3ee122418e1251,False,"Ah.  Checked again.  Actually the http_client is passed in the same way in both.  What _is_ different is that there's a builder class for the enricher.  Long-term, we'll have to pull some of this into gordon core and standardize it.",NONE,19,{}
5947,PullRequestReviewCommentEvent,2017-11-24 06:24:10+00:00,35988711,tox-dev/tox-travis,15092,jayvdb,20345659,tox-dev,created,78836400,ba9f2b28c4c382bcb30a628b58f5d2bebb039f8d,False,The .travis.yml does not have this nonsense.,COLLABORATOR,99,{}
5950,PullRequestReviewCommentEvent,2018-03-04 07:01:43+00:00,3409513,twisted/klein,422703,moshez,716546,twisted,created,100996670,ba900b405a4e6efd646d48ec7f1aaef97cdc8c36,False,"You could take the function definition out of the loop, and use partial here -- I think that looks nicer than the default-args-tricks, and it's not like you're not using partial all over anyway...",CONTRIBUTOR,238,{}
5952,PullRequestReviewCommentEvent,2017-06-27 07:31:12+00:00,3409513,twisted/klein,1382556,Lukasa,716546,twisted,created,46463596,fd3b5950989b4fff93ab7e27c0047cea9205bfc7,False,I think your defensiveness is sensible here: ISO-8859-1 is a reasonable choice. I do think you should add your reasoning to a docstring/comment though.,,181,{}
5969,PullRequestReviewCommentEvent,2018-05-18 18:20:18+00:00,27610253,ubyssey/dispatch,19273530,Rowansdabomb,10091792,ubyssey,created,121523418,17434b00f0162f5093e4e07da2a9f4b1012223ad,False,redundent?,CONTRIBUTOR,785,{}
5981,PullRequestReviewCommentEvent,2018-08-24 16:10:11+00:00,11957229,vertica/vertica-python,15162542,sitingren,10060,vertica,created,149360402,a46010d435ff014d33d5b12d697074709cfc73ea,False,"Please rebase your branch, see instructions in `CONTRIBUTING.md`: https://github.com/vertica/vertica-python/blob/master/CONTRIBUTING.md#step-5-push-and-rebase",COLLABORATOR,219,{}
5993,PullRequestReviewCommentEvent,2018-06-26 13:11:37+00:00,38744670,zalando/patroni,3407345,CyberDem0n,1564818,zalando,created,132010432,7968915ebac77f717a2d05629df85dd006d97fa8,False,"We run more than 400 clusters on k8s managed by Patroni, and we spend a lot of time to find good values for different timeouts.",MEMBER,723,{}
6075,PullRequestReviewCommentEvent,2018-05-17 20:13:17+00:00,124587275,Trick-17/clang-build,20553080,NOhs,24659237,Trick-17,created,121190681,935d5b5fa11f9402c615bd54f34b0acbc3afc067,False,"What is this? If the openMP test does not work, the openMP stuff should be removed from the test cases.",COLLABORATOR,44,{}
6120,PullRequestReviewCommentEvent,2017-08-12 12:29:19+00:00,13258039,aio-libs/aiohttp,1157412,socketpair,7049303,aio-libs,created,55942888,93ceddd9fc0df540f72b4da1bf6f9ed740f379fd,False,OK: #2192 ,,2191,{}
6123,PullRequestReviewCommentEvent,2017-11-27 07:15:58+00:00,13258039,aio-libs/aiohttp,1226121,pfreixes,7049303,aio-libs,created,79078501,9f0626ce35d94c71e08e3772c47fd02752c4726b,False,"IMHO I would prefer to keep the `trace_config` as an explicit argument of the signal handler. Both `trace_config` and `trace_config_ctx` have different purposes. Meanwhile, the first one is the class that allows you configure the signals that would be triggered, the second one is a pure temporary storage used to make the trace of a specific request stateful.

Change in the meaning of creating a new instance? No, I don't think so. Take into account that the pattern that we are allowing having this parameter is the following one

```python
ascync def start(session, trace_config, trace_config_ctx, *args, **kwargs):
    tace_config_ctx.start = session.loop.time()

ascync def end(session, trace_config, trace_config_ctx. *args, **kwargs):
    print(""Total time {}"".format(session.loop.time() - trace_config_ctx.start)
```",CONTRIBUTOR,2560,{}
6166,PullRequestReviewCommentEvent,2018-02-28 16:39:49+00:00,47820197,alphagov/notifications-python-client,5020841,leohemsted,596977,alphagov,created,100136139,3e76d8f5a214b2ae5a2b3cc1e7d0e25b3b0a6311,False,"should this mention that pdf_file is used if provided, else content is used?

and i'd probably push them towards providing a pdf_file over content, because that reduces risk of getting encoding wrong. In fact, is there a requirement to accept base 64 encoded content? the more i think about it the more it feels like it's just an implementation detail",CONTRIBUTOR,99,{}
6179,PullRequestReviewCommentEvent,2016-03-23 01:18:53+00:00,41557383,cloudant/python-cloudant,10552966,emlaver,44642,cloudant,created,,be827cbda13b61a1024377db42807ecfd5fac058,False,Fixed in be827cb.,,120,{}
6180,PullRequestReviewCommentEvent,2016-05-11 14:45:48+00:00,41557383,cloudant/python-cloudant,10698320,ricellis,44642,cloudant,created,,cefd64747f5ea45ef9782f6776f3977edce817ca,False,"Isn't this the `CloudantDatabase` instance where the design document is saved? Might it be a little clearer to say that? This description is accurate, but it doesn't really help a caller much in understanding what database to provide.
",,168,{}
6181,PullRequestReviewCommentEvent,2016-07-22 14:35:19+00:00,41557383,cloudant/python-cloudant,10552966,emlaver,44642,cloudant,created,,22c15e4a2de6c80755c6e1aa61fb6c44f95b9c83,False,Updated in https://github.com/cloudant/python-cloudant/pull/196/commits/22c15e4a2de6c80755c6e1aa61fb6c44f95b9c83#diff-f2994c8b7af6529726f4b4fbdd48e119R594 and https://github.com/cloudant/python-cloudant/pull/196/commits/22c15e4a2de6c80755c6e1aa61fb6c44f95b9c83#diff-f2994c8b7af6529726f4b4fbdd48e119R594,,196,{}
6182,PullRequestReviewCommentEvent,2016-09-27 21:18:50+00:00,41557383,cloudant/python-cloudant,8793303,alfinkel,44642,cloudant,created,1827954,9493d059e3b76663c23b6bc2a1245c355d822c61,False,I would move this line before the `with self.assertRaises...` that way it ensures that the HTTPError is being raised on the call to `.info()`.,,220,{}
6183,PullRequestReviewCommentEvent,2016-04-12 15:43:40+00:00,41557383,cloudant/python-cloudant,8793303,alfinkel,44642,cloudant,created,,f5d6f347b7fefe64dec2b9953bf6bd8678a43236,False,"I suppose if we're going to 100% accurate about what to do now for a developer to ""make a result"" then I think this should read something like this:

```
[BREAKING] Removed the make_result method from View and Query classes.  If you need to make a query or view result now, use ``CloudantDatabase.get_query_result``, ``CouchDatabase.get_view_result``, or the ``View.custom_result`` context manager, or you can use the ``Result`` and ``QueryResult`` classes directly and construct a result object that way.
```",,144,{}
6184,PullRequestReviewCommentEvent,2016-01-04 22:04:02+00:00,41557383,cloudant/python-cloudant,8793303,alfinkel,44642,cloudant,created,,a82235a8a9d60eebc5ba1dbddc284543e7198d9e,False,"I replaced every instance of exception checking with assertRaises in the code that was added/updated in PR #75, PR #77 (this PR), and PR #79.  I also created Issue #80 so that we can circle back and make this change in all of our unit tests.",,77,{}
6208,PullRequestReviewCommentEvent,2017-11-07 15:20:58+00:00,26876372,dateutil/dateutil,3709683,mariocj89,9849410,dateutil,created,74787215,85dc0153e46f5e1831b2bd59e2344e07122881fa,False,"You might be able to add mock using [markers](https://www.python.org/dev/peps/pep-0426/#environment-markers) as well here:
`mock ; python_version < '3.0'` (Try this out, I am just writing in github)",CONTRIBUTOR,499,{}
