,type,created_at,repo_id,repo_name,actor_id,actor_login,org_id,org_login,pr_review_comment_action,pr_review_comment_id,pr_review_comment_commit_id,pr_review_comment_site_admin,pr_review_comment_body,pr_review_comment_author_association,pr_number,pr_review_comment_reactions
11649,PullRequestReviewCommentEvent,2017-05-01 19:43:51+00:00,7137821,cloudtools/troposphere,1056585,acmcelwee,3028687,cloudtools,created,35632132,50a0ab76820cc90f0a705265675a7f13a933bd7d,False,"Yeah, I think there's a mix of validation when it's simple, like in [emr](https://github.com/cloudtools/troposphere/blob/master/troposphere/emr.py#L87-L92), and just a `basestring` in others, so there's not really 100% consistency. IMHO, it's always nice to have early validation, but I can also see the argument that it's more future-proof to let cloudformation be the validator.",,706,{}
11677,PullRequestReviewCommentEvent,2018-01-08 23:55:44+00:00,7209075,pantsbuild/pants,157586,jsirois,3065172,pantsbuild,created,87377598,2934aef1ef82f5234e9eff37542296564aaf218c,False,"Not a super great reason, but docs align and the one usage expects the docs (a list vs a tuple) - it adds this list to another in a list1 + thisList + otherList sandwich.",OWNER,5286,{}
11681,PullRequestReviewCommentEvent,2018-01-12 07:00:49+00:00,7209075,pantsbuild/pants,512764,benjyw,3065172,pantsbuild,created,88392817,493d083bac509d4f95081e8abe12c9f37e9faea6,False,"Gah, I didn't notice it's public API. Will restore it somehow.",CONTRIBUTOR,5312,{}
11684,PullRequestReviewCommentEvent,2017-09-28 18:49:49+00:00,7209075,pantsbuild/pants,1131704,illicitonion,3065172,pantsbuild,created,65962321,d680c4a75ba3e1b8df1e72646bb8091a69d820b2,False,Turns out the deps were actually pretty small. Done.,CONTRIBUTOR,4910,{}
11686,PullRequestReviewCommentEvent,2017-05-09 21:20:17+00:00,7209075,pantsbuild/pants,46740,stuhood,3065172,pantsbuild,created,37158347,245753182b89ae88a6642c2128eec923be5794e0,False,"I don't think it's necessary to defensively make these `@property`s... if you name the underlying fields `self.xml_path` and `self.cause`, it has the same effect, and you can convert it into an `@property` later if you need to.",,4561,{}
11695,PullRequestReviewCommentEvent,2017-01-31 20:45:30+00:00,7209075,pantsbuild/pants,512764,benjyw,3065172,pantsbuild,created,19418555,646814cf6678a1915f521a41f34c97cd908c5b21,False,"Right, but doesn't mixing it into the path have the same result as mixing it into the contents of the file? If you bump the cache_key_gen_version the file will be missing from the new path, so everything will get invalidated. 

I guess if you then demote the cache_key_gen_version back to its old value you can get into an inconsistent state, because Pants will find the old file and assume that nothing needs rebuilding, even though the workdir reflects the state of the new cache_key_gen_version.",,4223,{}
11700,PullRequestReviewCommentEvent,2016-12-14 20:24:53+00:00,7209075,pantsbuild/pants,46740,stuhood,3065172,pantsbuild,created,12996299,5380eb1a119fad01e1c2e81f444cae1e57a9af5d,False,"I thought about this a bit more... the idea was that if we switched back to exactly the same inputs as some previous build with zinc (for example), then zinc would quickly do the right thing: which is noop.

On the other hand, clearing the directory regardless as you're doing now is definitely less error prone then ever reusing an existing directory, so I think your change makes sense.

I would still love to see the test updated before landing this though.",,4139,{}
11703,PullRequestReviewCommentEvent,2017-05-12 20:41:40+00:00,7209075,pantsbuild/pants,46740,stuhood,3065172,pantsbuild,created,37939396,bbc7d0248b6b819c4aba758d51ddee09c5397058,False,"> So it must be fixed (and appropriately tested)

Correct.",,4561,{}
11704,PullRequestReviewCommentEvent,2017-08-05 01:10:48+00:00,7209075,pantsbuild/pants,46740,stuhood,3065172,pantsbuild,created,54504161,90a78c9fe6a5e748178ecc7ddb33834bb5f732b4,False,"They are used in the tests, so maybe `testprojects/` instead.

""// TODO: finish this tho""",,4787,{}
11709,PullRequestReviewCommentEvent,2018-07-05 16:04:22+00:00,7209075,pantsbuild/pants,14852634,Eric-Arellano,3065172,pantsbuild,created,134718330,06b0db028a0da65eb1d474a4f2dcc393e6aaa283,False,"This slightly changes the behavior from before. When comparing to non-Revisions, this returns `NotImplemented`, which is the expected behavior. instead of the prior `False`.",CONTRIBUTOR,6067,{}
11715,PullRequestReviewCommentEvent,2017-01-31 06:01:01+00:00,7209075,pantsbuild/pants,1883523,kwlzn,3065172,pantsbuild,created,19248701,d056d777ae444de033a058c776cd2c086098bc17,False,"ah, I had forgot that the ""special"" v2 specs also work in the v1 path and was aiming for v1+v2 compatibility - but this is much cleaner. thx.",,4222,{}
11718,PullRequestReviewCommentEvent,2018-03-10 01:49:58+00:00,7209075,pantsbuild/pants,46740,stuhood,3065172,pantsbuild,created,102835154,ee0aa5af9809d2f688963a53ca47f9c03c9eff57,False,Placing them somewhere more specific rather than less would be my preference... so here is better for now.,OWNER,5575,{}
11719,PullRequestReviewCommentEvent,2018-06-28 21:00:25+00:00,7209075,pantsbuild/pants,1305167,cosmicexplorer,3065172,pantsbuild,created,133018698,5a1665b915c10ae80e696881968959138fc44d42,False,Done in 5a1665b!,CONTRIBUTOR,5943,{}
11735,PullRequestReviewCommentEvent,2018-06-18 22:34:40+00:00,7209075,pantsbuild/pants,1883523,kwlzn,3065172,pantsbuild,created,129757916,9ca74f473252312d65775a677bdea09df5e9c9a1,False,"this call to `allow_builds` here doesn't seem necessary, afaict - since `SourcePackage` is always going to be in the default precedence?",MEMBER,5978,{}
11739,PullRequestReviewCommentEvent,2017-12-15 21:11:06+00:00,7209075,pantsbuild/pants,1883523,kwlzn,3065172,pantsbuild,created,83411539,4f7844983ae8b66c37167ec3ea4cddfe785bdea2,False,"this check is reasonable, but is this a case you've actually seen before? I wouldn't expect this to be possible without seriously non-standard setup.py.",MEMBER,5141,{}
11746,PullRequestReviewCommentEvent,2017-03-24 21:11:55+00:00,7209075,pantsbuild/pants,7378,baroquebobcat,3065172,pantsbuild,created,29009270,56e6846f8560cd0ebfc6f11a9379e03d57464312,False,"I thought that singletons are the only allowed value for that type since we don't allow merges from multiple producers. So, maybe ""Singleton tasks are the only task that can produce a product for a particular type(product)""?",,4369,{}
11749,PullRequestReviewCommentEvent,2018-07-18 19:06:31+00:00,7209075,pantsbuild/pants,46740,stuhood,3065172,pantsbuild,created,138396650,f7a8e6f23700f722f18ae716d7fad21b873e4646,False,"Eek. Sorry. Just looked at the javadocs for this: https://docs.oracle.com/javase/7/docs/api/java/util/zip/ZipEntry.html#isDirectory()

So the boolean isn't really necessary as long as you append a `/` here, and then later check whether it ends with a slash. Sorry!",MEMBER,6094,{}
11753,PullRequestReviewCommentEvent,2018-02-22 10:45:31+00:00,7209075,pantsbuild/pants,1131704,illicitonion,3065172,pantsbuild,created,98519184,0f31fe2a23045aea3d5be0555d76b85076400c72,False,Indeed :) Done,CONTRIBUTOR,5497,{}
11757,PullRequestReviewCommentEvent,2017-07-18 20:09:19+00:00,7209075,pantsbuild/pants,7378,baroquebobcat,3065172,pantsbuild,created,50726371,d4c52274b2deeddaea1962e7b58d4baf2693f32d,False,nit: sort,,4728,{}
11759,PullRequestReviewCommentEvent,2018-02-05 21:36:15+00:00,7209075,pantsbuild/pants,1883523,kwlzn,3065172,pantsbuild,created,93800094,d6dca9c869eed0e6af2e0fd5e96fe0083bcf7e3c,False,"the class name feels like an odd `Address` to use here? it won't be unique, for one - so this likely needs to be generative into some synthetic namespace.",MEMBER,5141,{}
11760,PullRequestReviewCommentEvent,2018-07-13 19:21:49+00:00,7209075,pantsbuild/pants,46740,stuhood,3065172,pantsbuild,created,137159260,9e131451d1104408f524ed7950a0d33cf996858c,False,This usage is a bit confusing to me. Why would we use two method calls rather than `tobytes` or `text_type` or whatever more specific thing is appropriate?,MEMBER,6103,{}
11765,PullRequestReviewCommentEvent,2018-07-12 00:42:54+00:00,7209075,pantsbuild/pants,46740,stuhood,3065172,pantsbuild,created,136469568,672bbe5afa2b613b23967505597c72700a8690ad,False,"...kicked off another travis run to try this out over here, as it seems to work locally: https://github.com/pantsbuild/pants/pull/6102",MEMBER,6101,{}
11769,PullRequestReviewCommentEvent,2018-07-18 23:21:19+00:00,7209075,pantsbuild/pants,1883523,kwlzn,3065172,pantsbuild,created,138475675,9065721b03e69d200121c61e2fb7b9c822304de4,False,the expected values should all be `b'1'` in this test case.,MEMBER,6181,{}
11772,PullRequestReviewCommentEvent,2018-07-30 01:03:26+00:00,7209075,pantsbuild/pants,14852634,Eric-Arellano,3065172,pantsbuild,created,141368661,4c74e713c3cd6bb535b4cb6d1ce95485228ffe62,False,"Sometimes Registrar was being passed an instance, rather than a type. To see a use case of this, add a debugger line 

```python
if inspect.isclass(object_type):
  import pdb; pdb.set_trace()
```

In that case, this will grab the underlying type.",CONTRIBUTOR,6272,{}
11774,PullRequestReviewCommentEvent,2018-05-22 23:15:08+00:00,7209075,pantsbuild/pants,46740,stuhood,3065172,pantsbuild,created,122381943,dd2f42271170f13abc46e68efe8c1187d975764e,False,"I'm not sure this new variant is worthwhile... it seems to add a lot of redundancy around `directory_listing`. Was it necessary in order to account for matches for some reason? If not, might be good to revert it.

In particular, recursion is already handled naturally by `loop_fn`, and so recursing here is redundant.",MEMBER,5769,{}
11798,PullRequestReviewCommentEvent,2017-08-07 17:03:08+00:00,93721432,awslabs/sockeye,363737,tdomhan,3299148,awslabs,created,54715295,e8b9bdc52e0a5df7ae722c57ec48e2945d22856f,False,"I don't have anything elegant, but a t>warmup around the log would work.",,98,{}
11799,PullRequestReviewCommentEvent,2017-07-12 19:03:16+00:00,93721432,awslabs/sockeye,636653,mjdenkowski,3299148,awslabs,created,49587676,6ba62f096ca5598726257188ce9514d8387061b3,False,Right now this is a straightforward implementation of Figure 1 in the paper.  There's some room for optimization if people start using this regularly.,,67,{}
11801,PullRequestReviewCommentEvent,2018-07-31 09:46:20+00:00,93721432,awslabs/sockeye,2027990,fhieber,3299148,awslabs,created,141877352,c4b65d4d1f00a6fa077a394da01142b59598e1fe,False,"True, your are correct. I thought the stop id stripping was removed. ",CONTRIBUTOR,487,{}
11802,PullRequestReviewCommentEvent,2017-08-10 15:46:43+00:00,93721432,awslabs/sockeye,683589,davvil,3299148,awslabs,created,55578981,6b3a5ef0c9db63020d5ea0c250f8781f51706d70,False,Will do.,,103,{}
11806,PullRequestReviewCommentEvent,2017-08-29 14:51:53+00:00,93721432,awslabs/sockeye,363737,tdomhan,3299148,awslabs,created,59269030,081555dc1463b49bbf54e177cd8e7aa14048d360,False,changed,,120,{}
11813,PullRequestReviewCommentEvent,2017-11-08 16:51:22+00:00,93721432,awslabs/sockeye,363737,tdomhan,3299148,awslabs,created,75168047,e424a45411201d97b86d6fa412e0822f79da30a7,False,"you should not include scarebleu here. This is actually why Travis is failing. In python 3.4 `typing` is a library that needs to be installed whereas in python 3.5+ it comes shipped with python. Now importing scarebleu in setup.py will try to import the `typing` module, which will only be installed once setup.py from sacrebleu has finished running. Hope that makes sense.

You will probably need to do a similar version regex dance as we do in the Sockeye setup.py:
https://github.com/awslabs/sockeye/blob/master/setup.py#L26 

",CONTRIBUTOR,177,{}
11817,PullRequestReviewCommentEvent,2017-11-10 09:59:45+00:00,93721432,awslabs/sockeye,683589,davvil,3299148,awslabs,created,75709450,5e612ad2fb8e1db52395fcda9c825746b42e3aa9,False,"I was referring to removing the argument altogether, not to overwriting args.",CONTRIBUTOR,196,{}
11818,PullRequestReviewCommentEvent,2017-10-20 16:00:15+00:00,93721432,awslabs/sockeye,2027990,fhieber,3299148,awslabs,created,70888482,0852086eb7dd82ca17767e28a94c55817b965742,False,empty or just the first element of the batch?,CONTRIBUTOR,172,{}
11821,PullRequestReviewCommentEvent,2018-06-12 07:52:39+00:00,93721432,awslabs/sockeye,683589,davvil,3299148,awslabs,created,127848531,7123783a8e53fd0c0127e0d7b5ad941f3cdb3a22,False,"Not strictly necessary, but I would be explicit here and put `if word_id > 0:', as it cannot be None.",CONTRIBUTOR,433,{}
11823,PullRequestReviewCommentEvent,2018-01-17 15:26:45+00:00,93721432,awslabs/sockeye,455256,mjpost,3299148,awslabs,created,89479111,0fe91e8937b0424bd4afed03425e86ea532d4beb,False,"I just copied it from the old chrF implemention, but you're right that it's overkill.",COLLABORATOR,271,{}
11849,PullRequestReviewCommentEvent,2018-02-12 19:51:41+00:00,70530854,awslabs/serverless-application-model,32497805,jfuss,3299148,awslabs,created,95919203,fcfe7c8380bcb571a7b106d72756f0e7072b7743,False,"I thought I tested this, but must have been doing something else. Will update to reflect what is actually supported",COLLABORATOR,290,{}
11860,PullRequestReviewCommentEvent,2018-06-07 19:56:38+00:00,70530854,awslabs/serverless-application-model,32497805,jfuss,3299148,awslabs,created,126933595,022e139147729cdd98fb60dd18569395c6418847,False,This may work but can be easily broken. I am not sure if self.Method is normalized (all upper or lower) but we should just force one of these here. It will also help in readability.,COLLABORATOR,449,{}
11907,PullRequestReviewCommentEvent,2016-12-07 10:18:11+00:00,53788968,behave/behave-django,665072,bittner,3344102,behave,created,11767930,39313a290d9571ccd36110e5a261383e359bfe36,False,Why? Shouldn't this be `[pytest]` according to the [py.test documentation](http://doc.pytest.org/en/latest/customize.html#builtin-configuration-file-options)?,,25,{}
11916,PullRequestReviewCommentEvent,2017-12-05 16:37:31+00:00,30618733,prometheus/client_python,1140844,ioggstream,3380462,prometheus,created,81250951,7f68e86bbee094dd63c00674fb1eb193e67e6c0e,False,"Once you pass registry to MetricsHandler, you still need to call `MultiProcessCollector(registry)`.

Is there a smart way to do it?

@brian-brazil Thx++ for your feedback!",NONE,215,{}
11945,PullRequestReviewCommentEvent,2017-12-05 01:04:57+00:00,17010581,plaid/plaid-python,1106237,michaelckelly,3579888,plaid,created,81042508,ea2160c6a160064f7e7c3bc18768a714899c757d,False,👍 Agreed,OWNER,108,{}
11951,PullRequestReviewCommentEvent,2017-02-17 17:48:21+00:00,8372403,snowballstem/snowball,1124347,dscorbett,3676704,snowballstem,created,22552277,31481d8c71b111f57e47992cffbf30bd2d9b9896,False,What are these functions for? Can they be removed?,,51,{}
11963,PullRequestReviewCommentEvent,2015-07-03 21:58:02+00:00,9861437,imageio/imageio,1454335,kuchi,3678179,imageio,created,,30e8544e0123ff61809350f825696a95eccae668,False,But I tried it in my python and no message showed up? It said not default logger configured and didn't print the warning... I'm not sure why. Usually I have to configure a logger to see messages I thought. But maybe something is weird.,,96,{}
12018,PullRequestReviewCommentEvent,2018-06-01 18:53:13+00:00,85602406,uw-it-aca/uw-restclients-django-utils,9834194,fanglinfang,3730428,uw-it-aca,created,125279976,5933e3501b3e70df868f9228f3550f3a4eec9857,False,"Ah, added it back. Thank you!",CONTRIBUTOR,51,{}
12045,PullRequestReviewCommentEvent,2018-03-08 08:38:13+00:00,8763405,SoCo/SoCo,6164825,relevitt,3826649,SoCo,created,102220912,c483c952f48ee42fc12e830db1de69daba90d25c,False,Thank you. Well spotted.,CONTRIBUTOR,602,{}
12047,PullRequestReviewCommentEvent,2015-08-30 10:10:34+00:00,8763405,SoCo/SoCo,5252441,lawrenceakka,3826649,SoCo,created,,c89f5e42713f0572a3a1360ffef3ef9cfa11b9df,False,Excellent point.  I'll move it,,262,{}
12048,PullRequestReviewCommentEvent,2016-09-18 23:57:41+00:00,8763405,SoCo/SoCo,618191,americanwookie,3826649,SoCo,created,,63137a3dec1371dbb1ac858a19c59941371ab5eb,False,"No, in my limited testing I found the device doesn't care. Maybe down the road it does. But there's so much string gymnastics here that I'm inclined to just clean it up and count on the device never caring.",,413,{}
12069,PullRequestReviewCommentEvent,2016-08-11 23:54:50+00:00,49976939,learningequality/kolibri,10454785,rayykim,3926525,learningequality,created,,20763ee225c1f6fff8af79549893f059cef6b229,False,"@radinamatic in the mock-up, it said ""Account Info"" so it was changed. @whitzhu any thoughts?",,373,{}
12072,PullRequestReviewCommentEvent,2017-04-25 19:04:00+00:00,49976939,learningequality/kolibri,2367265,indirectlylit,3926525,learningequality,created,34655764,e7413d3495dcbdf4d46b7c8dd7205c66163ec409,False,"it isn't really a validator - more like one of our state mappers (with some normalization)?

Maybe instead call it `assessmentMetadataState` and put it in the `core/state` directory?
",,1316,{}
12087,PullRequestReviewCommentEvent,2016-08-18 00:40:31+00:00,49976939,learningequality/kolibri,7193975,christianmemije,3926525,learningequality,created,,2af1aebbea8350d9f8e3d9d1b3c22f6119145c4f,False,@radinamatic I removed it. Quick google search shows that this is necessary for accessibility. My mistake. Should the label should be visible or can be just part of the markup but hidden?,,448,{}
12088,PullRequestReviewCommentEvent,2017-08-30 17:38:49+00:00,49976939,learningequality/kolibri,2367265,indirectlylit,3926525,learningequality,created,59636821,e3be6a9ac0abe7e134c7b3ad4cf9a66f3b633b40,False,"Hm okay. As a general rule, introducing timing offsets to try and affect order of operations is brittle, and liable to introduce subtle bugs down the line.

It sounds like this stems from the [form spec](https://docs.google.com/document/d/1rrq8fovV5wBtUKv65wfRqXxP4SfnV30anUZHfzCVmN4/edit) which says that the buttons should be enabled unless there is a visible error shown? So, even though the field contents are invalid, the user hasn't seen an error yet and therefore we allow submission? It's a subtle situation, which makes me slightly want to change the spec'd behavior. But for now let's leave it since it's well-defined.

There are two things I can think of doing to make this a little cleaner while leaving the logic basically the same:

* Try switching from a timeout to a vue `nextTick`. While still a code smell, it's a little less arbitrary than 100ms
* Since this logic is specific to form handling patterns, move the delay out of the textbox component and up to the form level, in the event listener. This makes it less likely that a future user of textboxes will encounter subtle bugs because of an unexpected internal event firing delay
",OWNER,2005,{}
12092,PullRequestReviewCommentEvent,2016-04-19 09:07:30+00:00,49976939,learningequality/kolibri,1680573,rtibbles,3926525,learningequality,created,,c2a5e230cc744fa2d5c4d296345003814c5d2121,False,I like this approach.,,58,{}
12094,PullRequestReviewCommentEvent,2017-11-06 22:47:09+00:00,49976939,learningequality/kolibri,19424916,lyw07,3926525,learningequality,created,74589284,edcd14b10824062460e60e2bb403dd4da1c4e48e,False,It looks like `rest_framework.viewsets` has been imported in line 15. Do you mind using `viewsets.Viewset` for your class `RemoteChannelViewSet`?,CONTRIBUTOR,2566,{}
12096,PullRequestReviewCommentEvent,2018-04-20 05:56:23+00:00,49976939,learningequality/kolibri,2367265,indirectlylit,3926525,learningequality,created,113856078,b822c01e1181109ec717fa7c001b195aad1c2fbb,False,yes,OWNER,3559,{}
12109,PullRequestReviewCommentEvent,2016-02-05 12:06:39+00:00,49976939,learningequality/kolibri,374612,benjaoming,3926525,learningequality,created,,27efb4546fdded246cda0dbc9d0ebc10d8cc0499,False,Let's btw add the `fix-encoding-pragma` pre-commit hook?,,26,{}
12111,PullRequestReviewCommentEvent,2017-04-12 18:00:26+00:00,49976939,learningequality/kolibri,2367265,indirectlylit,3926525,learningequality,created,32449994,c031235ecaf906fb08c87733c687bb1c300fd64c,False,"check out the latest coach app.js for the specific parameters that each page takes.

Channel root pages only take channel and class IDs
",,1217,{}
12113,PullRequestReviewCommentEvent,2016-12-13 21:19:48+00:00,49976939,learningequality/kolibri,2367265,indirectlylit,3926525,learningequality,created,12772658,3f223859f691c4505e9accffc3cbbb52d72c1192,False,whitespace,,721,{}
12125,PullRequestReviewCommentEvent,2018-06-19 15:34:46+00:00,49976939,learningequality/kolibri,2367265,indirectlylit,3926525,learningequality,created,130034462,b40b71b79cafb15ed74bd7e65ee1cb28abf58092,False,good catch - PR here #3817,MEMBER,3808,{}
12127,PullRequestReviewCommentEvent,2017-08-30 22:13:22+00:00,49976939,learningequality/kolibri,1680573,rtibbles,3926525,learningequality,created,59710093,fd387e87619ad3aa10332d516099bde8d61225ea,False,"Just to chip in here and concur that this sort of timeout will produce different kinds of unexpected behaviour (not least because other processing could cause the actual execution of the timeout to be significantly later). If the spec simply isn't implementable without this, I would strongly recommend changing the spec.",OWNER,2005,{}
12131,PullRequestReviewCommentEvent,2016-04-25 18:48:07+00:00,49976939,learningequality/kolibri,2367265,indirectlylit,3926525,learningequality,created,,1be54c212ed4fd45a13559e8a9e69adfec50171b,False,Is there a place that defines the attributes that a `User` can have?,,61,{}
12134,PullRequestReviewCommentEvent,2016-03-09 22:59:37+00:00,49976939,learningequality/kolibri,191955,aronasorman,3926525,learningequality,created,,3572c0453fedbc666265df4fea9eccb749754f8f,False,Is it possible to put a comment with a link pointing to where these flags are defined?,,49,{}
12140,PullRequestReviewCommentEvent,2017-09-12 22:50:21+00:00,49976939,learningequality/kolibri,10248067,jonboiser,3926525,learningequality,created,62288811,60ae1386e9590870d9f114f5ab24cb7eaa614a66,False,Align with opening bracket,CONTRIBUTOR,2154,{}
12142,PullRequestReviewCommentEvent,2017-03-27 22:15:06+00:00,49976939,learningequality/kolibri,7193975,christianmemije,3926525,learningequality,created,29316479,130df11a0a7e9054a39d32f267c9ededdd43c6e4,False,"```
Periods should be used for:
Lists or dialogs with multiple sentences
```
This is a dialog with multiple sentences, so It looks appropriate. ",,1117,{}
12148,PullRequestReviewCommentEvent,2017-05-01 22:01:12+00:00,49976939,learningequality/kolibri,9877852,DXCanas,3926525,learningequality,created,35659830,84c030c5fb5b026fe186d7b60c820ef2f560a2ed,False,Linting error here,,1406,{}
12149,PullRequestReviewCommentEvent,2016-10-11 21:11:18+00:00,49976939,learningequality/kolibri,618416,jamalex,3926525,learningequality,created,3764745,9f549e91b949948793a4ed1ab7b0185ac4c4a6db,False,"Instead of hand-constructing the replacement URL, we should use Django's URL reversal. Even better, you can use the `get_content_storage_file_url` helper function:
https://github.com/learningequality/kolibri/blob/master/kolibri/content/utils/paths.py#L82
(pass in `zipped_filename`)

",,565,{}
12150,PullRequestReviewCommentEvent,2016-04-25 16:54:48+00:00,49976939,learningequality/kolibri,8888020,MCGallaspy,3926525,learningequality,created,,1be54c212ed4fd45a13559e8a9e69adfec50171b,False,"Granted, it's an odd name. I just couldn't think up a concise one at the time.",,61,{}
12156,PullRequestReviewCommentEvent,2017-03-07 03:48:54+00:00,49976939,learningequality/kolibri,2367265,indirectlylit,3926525,learningequality,created,25426361,7f53cf154824c638dba575011b03b56e6662da54,False,"perhaps this?

```
Running Sphinx v1.4.6
making output directory...

Exception occurred:
  File ""/Users/d/Projects/learning_equality/repos/kolibri/kolibri/utils/version.py"", line 96, in parse_git_tag_version_string
    build_hash = version_split[3]
IndexError: list index out of range
The full traceback has been saved in /var/folders/n9/k997qvqs3f7_m_310crwsxyc0000gp/T/sphinx-err-jEjQWI.log, if you want to report the issue to the developers.
Please also report this if it was a user error, so that a better error message can be provided next time.
A bug report can be filed in the tracker at <https://github.com/sphinx-doc/sphinx/issues>. Thanks!
make[1]: *** [html] Error 1
make: *** [docs] Error 2
```


",,1005,{}
12159,PullRequestReviewCommentEvent,2017-06-11 21:56:48+00:00,49976939,learningequality/kolibri,374612,benjaoming,3926525,learningequality,created,43329965,da0e6fb01b3d468eeb1a922b7a867fd2f4d1c97a,False,Isn't this part what actually fixes the issue?,,1604,{}
12165,PullRequestReviewCommentEvent,2017-07-27 19:54:10+00:00,49976939,learningequality/kolibri,9877852,DXCanas,3926525,learningequality,created,52767549,896fc936cd753fe1dad6d40ad720c9cb382dcc43,False,ah I see. The docs use the same instance of the throttled listener. I'm creating a new one in the function. Got it,,1911,{}
12166,PullRequestReviewCommentEvent,2018-04-18 21:11:53+00:00,68139052,learningequality/morango,6361732,ralphiee22,3926525,learningequality,created,113394059,1fa645c4f0be8209f1d36616c43cd245c1d159b7,False,in postgres atleast,COLLABORATOR,50,{}
12178,PullRequestReviewCommentEvent,2016-10-21 02:19:03+00:00,66905525,learningequality/kolibri-exercise-perseus-plugin,2367265,indirectlylit,3926525,learningequality,created,5190668,ddbe8ee677aab23b5d5cf35dab1a245a189f6d29,False,may have removed `$parent` by accident while we were talking?,,3,{}
12181,PullRequestReviewCommentEvent,2015-01-30 21:51:48+00:00,17720373,crate/crash,48020,dobe,4048232,crate,created,,8c526d5df9f279503c0881cd967ef0978c215df1,False,"use stdout if not in tty, also for other printers",,46,{}
12282,PullRequestReviewCommentEvent,2016-08-30 21:26:46+00:00,61582775,lyft/python-kmsauth,1538354,ryan-lane,4269340,lyft,created,,4a9a45d126c84af8cc8f30fe628b9e5e6bc0a72b,False,startswith?,,8,{}
