,type,created_at,repo_id,repo_name,actor_id,actor_login,org_id,org_login,pr_review_comment_action,pr_review_comment_id,pr_review_comment_commit_id,pr_review_comment_site_admin,pr_review_comment_body,pr_review_comment_author_association,pr_number,pr_review_comment_reactions
6396,PullRequestReviewCommentEvent,2018-03-29 05:54:41+00:00,77478378,ethereum/py-evm,17670147,NIC619,6250754,ethereum,created,107931697,187b59244e5d1828c33c8407bdb28b3414527e46,False,Good point. Though if we implement slashing condition for adding multiple header at same shard during same period then `self.period_head` can be removed.,CONTRIBUTOR,517,{}
6400,PullRequestReviewCommentEvent,2018-03-21 20:41:32+00:00,52113942,ethereum/eth-abi,205327,carver,6250754,ethereum,created,105898714,cf1481870b08a8da1c35b0a64b293d38715e4dbf,False,I think this should raise if the label or predicate already exist.,COLLABORATOR,41,{}
6410,PullRequestReviewCommentEvent,2018-03-26 10:35:41+00:00,56251096,ethereum/web3.py,157039,zheli,6250754,ethereum,created,106849502,b15b6514c4c02bbf16dd533dd14258ee765406ed,False,Thanks! It is removed.,CONTRIBUTOR,693,{}
6412,PullRequestReviewCommentEvent,2018-03-15 21:45:19+00:00,56251096,ethereum/web3.py,8933231,dylanjw,6250754,ethereum,created,104391968,950f9f24be84eb117deec898b93f34b134456f87,False,"Is there enough code overlap between this class and the ContractFunction class, to attempt to unify them in some way? If the main difference is the transaction parameter checking, you could use your strategy of putting the parameter check into a function (`check_forbidden_keys_in_transaction`) in a shared base class that can be overrided or have class or instance level `forbidden_keys` set to fit the different situation.",CONTRIBUTOR,693,{}
6486,PullRequestReviewCommentEvent,2018-06-02 23:40:30+00:00,6235174,conda/conda,1418419,kalefranz,6392739,conda,created,125379521,a048d9947b408e5014ad37b336dd9ac14dc28a21,False,Thanks!,MEMBER,7367,{}
6604,PullRequestReviewCommentEvent,2017-10-19 23:45:31+00:00,51040886,Azure/azure-cli,16448634,derekbekoe,6844498,Azure,created,70709596,d8f4b0514b9c03e5a504c55e84088b6347a3ae0e,False,"What error message does the server return? If the server returns some JSON data, should include that in your error message.

Your `r.reason` refers to ""Textual reason of responded HTTP Status, e.g. ""Not Found"" or ""OK""."" from https://github.com/requests/requests/blob/master/requests/models.py#L617 which IMO isn't that helpful.",MEMBER,4700,{}
6608,PullRequestReviewCommentEvent,2017-03-15 00:45:46+00:00,51040886,Azure/azure-cli,6014209,yugangw-msft,6844498,Azure,created,26969157,0c1d936c0b0f8f77330ab1f55f38df8a15d914c8,False,"    > If you want to enable it with all the defaults, you can use this flag.
Okay, looks like i am still on the same page. My previous comment was to confirm this flag alone will work w/o other metrics arguments",,2510,{}
6619,PullRequestReviewCommentEvent,2018-01-10 17:24:13+00:00,51040886,Azure/azure-cli,1329240,troydai,6844498,Azure,created,87915177,e0b6fe3cf3e3f03cecc968a16f6c0e1c551ac99c,False,It is what we have today. And yes it is not ideal. I intended to further improve this in the next stage. I,CONTRIBUTOR,5242,{}
6622,PullRequestReviewCommentEvent,2016-09-22 21:39:58+00:00,51040886,Azure/azure-cli,10146011,JasonRShaver,6844498,Azure,created,,9aebc967f07ab1fad5bddc04bf4d0f61709d3161,False,"As long as this leads them to the right function area, I think we are fine.  I didn't want to match exact functionality.   I'll call this example (and concept) in our migration document I'm writing",,955,{}
6629,PullRequestReviewCommentEvent,2018-06-26 18:58:38+00:00,51040886,Azure/azure-cli,3630974,djyou,6844498,Azure,created,132160992,3f3bf3d16f15ee7b7e2e654851e3ef41846cc529,False,Yes the existing definition takes the values from SDK enums.,MEMBER,6634,{}
6631,PullRequestReviewCommentEvent,2016-10-11 19:36:04+00:00,51040886,Azure/azure-cli,16448634,derekbekoe,6844498,Azure,created,3747766,b7a121e241492ae428a8f2e72d14785698ae1dd4,False,"The ones above are only for help of if completer is enabled.
I'll change the logic to make it clearer.

We call load_command_table again though because load_params will have loaded some changes that we need to pass to the parser.",,1059,{}
6634,PullRequestReviewCommentEvent,2017-10-16 17:48:01+00:00,51040886,Azure/azure-cli,1329240,troydai,6844498,Azure,created,69642565,3ea6e58eed967afbb3afd2a6b2b5e404b433e43b,False,ops,CONTRIBUTOR,4675,{}
6642,PullRequestReviewCommentEvent,2018-01-10 17:23:25+00:00,51040886,Azure/azure-cli,5723682,tjprescott,6844498,Azure,created,87913344,e0b6fe3cf3e3f03cecc968a16f6c0e1c551ac99c,False,Is there a reason why don't call this `event-hub-rule` and accept a name or ID?,MEMBER,5242,{}
6650,PullRequestReviewCommentEvent,2017-05-25 14:51:02+00:00,51040886,Azure/azure-cli,5723682,tjprescott,6844498,Azure,created,40300785,870cd40f65a52150a1d626c78fa749aa3f60f0df,False,"From what you have here I would recommend removing this and have ""invoice show"" be via reflection.  *However*... you have an ""invoice show"" and an ""invoice show-latest"" command. This actually looks like the ideal opportunity to fold these into a single ""invoice show"" command where `name=None` makes name optional.  It would look something like:

```Python
def cli_billing_get_invoice(client, name=None):
  if name:
    return client.get(name)
  else:
    return client.get_latest(name)
```

This is very similar to commands throughout the CLI for retrieving things for the entire subscription or within a resource group.  Instead of two commands (because they are two SDK methods) there's a single command that chooses the right call based on whether resource group is specified.",,3402,{}
6653,PullRequestReviewCommentEvent,2017-10-17 03:28:23+00:00,51040886,Azure/azure-cli,29225848,kuvinodms,6844498,Azure,created,69757706,ad082f01dc91ed3f9276e3b1b73e72ba4fda9786,False,"We have planned to do few more releases of vsts-cd-manager without any modifying azure-cli.  '<' will provide flexibility to release vsts-cd-manager, however if use == then we have to update azure-cli also with every new release of vsts-cd-manager",CONTRIBUTOR,4498,{}
6654,PullRequestReviewCommentEvent,2017-02-27 16:32:33+00:00,51040886,Azure/azure-cli,5723682,tjprescott,6844498,Azure,created,24030037,3c9fec1e0bef56695583de9e40d98b19d81010dc,False,Super intentional 💯 ,,2256,{}
6657,PullRequestReviewCommentEvent,2017-04-28 15:57:15+00:00,51040886,Azure/azure-cli,1329240,troydai,6844498,Azure,created,35397020,fc47810cb1a138055f16fcb6ec0960c7ba6b56d4,False,Please do not check in commented code.,,3060,{}
6661,PullRequestReviewCommentEvent,2018-08-12 12:53:51+00:00,108257720,Azure/azure-kusto-python,31644896,vladikbr,6844498,Azure,created,145473617,81bf0bc66bc8788fe83aec7a295d05f283d70cd9,False,pop-up,NONE,51,{}
6662,PullRequestReviewCommentEvent,2018-07-30 20:42:23+00:00,108257720,Azure/azure-kusto-python,54418,brettcannon,6844498,Azure,created,141705667,144b2e37c7e8006ff6b23615337cbc65790f42b0,False,This suggests to me that this shouldn't be a dict and you should just have a normal class or provide functions that operate directly on a dict as necessary.,MEMBER,38,{}
6665,PullRequestReviewCommentEvent,2018-02-22 21:40:25+00:00,94585736,Azure/service-fabric-cli,4260977,Christina-Kang,6844498,Azure,created,98709702,2b8a4f7ba2d7d85881807c6e6a3f7ed5302ba12a,False,Add this to the end of the line below,CONTRIBUTOR,70,{}
6672,PullRequestReviewCommentEvent,2015-02-20 18:41:06+00:00,4127088,Azure/azure-sdk-for-python,1693688,zooba,6844498,Azure,created,,ec7b33f7849ed0b66ab302599e2fbb4b2d018f6b,False,Use tag.partition('}')[2],,295,{}
6715,PullRequestReviewCommentEvent,2018-04-26 16:03:12+00:00,22739277,Azure/azure-documentdb-python,1086421,c-w,6844498,Azure,created,115643504,bb74225a8983061627889b352f8b789462898e10,False,"I didn't do that originally because it adds a little bit of boilerplate, but sure thing. Emulated the full basicConfig code path in bb74225, modeled on the Python 3.6.4 implementation.",NONE,119,{}
6722,PullRequestReviewCommentEvent,2017-05-30 18:09:03+00:00,62902455,Azure/azure-data-lake-store-python,1693688,zooba,6844498,Azure,created,41029949,ccc3b3c1e0ae8b310920584b81d906589b7ac19e,False,You're going from never doing this to always doing it (by default)? Is that deliberate?,,161,{}
6744,PullRequestReviewCommentEvent,2018-08-31 02:03:08+00:00,17689377,pre-commit/pre-commit,1810591,asottile,6943086,pre-commit,created,151239275,a970d3b69b693fffd858fce7791c0d0168e584ff,False,"hmm, given the test failures, this should probably happen in the `use_color` function below and not in `format_color` (to keep this function pure and to keep `auto` / `always` functioning properly)

Probably change the the return to:

```python
return (
    setting == 'always' or
    (setting == 'auto' and sys.stdout.isatty() and terminal_supports_color)
)
```",MEMBER,819,{}
6789,PullRequestReviewCommentEvent,2018-04-26 20:39:22+00:00,13258039,aio-libs/aiohttp,1226121,pfreixes,7049303,aio-libs,created,115740051,66333b5d81555033568aa93b265ba6e5854e33e5,False,"Yes, the issue was already there, indeed I can see the following issues with the code that we have in master:

1) The iteration till reach a none canceled waiter has to be done through all of the items of a list, right now is only done on top of the head of each list.
2) Each time that we try to release a waiter we have to calculate if the limit and the number of concurrent connections allows us to make it. This is done only in one when the release_waiter is called explicitly but not when we had an exception trying to make the connection
3)The limit per host, TBH, i would say that is not well calculated.

So we have to fix them, but true that they were already there and would be nice if we decouple both things.",CONTRIBUTOR,2937,{}
6809,PullRequestReviewCommentEvent,2018-03-11 19:34:54+00:00,28932001,aio-libs/aiomysql,1986397,terrycain,7049303,aio-libs,created,102893258,ed34a1ec841e628ddbef14b39e57db05019abe01,False,"Yeah I completely agree though vaguely remember when I tested it that it didn't like PROTOCOL_TLSv1, but its possible that it was the MySQL i was testing against instead of RDS.",NONE,225,{}
6858,PullRequestReviewCommentEvent,2017-07-06 19:46:16+00:00,23984796,jupyter/nbgrader,2680980,willingc,7388996,jupyter,created,48443399,8010d89058ed41ea53884721fb6e36bd777368a4,False,Got it. I see the usage later in the PR.,,782,{}
6861,PullRequestReviewCommentEvent,2017-07-16 01:17:46+00:00,23984796,jupyter/nbgrader,83444,jhamrick,7388996,jupyter,created,50200844,f9fb1626bcd0bad2cca093116fc6aef013a5d021,False,It looks like these unrelated docs changes snuck in here again.,,830,{}
6883,PullRequestReviewCommentEvent,2015-06-07 23:30:48+00:00,33653601,jupyter/notebook,335567,Carreau,7388996,jupyter,created,,16d80f03e4e42c290e46dad973b972eb5fd796e3,False,"Bad merge/rebase of package.json, there are some duplicate deps in here too. Will fix.",,134,{}
6885,PullRequestReviewCommentEvent,2015-08-06 17:25:56+00:00,33653601,jupyter/notebook,151929,minrk,7388996,jupyter,created,,237d2fa51c274dd1b5900f53f7eb112a4ad50289,False,"like below, perhaps `class=help_link` so that it can be treated with CSS rather than a block.",,247,{}
6957,PullRequestReviewCommentEvent,2018-02-05 10:17:41+00:00,49277326,cqse/teamscale-client-python,38839,karottenreibe,7558740,cqse,created,93930235,b686c384a1049f9946e5cdb25dab67ad16b44d1c,False,"please add a shebang to the file and make it executable so people can call it like ./migration.py directly
please add a comment at the beginning of this file, explaining what it does and how to use it",CONTRIBUTOR,27,{}
6966,PullRequestReviewCommentEvent,2016-04-21 02:33:32+00:00,43686408,OCA/pylint-odoo,6644187,moylop260,7600578,OCA,created,,9d7609fb7e2d22b90ec7101b407e1aead9a32c36,False,Use `if` sentences,,23,{}
6969,PullRequestReviewCommentEvent,2016-04-21 02:17:44+00:00,43686408,OCA/pylint-odoo,6644187,moylop260,7600578,OCA,created,,9d7609fb7e2d22b90ec7101b407e1aead9a32c36,False,s/translation-errors/translation-required/g,,23,{}
6977,PullRequestReviewCommentEvent,2017-12-14 15:23:39+00:00,85677006,hyperledger/indy-sdk,5072859,jovfer,7657900,hyperledger,created,83537706,cc575bb838a2f11fa5b9afb6b78e3ce78876bce1,False,"I suggest to extract string constant for this.
In non-test configuration it should be ""pool_transactions_genesis"" like in nodes
In test configuration it may be same with non-test or may be ""docker_pool_transactions_genesis""",MEMBER,428,{}
6979,PullRequestReviewCommentEvent,2017-08-14 08:04:59+00:00,85677006,hyperledger/indy-sdk,426295,srottem,7657900,hyperledger,created,56016147,4fb6b69f75823c5ab99f49c2feac11af425dc4d9,False,".NET does have Task.WaitForAll() and Task.WaitForAny() as well as
Task.WhenAll() and Task.WhenAny() which take an array of async tasks to
wait on.  Is that what you're looking for?",,185,{}
6986,PullRequestReviewCommentEvent,2017-12-28 11:10:30+00:00,51585028,hyperledger/indy-plenum,3115401,lovesh,7657900,hyperledger,created,85803773,e5d982f68b3b0c6171ab7e639393a4b581e8c7f0,False,"Done
",MEMBER,494,{}
6987,PullRequestReviewCommentEvent,2017-07-19 11:20:11+00:00,51585028,hyperledger/indy-plenum,3115401,lovesh,7657900,hyperledger,created,50875727,bd3c34d234f3a79433ac36f657d1821662285ebc,False,"1. Yes
2. Ok.
3. Ok.",,288,{}
6990,PullRequestReviewCommentEvent,2018-05-11 08:32:22+00:00,51585028,hyperledger/indy-plenum,21102430,ashcherbakov,7657900,hyperledger,created,119356005,cee6359ce2aff9fa2e54c0682d92af283d735e4a,False,"Ok, I see... BTW maybe we can just rely on quorum of prepares and don't check for out-of-order PrePrepares at all...
",MEMBER,664,{}
7023,PullRequestReviewCommentEvent,2017-09-18 08:43:42+00:00,61229773,galaxyproject/ephemeris,6804901,mvdbeek,7937847,galaxyproject,created,63284620,6cf58df9191301db7fee255c85a55f3bccbd44ab,False,"It isn't more than it was before, given that the web port is reachable with a predictable api key / username/password combination, but that's certainly something we should change.",MEMBER,53,{}
7026,PullRequestReviewCommentEvent,2017-02-16 16:45:04+00:00,48335886,galaxyproject/galaxy-lib,216771,jmchilton,7937847,galaxyproject,created,22300775,3bd9c95c844dbd9ad2b7418836a23e493ebe169d,False,"... and I just pushed directly into master - ugh. I maybe need to take a break from attempting to computer today. 

Anyway - I think it is fixed in master as well.",,43,{}
7032,PullRequestReviewCommentEvent,2018-02-16 05:54:59+00:00,21749516,scikit-build/scikit-build,15351036,xoviat,8144855,scikit-build,created,97088248,b1b63bbe74591c46dc35eee6186cdc7d75e8d21f,False,This is the only use case we need to support. I'll look into that issue after I finish this.,CONTRIBUTOR,281,{}
7057,PullRequestReviewCommentEvent,2017-05-02 11:30:30+00:00,6475842,nsqio/pynsq,1751262,panaetov,8295919,nsqio,created,35750925,6393d321a32abf74e1a77290b5f2efe1455aa41b,False,Done,,174,{}
7062,PullRequestReviewCommentEvent,2016-03-08 14:15:33+00:00,22601443,OpenKMIP/PyKMIP,3485617,rellerreller,8350747,OpenKMIP,created,,9d76b37bb8cbfdd44de3cd866a8ad1192acbd3e4,False,"Based on this annotation it appears that the intent is for only one request to be handled at a time? Is that correct?

It looks like your plan is to have multiple threads running for a thread-per-connection setup. While this will work it adds complexity and overhead. We could make this a single threaded application and do a reactor pattern. Essentially the for loop will be in the server. It will have the handle to the listener socket and each connected socket. Then all of the socket handles will be registered with an event dispatcher. When the event dispatcher returns then a handle to a socket is ready. If it is a connected socket then call process request. Otherwise create a client socket and register it with the event dispatcher.

See the reactor patter for more details.

I see that Twisted has a library for this.
http://twistedmatrix.com/documents/13.1.0/core/howto/reactor-basics.html",,142,{}
7063,PullRequestReviewCommentEvent,2016-02-12 18:38:52+00:00,22601443,OpenKMIP/PyKMIP,3485617,rellerreller,8350747,OpenKMIP,created,,233a3a8bec2319cafe56ec5b07f0bf1265e63a4d,False,Remove this print statement.,,126,{}
7067,PullRequestReviewCommentEvent,2016-07-21 16:40:22+00:00,28855778,matrix-org/matrix-python-sdk,2072976,Half-Shot,8418310,matrix-org,created,,f2a803a086d8b9b1ad245e4db08d7fcfbb4ef50d,False,"I'd prefer it if you return None here. It's perfectly okay to do it as a helper method, but there are times when I want to know if a displayname is set or not.",,28,{}
7068,PullRequestReviewCommentEvent,2017-03-23 15:01:36+00:00,28855778,matrix-org/matrix-python-sdk,10236920,pik,8418310,matrix-org,created,28678825,7348fdf043227d81d10e531a9333277c26bc83a4,False,"In practice, I think this only accepts `m.login.password` type auth https://github.com/matrix-org/synapse/blob/develop/synapse/rest/client/v2_alpha/devices.py#L133 but that's not specified in the spec (so maybe still subject to change?) 

https://matrix.org/speculator/spec/HEAD/client_server/unstable.html#delete-matrix-client-unstable-devices-deviceid

",,107,{}
7069,PullRequestReviewCommentEvent,2018-08-08 20:13:09+00:00,28855778,matrix-org/matrix-python-sdk,30212477,Zil0,8418310,matrix-org,created,144588646,c1cd4b1cdfc5660362d883717313bcdd0951d621,False,"Yep, defaulting to the global display name seems like a bad idea after all.

`self.api.get_display_name` doesn't raise anything and just returns `None` (which sure is unexpected according to the docstring of `User.get_display_name`), so here the try/except clause would just be replaced by `return room.members_displaynames.get(self.user_id)`.

However, it seems like `get_display_name` should indeed raise an exception, while if someone doesn't want that they should call `get_friendly_name` which ideally wraps around `get_display_name`, returning the user id if an exception was raised.

While we're at it, I don't think this is a good design. The spec doesn't say anything that suggests having two methods (to me it says that only `get_friendly_name` should exist, and should be called `get_display_name`). Also I can't see any use of having an exception raised in this kind of method.

So my proposal would be:
  - `User.get_display_name()` gives the global display name, or the user id if not set.
  - `User.get_display_name(room)` gives the display name corresponding to the room, or the user id if not set.
  - `User.get_friendly_name()` is deprecated and returns `User.get_display_name()`.

How's all that?",COLLABORATOR,259,{}
7126,PullRequestReviewCommentEvent,2016-03-14 18:08:27+00:00,39923176,BD2KGenomics/toil-scripts,3752466,fnothaft,8701293,BD2KGenomics,created,,bfcd4afaf3b9aeb538e5e713cb52df6ba0348270,False,"Since this is a pretty simple pipeline and there aren't variable arguments to the concordance tool, I would drop the `try` and just let the job fail. `docker_call` reports the full command line in the log.",,173,{}
7127,PullRequestReviewCommentEvent,2016-08-26 22:39:53+00:00,39923176,BD2KGenomics/toil-scripts,12463956,jpfeil,8701293,BD2KGenomics,created,,0790c785d9c5c95aa43b10e06c8157e487aefd35,False,Because it has a child job that depends on a promise from another child job.,,335,{}
7138,PullRequestReviewCommentEvent,2018-02-21 18:29:38+00:00,17799097,PyCQA/flake8-import-order,1867464,labrys,8749848,PyCQA,created,98308549,09c696a6adfba09b56dee0bffdf15f545721e704,False,"I agree they are mostly stylistic changes, thus the PR title minor cleanups.

The one change of substance is making parse options more DRY.  
I made this change intentionally because I have some very significant changes I am working on and it would simplify additions of new options.

Essentially without getting too much into it here I am changing to a configuration based system where the different styles are defined as a set of standard options instead of subclasses.

It would allow users to customize the import-order without necessarily requiring a new style to be created.  For example the PyCharm style recently implemented only covers a single way PyCharm can be configured and could have been implemented as `smarkets` with case-sensitivity option.

Feel free to close the PR if you feel they are not appropriate.",NONE,151,{}
7189,PullRequestReviewCommentEvent,2017-10-13 13:53:53+00:00,46265005,ARMmbed/mbed-flasher,19773173,YifeiZuo01,8916057,ARMmbed,created,69234599,021359e58ffce553b680abae605dd3536a9ea609,False,"yes, you're right, this is a bug, fixed now. :)",CONTRIBUTOR,70,{}
7221,PullRequestReviewCommentEvent,2017-01-19 17:02:49+00:00,26784827,dotnet/core,8228359,Petermarcu,9141961,dotnet,created,17505277,1d1123417acea31401c2c9d1ab52d8acb4093100,False,Debian would work if we made the zips for them. I haven't tried these bits on debian but they may work. I don't know all the reasons why we have seperate debian and ubuntu builds.,,430,{}
7266,PullRequestReviewCommentEvent,2015-11-08 05:38:15+00:00,26516210,letsencrypt/letsencrypt,479213,pde,9289019,letsencrypt,created,,bbb7606fe1914e186443b85bf192f55200400285,False,"Note: we assume `hexidgest` is always lowercase, which is probably fine but may deserve a comment.",,1411,{}
7299,PullRequestReviewCommentEvent,2016-04-02 18:19:34+00:00,26516210,letsencrypt/letsencrypt,6504915,bmw,9289019,letsencrypt,created,,7fbd800ddd96e37d6293afc6b9580c8d4cb040b6,False,"This logic isn't quite right.

Before, `bold_on` was set and `le_util.ANSI_SGR_BOLD` was written to the terminal depending on the value of `bold_on`. Now, `bold_on` can be set to `True` but we never actually write `le_util.ANSI_SGR_BOLD` to the terminal, causing us to unnecessarily write `le_util.ANSI_SGR_RESET` later.

This isn't a big deal, but it should probably be written correctly. ",,2745,{}
7309,PullRequestReviewCommentEvent,2015-08-22 13:14:16+00:00,26516210,letsencrypt/letsencrypt,106176,kuba,9289019,letsencrypt,created,,4566a6226722f39c1384f7b137f7b31f35a0fb50,False,you are missing `python-cryptography>=0.7` here,,701,{}
7318,PullRequestReviewCommentEvent,2015-08-22 13:50:14+00:00,26516210,letsencrypt/letsencrypt,711517,hlieberman,9289019,letsencrypt,created,,4566a6226722f39c1384f7b137f7b31f35a0fb50,False,"It's because right now it's 0.<date>, and it's 2015.  If you release it as 0.1 and we already put it in Debian with 0.2015xxxx, then we will need to use epochs to make sure the versioning is correct.  README.source is notes for the other Debian maintainers, not for users.",,701,{}
7345,PullRequestReviewCommentEvent,2018-04-10 10:44:47+00:00,56217288,confluentinc/confluent-kafka-python,524990,edenhill,9439498,confluentinc,created,110780997,dd26988f274d30a7abbeef0ed1dfda32d0efd2d7,False,ditos,MEMBER,353,{}
7346,PullRequestReviewCommentEvent,2018-02-13 21:06:15+00:00,56217288,confluentinc/confluent-kafka-python,19174,mhowlett,9439498,confluentinc,created,96299599,3da1dea8544b0665f4e76724dfeefa08d00e15b2,False,"comment is unrelated to this PR, but having non error events exposed via `error()` is not a good API choice imo. it'll confuse people. ",CONTRIBUTOR,312,{}
7352,PullRequestReviewCommentEvent,2018-05-22 16:19:24+00:00,56217288,confluentinc/confluent-kafka-python,5313961,rnpridgeon,9439498,confluentinc,created,122246813,c5e671e21cb95e06cb0414af9c61691b60beedd0,False,ack,CONTRIBUTOR,377,{}
7354,PullRequestReviewCommentEvent,2018-04-09 23:40:32+00:00,56217288,confluentinc/confluent-kafka-python,19174,mhowlett,9439498,confluentinc,created,110652649,dd26988f274d30a7abbeef0ed1dfda32d0efd2d7,False,"as a non-python user, I actually appreciate having all this spelled out so I don't need to go look it up, but maybe it doesn't belong here.",CONTRIBUTOR,353,{}
7355,PullRequestReviewCommentEvent,2016-10-07 00:33:51+00:00,56217288,confluentinc/confluent-kafka-python,47366,ewencp,9439498,confluentinc,created,3226620,c0619fd59d4bd32ff3c1b792d0e4f889fe55d669,False,"If possible, it would be better to not depend on a specific port. This is a really common way to generate confusion when developers have something else running on that port or to cause random failures of tests on shared infrastructure like Jenkins. We had lots of these problems in Kafka until I converted all the places we bind to ports to use `0` (to select a random available port) and then constructing URLs to match whatever port ends up being bound.",,40,{}
7356,PullRequestReviewCommentEvent,2016-11-21 19:03:34+00:00,56217288,confluentinc/confluent-kafka-python,524990,edenhill,9439498,confluentinc,created,9519235,8d6cf4994b7030e5f9e69f805c6a1c20cba6db9e,False,"I dont think there is much value (pun!) to these log messages, they dont include any actual information, and there is an exception to counter-represent their coverage, so I think you should remove all the just-before-exception logs, and logs like this.",,40,{}
7358,PullRequestReviewCommentEvent,2018-05-23 10:34:31+00:00,56217288,confluentinc/confluent-kafka-python,524990,edenhill,9439498,confluentinc,created,122524873,909483c939a808e6f0f2f5e49983b230dc0035ad,False,"Right, but it is better if the tests are as modest as possible (performance tests excluded of course) to be runnable in CI, whatnot.",MEMBER,377,{}
7389,PullRequestReviewCommentEvent,2015-06-07 00:04:00+00:00,26876372,dateutil/dateutil,2650040,MichaelAquilina,9849410,dateutil,created,,0cd3784485a7084238fe081d20e1fee7a22777be,False,"In my opinion, because return will always be returning a tuple - it would probably be best if the internal _parse method always return the skipped_tokens. These can then just be ignored if required.",,91,{}
