,type,created_at,repo_id,repo_name,actor_id,actor_login,org_id,org_login,pr_review_comment_action,pr_review_comment_id,pr_review_comment_commit_id,pr_review_comment_site_admin,pr_review_comment_body,pr_review_comment_author_association,pr_number,pr_review_comment_reactions
14817,PullRequestReviewCommentEvent,2015-11-24 15:38:05+00:00,26516210,letsencrypt/letsencrypt,6504915,bmw,9289019,letsencrypt,created,,1d30bba0c2896dcc9b1e5f8767281444cc696836,False,"So this technically isn't an authenticator since it doesn't implement the `IAuthenticator` interface. Perhaps we should avoid using the term and just call it ""A class that performs TLS-SNI-01 challenges for Apache""?

There are a few other places, with varying importance, where `authenticator` was used to refer to this class as well.",,1568,{}
14844,PullRequestReviewCommentEvent,2016-02-09 00:07:34+00:00,26516210,letsencrypt/letsencrypt,479213,pde,9289019,letsencrypt,created,,1fd3f8a8dcb9a3a8a3060bf168f7852c4cdde7cd,False,"Also print a batch of ""not yet due for renewal"" outputs.",,2392,{}
14857,PullRequestReviewCommentEvent,2016-02-03 04:59:27+00:00,26516210,letsencrypt/letsencrypt,6158,olabini,9289019,letsencrypt,created,,6065a013eb6269eb9534c1889d5043330c68b3f5,False,"Yes, I noted this, but I didn't want to change it in this PR since some of that awkwardness was there from before (several type-checks that actually differentiate different directive types). I would be fine with fixing it, but it probably fits better as a self contained refactoring.",,2285,{}
14872,PullRequestReviewCommentEvent,2015-10-20 18:08:22+00:00,26516210,letsencrypt/letsencrypt,479213,pde,9289019,letsencrypt,created,,719cbdb4884d9559fa95fb0ac3a61356cf927b0c,False,"I think that `letsencrypt --standalone` is a pretty simple command that should just do what it seems like it should do.  I don't think there's a conceptual problem with the internal semantics of a CLI tool being slightly different when it receives a flag, if that's what makes logical sense.

That's especially true when we're talking about the *default* selection of subcommands, because the user will often not have much of a model of what the subcommands exactly are and what they exactly do.  And if they do have that model, the help is [very clear](https://github.com/letsencrypt/letsencrypt/pull/1038/files#diff-54b2f468d57ef7436008bd031bc89711R74).",,1038,{}
14888,PullRequestReviewCommentEvent,2016-02-13 04:28:08+00:00,26516210,letsencrypt/letsencrypt,1497288,moshevds,9289019,letsencrypt,created,,c15581bcfd4b9ffe8d1e1ceb03e316c337691524,False,self.key_authorization should be validation here,,2061,{}
14915,PullRequestReviewCommentEvent,2016-02-16 20:26:08+00:00,26516210,letsencrypt/letsencrypt,479213,pde,9289019,letsencrypt,created,,9b5ff7bcd725592b97fcd86521f99bb5b46eb97f,False,"This may raise an exception and crash if that directory is not empty (for instance, if the user had run the webroot plugin with a previous version of the client).",,2480,{}
14928,PullRequestReviewCommentEvent,2015-12-29 07:25:43+00:00,26516210,letsencrypt/letsencrypt,106176,kuba,9289019,letsencrypt,created,,4ba50889579f5ddc9c2c33309d70a5a591a74c54,False,"`assert_not_called` requires `mock>=1.3.0`, so it's a NOP e.g. in Python 2.6. Please fix",,2014,{}
14945,PullRequestReviewCommentEvent,2017-03-07 21:13:00+00:00,64330225,trustar/trustar-python,8205616,tiludropdancer,9372891,trustar,created,25631848,0a0d2d04e36d7c7595885fc5aa92e4a1c65f1c8b,False,"oh yes, I'll remove that",,5,{}
14950,PullRequestReviewCommentEvent,2015-11-06 16:36:22+00:00,30055479,SparkPost/python-sparkpost,14877079,rajumsys,9406778,SparkPost,created,,1193d62bfb7c57be1ae89930217cca4776165138,False,can we explicitly mention that datetime must come with tz? May be an example too. ,,59,{}
14969,PullRequestReviewCommentEvent,2017-12-05 16:05:20+00:00,56217288,confluentinc/confluent-kafka-python,524990,edenhill,9439498,confluentinc,created,81237659,1aaf4fe8109bc55661789bae382ee85c4ba74f26,False,or KafkaError in case of internal error.,MEMBER,282,{}
14971,PullRequestReviewCommentEvent,2018-08-20 14:06:44+00:00,56217288,confluentinc/confluent-kafka-python,524990,edenhill,9439498,confluentinc,created,147635577,0fb61eacd232db094de53013f904f926e1d84a9b,False,same,MEMBER,440,{}
14972,PullRequestReviewCommentEvent,2016-10-27 06:56:58+00:00,56217288,confluentinc/confluent-kafka-python,524990,edenhill,9439498,confluentinc,created,5999056,73b363f3ef3e100c5e55aeef43817de16c05239e,False,"Make these size_t changes a separate commit, for tracking.",,55,{}
14996,PullRequestReviewCommentEvent,2017-10-17 21:18:17+00:00,30112103,Calysto/matlab_kernel,168568,dsblank,9684179,Calysto,created,70033992,571f6a14ab64bf1b4cde37f3abe3f89db4bd2d15,False,"Does putting the name ""python"" here prevent using other versions to start the kernel?",OWNER,103,{}
15003,PullRequestReviewCommentEvent,2017-10-31 15:47:59+00:00,63251150,go-macaroon-bakery/py-macaroon-bakery,66491,rogpeppe,9721471,go-macaroon-bakery,created,73219921,57d84877d8302b0fef62a26ca924697a24874bc7,False,done,OWNER,21,{}
15004,PullRequestReviewCommentEvent,2017-06-13 07:44:18+00:00,63251150,go-macaroon-bakery/py-macaroon-bakery,1395842,fabricematrat,9721471,go-macaroon-bakery,created,43642469,cb84532114802a87b0cba3e46ccdfea74b21c169,False,@frankban pointed this type of error http://effbot.org/zone/default-values.htm,,4,{}
15006,PullRequestReviewCommentEvent,2017-10-26 17:59:44+00:00,26876372,dateutil/dateutil,1377457,pganssle,9849410,dateutil,created,72286634,6330d8e35c92e2278fdf8dd47a00f615782c99be,False,"Note that by ""moved to"" I mean that it should not `yield` anything, and the `assert` statement should be switched to a `self.assertEqual()` call.",OWNER,481,{}
15013,PullRequestReviewCommentEvent,2018-04-13 17:39:43+00:00,26876372,dateutil/dateutil,8078968,jbrockmendel,9849410,dateutil,created,112099062,bbdf9ad64ea97cb9b3bcd215a7a3e25d4efdb02c,False,@pganssle is there a preferred convention for how to do these assertions?  I tend to prefer just `assert result == new_year`,CONTRIBUTOR,674,{}
15016,PullRequestReviewCommentEvent,2018-04-13 13:56:09+00:00,26876372,dateutil/dateutil,1377457,pganssle,9849410,dateutil,created,112020024,bbb048c28bf31b61961076bb458f24ec0aa9f3a3,False,"I would change this to:

```python
try:
    from weakref import WeakRefDictionary
except ImportError:
    WeakRefDictionary = dict
```",OWNER,672,{}
15018,PullRequestReviewCommentEvent,2018-04-18 20:30:40+00:00,26876372,dateutil/dateutil,8078968,jbrockmendel,9849410,dateutil,created,113380311,f038715a4577f51303629990c97fe67ddfce832a,False,"I like the round-trip test, seems like an ideal use case for hypothesis.  Only question is about the name `test_auto`.  Can that be clarified?  I'm guessing the isoparser marker is intended to pull some of the weight in describing the test?",CONTRIBUTOR,688,{}
15040,PullRequestReviewCommentEvent,2017-10-01 20:43:43+00:00,66641037,LonamiWebs/Telethon,6297805,Lonami,9887454,LonamiWebs,created,66346583,f85e565158f58460a3c4fd18cdf4fc44807665f8,False,"But there's already ""example.py"" for this purpose. ""test.py"" ran as tests on my IDE so that's why I wasn't using this. Anyway.",OWNER,282,{}
15059,PullRequestReviewCommentEvent,2017-12-09 06:02:03+00:00,66641037,LonamiWebs/Telethon,11808223,stek29,9887454,LonamiWebs,created,82317746,6c45fe46dd6abebef835c93b2b72819ceed570f2,False,"@Lonami lol, indeed",CONTRIBUTOR,481,{}
15070,PullRequestReviewCommentEvent,2017-07-14 13:17:32+00:00,43816051,common-workflow-language/cwltool,1330696,mr-c,9947495,common-workflow-language,created,50042667,fee18d038e46930de08bc46b59e32dcb771a9c0d,False,"This is a big behavior change. I'm guessing that this is about enforcing priority of the dockerRequirements, but now this method works rather differently than before. Perhaps a rename is called for?",,419,{}
15087,PullRequestReviewCommentEvent,2017-02-08 09:32:36+00:00,43816051,common-workflow-language/cwltool,1330696,mr-c,9947495,common-workflow-language,created,20714576,518b5c1c3a02925f7da771d498c10f9f50c0c34b,False,"I'd try `completed = []  # type: List[BytesIO]` here ...
  
     ",,287,{}
15088,PullRequestReviewCommentEvent,2018-04-09 10:17:36+00:00,43816051,common-workflow-language/cwltool,253413,stain,9947495,common-workflow-language,created,110399441,a7ca40e5b23933afc253d0ca2f021ea68dda519b,False,Fixed :) How can we test if more type annotations are needed?,OWNER,676,{}
15091,PullRequestReviewCommentEvent,2017-08-13 15:13:45+00:00,43816051,common-workflow-language/cwltool,1330696,mr-c,9947495,common-workflow-language,created,55968369,cb5642924af0996fa81c05f3cf4e84c892869b1d,False,"Line wrap at 80 columns please. Also, I do not see any workflow calling `python` at the given link",,521,{}
15098,PullRequestReviewCommentEvent,2018-04-25 08:48:48+00:00,43816051,common-workflow-language/cwltool,578125,undu,9947495,common-workflow-language,created,115084843,fb259082a0049bd8c76ee9deb3ffd4714b4cc6c8,False,Would the new image with `sh` as an entrypoint work for this purpose?,CONTRIBUTOR,690,{}
15111,PullRequestReviewCommentEvent,2015-08-16 14:01:49+00:00,9952134,python-visualization/folium,4586863,BibMartin,9969242,python-visualization,created,,a44d4524dcc1a562798b83bdbb7222ba518d9ed9,False,Why do we need to import time ?,,182,{}
15117,PullRequestReviewCommentEvent,2017-09-01 17:32:42+00:00,9952134,python-visualization/folium,16011037,stickler-ci,9969242,python-visualization,created,60197620,03d068e316c51353c3ef8209bd22e1e2bb6f0509,False,C901 'Map.choropleth' is too complex (17),NONE,703,{}
15118,PullRequestReviewCommentEvent,2015-03-22 17:36:07+00:00,9952134,python-visualization/folium,950575,ocefpaf,9969242,python-visualization,created,,29d3782fd7d9aa9a7cb5a6e0153d3f26b90efb01,False,"@apatil I am on the fence here.  I am not sure if the call to `str` is necessary, but it does not hurt...  What is your argument?",,95,{}
15121,PullRequestReviewCommentEvent,2018-06-18 16:53:36+00:00,9952134,python-visualization/folium,16011037,stickler-ci,9969242,python-visualization,created,129649323,044cf3c5003cac2858920d8495f1fd8e67aca5b1,False,E262 inline comment should start with '# ',NONE,885,{}
15129,PullRequestReviewCommentEvent,2018-08-03 06:12:07+00:00,9952134,python-visualization/folium,33519926,Conengmo,9969242,python-visualization,created,143063093,ea6da8e081d3ef4625449a320156540d5d379cab,False,"Changing the default of `location` here doesn't have to do with tooltip, please remove it here.",COLLABORATOR,883,{}
15161,PullRequestReviewCommentEvent,2017-02-10 22:31:23+00:00,42750248,watson-developer-cloud/python-sdk,31938,kognate,10017763,watson-developer-cloud,created,21356577,2136c0c3e826fbbb132191b3f85f9bc390f65d07,False,OK.  ,,159,{}
15200,PullRequestReviewCommentEvent,2017-05-01 23:31:12+00:00,27610253,ubyssey/dispatch,2547035,psiemens,10091792,ubyssey,created,35672111,4523a6c94e62f7e372d2b7fa46a375be64f3ae56,False,Use `rejected` helper,,510,{}
15212,PullRequestReviewCommentEvent,2015-07-19 19:16:15+00:00,4637221,powerline/powerline,322097,ZyX-I,10100576,powerline,created,,1db251a877c10d083aa80ea379e39cfc6b7cc836,False,You are absolutely right.,,1415,{}
15214,PullRequestReviewCommentEvent,2017-10-23 20:23:36+00:00,4637221,powerline/powerline,322097,ZyX-I,10100576,powerline,created,71316770,c8f361c9ca64712c0a8ab684635f5896e1fa0385,False,"Do not use `.format`, `PowerlineLogger` does already use it internally.",CONTRIBUTOR,1851,{}
15215,PullRequestReviewCommentEvent,2015-05-14 15:15:03+00:00,4637221,powerline/powerline,1731279,S0lll0s,10100576,powerline,created,,9afc7e03b4e2f56892476ea65ba6c0616a4c81e6,False,But then it would create a new connection every time. Should I instead use `ThreadedSegment`?,,1366,{}
15227,PullRequestReviewCommentEvent,2015-11-13 21:29:48+00:00,4637221,powerline/powerline,322097,ZyX-I,10100576,powerline,created,,0f92432fec52328cd7e48d0f382a2af309fe6297,False,This all needs to be aligned.,,1490,{}
15361,PullRequestReviewCommentEvent,2018-06-19 17:45:49+00:00,112676803,apple/turicreate,56061,hoytak,10639145,apple,created,130087125,8fadff83a58d62e73b60d4ca83afdc277bc0e61b,False,"Oops, yes, cherry picked the wrong commit. ",COLLABORATOR,714,{}
15431,PullRequestReviewCommentEvent,2016-02-06 14:00:12+00:00,584410,django-tastypie/django-tastypie,134373,SeanHayes,10821692,django-tastypie,created,,e411988380d4fd86d639f90d397b08a856bda0c2,False,No need to copy since fixed_data is being updated and returned.,,1428,{}
15438,PullRequestReviewCommentEvent,2017-12-18 08:35:47+00:00,66823715,intel-analytics/BigDL,2662017,zhichao-li,10941215,intel-analytics,created,84061253,73ac1fea2c3e00844cfb89f60b3d58f68f6da51d,False,we should give an example that saving definition and also parameters.,CONTRIBUTOR,2039,{}
15444,PullRequestReviewCommentEvent,2018-07-24 08:01:24+00:00,66823715,intel-analytics/BigDL,1297418,yiheng,10941215,intel-analytics,created,139773855,8ff10c068a76826da04a8722a492c930259b4a12,False,what's this for?,CONTRIBUTOR,2593,{}
15452,PullRequestReviewCommentEvent,2017-02-16 04:53:26+00:00,66823715,intel-analytics/BigDL,10606312,SeaOfOcean,10941215,intel-analytics,created,22173386,f4c685b9e30c424823b4eb2049b953039286888d,False,"since each core has one running model, it may not help to parallelize within a module",,466,{}
15459,PullRequestReviewCommentEvent,2017-12-13 03:02:03+00:00,66823715,intel-analytics/BigDL,1297418,yiheng,10941215,intel-analytics,created,83050610,dcf85fd8048cac0cf578fdd26280215ab01b06e6,False,https://software.intel.com/node/d62fb8af-02ff-463f-b4b0-909d08708290#D62FB8AF-02FF-463F-B4B0-909D08708290,CONTRIBUTOR,1847,{}
15467,PullRequestReviewCommentEvent,2017-07-06 14:59:46+00:00,66823715,intel-analytics/BigDL,1931082,jason-dai,10941215,intel-analytics,created,48362537,74f02350a4d5d793dec79082a1db47d1f89fc1c9,False,Is noChild true for padding?,,1138,{}
15472,PullRequestReviewCommentEvent,2017-08-22 05:30:34+00:00,66823715,intel-analytics/BigDL,1837261,wzhongyuan,10941215,intel-analytics,created,57670947,7edb78642f13dadea3afd470d0a16c2305eed884,False,"ok, renamed.",,1491,{}
15481,PullRequestReviewCommentEvent,2018-01-08 05:50:38+00:00,66823715,intel-analytics/BigDL,1297418,yiheng,10941215,intel-analytics,created,87130017,76a71989b6c6b5a9a0898466fddcfcda852e69f0,False,"How do we deal with unfixed size, e.g. batch size dimension",CONTRIBUTOR,2163,{}
15487,PullRequestReviewCommentEvent,2017-08-07 05:49:42+00:00,66823715,intel-analytics/BigDL,1297418,yiheng,10941215,intel-analytics,created,54569290,df0fe6241a4b7eae7f6ebd4d600b590be8416474,False,do we also need padRight and padBottom?,,1419,{}
15493,PullRequestReviewCommentEvent,2018-07-09 03:31:12+00:00,90328920,intel-analytics/analytics-zoo,21994046,hkvision,10941215,intel-analytics,created,135267931,22dab2ddbe2c3f4811bf795f8b92dfbec4440f62,False,wrong doc...,CONTRIBUTOR,482,{}
15495,PullRequestReviewCommentEvent,2018-05-17 10:31:21+00:00,90328920,intel-analytics/analytics-zoo,21994046,hkvision,10941215,intel-analytics,created,120982614,53d69cbf98cbee1f858f4007ef680b3022f24e7a,False,Analytics Zoo model defined in Keras-style.,COLLABORATOR,132,{}
15496,PullRequestReviewCommentEvent,2018-08-22 02:42:51+00:00,90328920,intel-analytics/analytics-zoo,21994046,hkvision,10941215,intel-analytics,created,148316857,de64934069afa03f2b7a41497af40d818af22312,False,So you mean directly providing the link to https://analytics-zoo.github.io/master/#PythonUserGuide/install/,CONTRIBUTOR,617,{}
15501,PullRequestReviewCommentEvent,2018-05-18 02:16:45+00:00,90328920,intel-analytics/analytics-zoo,21994046,hkvision,10941215,intel-analytics,created,121272636,56ff6dec0b31e000894eac2522fa2df29a51e397,False,"I think we can just use `BModel(input, output)`?",COLLABORATOR,132,{}
15535,PullRequestReviewCommentEvent,2016-10-14 21:48:37+00:00,30895522,pvlib/pvlib-python,4383303,wholmgren,11037261,pvlib,created,4349161,dfe04b19311f5272e207842c176574a0c7eeef0b,False,Might be best for pvlib to only use a simple assignment. Users can do this in their own code before passing the parameter or making the assignment.,,239,{}
15558,PullRequestReviewCommentEvent,2016-04-07 22:02:09+00:00,53442595,globality-corp/microcosm-flask,477722,jessemyers,11172782,globality-corp,created,,ff1366a43913b2f51aa95e33016c9532e0f50845,False,Do you have a sample input? Unit tests are good for this sort of thing.,,23,{}
15571,PullRequestReviewCommentEvent,2017-12-22 08:30:48+00:00,89189034,globality-corp/microcosm-eventsource,477937,wheremiah,11172782,globality-corp,created,85261058,8c5c2c66f850b3900cfe36d82ccd34d08102364d,False,Previously new events with a parent would not use the Store's mock friendly `new_object_id()` function.,NONE,8,{}
15601,PullRequestReviewCommentEvent,2017-09-25 14:39:07+00:00,71999787,socialwifi/jsonapi-requests,1043875,jgoclawski,11313748,socialwifi,created,64917117,266c73f407583f1d281b88ff824bad4269341af3,False,"Let's add imports to the example. 
I'd also add an example of how to install the package with Flask support, so:
```
pip install jsonapi-requests[flask]
```",OWNER,29,{}
15622,PullRequestReviewCommentEvent,2017-06-15 07:26:06+00:00,33120392,zalando-stups/senza,1064524,tuxlife,11431876,zalando-stups,created,44222522,6bc75c27a35f35b2e91fe4e5a3bcf7a6007ac68a,False,Please remove dead code,,466,{}
15630,PullRequestReviewCommentEvent,2018-07-19 13:02:48+00:00,33120392,zalando-stups/senza,19940114,codacy-bot,11431876,zalando-stups,created,138659847,30f9c7e5d8a43a3e597ba58a6cfb1a59200ae5ac,False,![Codacy](https://app.codacy.com/assets/images/favicon.png) Issue found: [Line too long (140/120)](https://app.codacy.com/app/zalando-bus/senza/pullRequest?prid=1923297),NONE,525,{}
15660,PullRequestReviewCommentEvent,2018-07-11 05:53:57+00:00,128121076,dmlc/gluon-nlp,2626883,szha,11508361,dmlc,created,136097969,a99825d7b9fefbc5756d6f29f1d75d9bf56aa726,False,query.shape is only available if query is ndarray. you can do the check by checking whether `F == nd`.,MEMBER,201,{}
15668,PullRequestReviewCommentEvent,2017-05-14 09:39:13+00:00,41312700,symengine/symengine.py,5234427,isuruf,11509221,symengine,created,37996186,00b717ece6dee5e7ff9f771b0322728230a61146,False,Isn't this functionality in `__setitem__`?,,129,{}
15671,PullRequestReviewCommentEvent,2017-07-11 14:30:29+00:00,41312700,symengine/symengine.py,5234427,isuruf,11509221,symengine,created,49214328,e4ef6db186c991d4d6982b3d6c42191f52bd19fe,False,I would rename this to `is_square` instead of aliasing. Two names for the same method is needed only for sympy compatibility or backwards compatibility.,,172,{}
15672,PullRequestReviewCommentEvent,2017-06-27 11:54:39+00:00,41312700,symengine/symengine.py,5234427,isuruf,11509221,symengine,created,46523370,f3809209c341f6bfeac0925033bbfa12abf04803,False,What about changing `OneArgFunction`'s implementation to use the same name instead of lowercase?,,162,{}
15673,PullRequestReviewCommentEvent,2015-11-10 15:52:03+00:00,41312700,symengine/symengine.py,20568,certik,11509221,symengine,created,,44a00283896e261a261e3fbf84824293d553a751,False,Add documentation.,,19,{}
15682,PullRequestReviewCommentEvent,2016-04-08 08:26:20+00:00,7347535,pimusicbox/mopidy-musicbox-webclient,934824,kingosticks,11539267,pimusicbox,created,,137593c586f2291c2ff88ca593d7e489e288fc80,False,"Sure, I appreciate the different goals here. My point is that if you pass getImages an artist_uri then, depending on the backend, it may be able to provide you with an artist image. If not, you can fallback to using track metadata to do a last.fm request. ",,190,{}
15685,PullRequestReviewCommentEvent,2016-03-02 21:30:43+00:00,7347535,pimusicbox/mopidy-musicbox-webclient,10268911,jcass77,11539267,pimusicbox,created,,b481cdbefff05419f4c7f78a321182697f886bd5,False,The idea is that this could be used in editors like Sublime Text. But it is not essential and we can remove if needed.,,180,{}
15698,PullRequestReviewCommentEvent,2018-08-07 04:02:23+00:00,32944298,Z3Prover/z3,3085284,NikolajBjorner,11668813,Z3Prover,created,143833632,1aca1ccaebf9cb24b8fbe9728b21ae3320c08a3b,False,"ouch, it is then something for me to look at.",CONTRIBUTOR,1792,{}
15732,PullRequestReviewCommentEvent,2018-07-02 18:24:21+00:00,32944298,Z3Prover/z3,5377127,levnach,11668813,Z3Prover,created,133730468,ca3c0763945653660ec8273fe5a72750cecaca04,False,"We can replace i.first by i.var(), and i.second by i.coeff().",CONTRIBUTOR,1716,{}
15777,PullRequestReviewCommentEvent,2015-07-21 16:11:45+00:00,23924195,Lasagne/Lasagne,629706,f0k,11752110,Lasagne,created,,af0b293b3f133744624b144b5bdc55259e81e310,False,"> get_output is called, which will throw an error:

No, you're calling `get_output(layer, input)` there, which is totally fine!

> Where does it sound like that?

In the line this comment is attached to: ""Layer which connects input to the hidden state"". This can be understood to mean a single layer. To make it clear, you could write ""Layer or network"". The part you quoted can also be read in both ways, since ""layer instances"" could both mean ""one or more instances for input-to-hidden and one or more instances for hidden-to-hidden"" or merely ""one instance for input-to-hidden and one instance for hidden-to-hidden"". I think it would be helpful to make this explicit!",,294,{}
15786,PullRequestReviewCommentEvent,2015-09-28 12:40:30+00:00,23924195,Lasagne/Lasagne,629706,f0k,11752110,Lasagne,created,,10a46dfc6bb15f0cfb7879efb1876ca2d16c4de9,False,"Again, please retain `when stride=1` (commenting here so it's not forgotten).",,438,{}
15797,PullRequestReviewCommentEvent,2015-11-21 22:02:08+00:00,23924195,Lasagne/Lasagne,629706,f0k,11752110,Lasagne,created,,92e8140c839ec0f02052b5fd42b431d1469f7f90,False,"Oh, right. Seems that was German.",,467,{}
15809,PullRequestReviewCommentEvent,2015-11-18 23:23:30+00:00,23924195,Lasagne/Lasagne,43829,benanne,11752110,Lasagne,created,,9f0f4b3dbc6c44d95d9b9cfa31b71fc94bc33e86,False,"No, because in many cases specifying them is not necessary, and this would add unnecessary cognitive overhead to those cases.

As an example, in many nets, all parameters are `trainable`, so then it's nice to not have to worry about this distinction. I think this is where the ""restraint"" part of Lasagne's design philosophy applies :) (see http://lasagne.readthedocs.org/en/latest/user/development.html )

The same argument can be made for nets without dropout layers.",,467,{}
15810,PullRequestReviewCommentEvent,2016-09-28 16:44:42+00:00,23924195,Lasagne/Lasagne,4639261,fvisin,11752110,Lasagne,created,1978973,b57e742a413195f32f0f933bcd190e8be8f4b6dc,False,Right. I'll change it.,,745,{}
15814,PullRequestReviewCommentEvent,2018-07-02 19:48:28+00:00,40161124,vega/ipyvega,589034,domoritz,11796929,vega,created,133754112,d2fe6e9e8ea641a165d7921bb5d99ce50f8f52f9,False,What is `element`?,MEMBER,95,{}
15829,PullRequestReviewCommentEvent,2018-07-22 15:05:48+00:00,70920962,PyFilesystem/pyfilesystem2,554369,willmcgugan,11898830,PyFilesystem,created,139290451,69bd366f88e4b67f7b6b0d3104a826847673482f,False,Mypy doesn't seem to complain about this.,MEMBER,194,{}
15848,PullRequestReviewCommentEvent,2017-11-07 19:30:17+00:00,99273369,NeurodataWithoutBorders/pynwb,219043,jcfr,12140348,NeurodataWithoutBorders,created,74878388,9f9dc23dcf942981d9dbd8fb6dfabab1628e63c0,False,"@oruebel  This new PR cleans up the call to `write_out` removing extra unused parameters like `file=sys.stderr` and `end=''` that were present in #187 

Is expected to write error on `stdout` instead of `stderr` ? 

Also `sys.out` is invalid, it should be `sys.stdout`",COLLABORATOR,205,{}
15857,PullRequestReviewCommentEvent,2017-10-25 02:25:11+00:00,99273369,NeurodataWithoutBorders/pynwb,219043,jcfr,12140348,NeurodataWithoutBorders,created,71726420,1aac6076ec7ed5d792c7ac6c2159d6210c63f12b,False,"What do you think of adding `License :: OSI Approved :: BSD License` ?

https://pypi.python.org/pypi?:action=browse&c=60",COLLABORATOR,166,{}
15876,PullRequestReviewCommentEvent,2016-09-23 08:42:59+00:00,1750874,django-money/django-money,374612,benjaoming,12234694,django-money,created,,85485a31f4ce1ec93bdbf8a139869c666a2b6179,False,Are you saying that invoking `py.test` directly from tox is 20% faster than the Make -> setup.py -> py.test chain? :O,,231,{}
15885,PullRequestReviewCommentEvent,2018-01-26 20:26:10+00:00,87125865,Nealelab/cloudtools,755311,abaumann,12278453,Nealelab,created,91959594,76d1c187398a04c4acd84806cda53539dac461bd,False,"This is actually not used right now - it submits the job and doesn't wait, but this would be used if we wanted to monitor it's status",NONE,42,{}
15899,PullRequestReviewCommentEvent,2018-06-13 03:43:36+00:00,42593972,b12io/orchestra,57725,marcua,12401025,b12io,created,128218795,97a47186416b5b687aabee3b62dc00e185cd94a9,False,"whenever null=True, also do blank=True so you can save it in admin :)",MEMBER,449,{}
15901,PullRequestReviewCommentEvent,2017-11-28 17:23:48+00:00,37496521,nteract/nteract,836375,rgbkrk,12401040,nteract,created,79587824,02e646ae4fa78d017bca1a32c8575d3c30a90cd0,False,"That's very true.

Since it's the README, I left it being super explicit purely to be demonstrative. I tend to find I have to explain less / answer less questions if I pass a declared arrow function rather than pass a function by name.",OWNER,2105,{}
15905,PullRequestReviewCommentEvent,2018-02-12 17:59:53+00:00,37496521,nteract/nteract,836375,rgbkrk,12401040,nteract,created,95884288,4d1f9be87eb8069e3f6a99c156de5664840c5d0d,False,"I suppose, looking over this again, that we could always have `kernelRefs` for both. Maybe that's duplicative though. I guess what I'm saying is that we'll want to be able to list all the running kernels on a jupyter host and then all the ones active for the document are in `kernelRefs`?",OWNER,2516,{}
