,type,created_at,repo_id,repo_name,actor_id,actor_login,org_id,org_login,pr_review_comment_action,pr_review_comment_id,pr_review_comment_commit_id,pr_review_comment_site_admin,pr_review_comment_body,pr_review_comment_author_association,pr_number,pr_review_comment_reactions
11507,PullRequestReviewCommentEvent,2015-06-01 15:59:45+00:00,7209075,pantsbuild/pants,3391199,gmalmquist,3065172,pantsbuild,created,,329cabfd79f13c8617ba921f45acc24ff6d33cd8,False,"I just left it in because test_protobuf_gen already had working unit tests for it, and I didn't see a reason to break that.",,1613,{}
11509,PullRequestReviewCommentEvent,2015-06-03 18:27:38+00:00,7209075,pantsbuild/pants,3391199,gmalmquist,3065172,pantsbuild,created,,0fcbd8b1e08b82b720a242769a1271bc9afb087a,False,"I found this necessary to add after testing in our /java repo, and finding that protoc failed on many things using the isolated strategy because we have proto targets that apparently don't have any sources.",,1609,{}
11511,PullRequestReviewCommentEvent,2017-04-12 21:02:16+00:00,7209075,pantsbuild/pants,46740,stuhood,3065172,pantsbuild,created,32488776,fc00dc660880deb29d741eeaf67b5b2f5378548d,False,`iter.map(|x|x.clone())` should be equivalent to `iter.cloned()` ('cloned' with a 'd'),,4461,{}
11517,PullRequestReviewCommentEvent,2017-10-02 21:23:36+00:00,7209075,pantsbuild/pants,2623,copumpkin,3065172,pantsbuild,created,66596391,6768daddbadb2763a455093c4f950dd34d5bda52,False,So I'd pass those paths into `interpreter_cache.setup()`? I can do that,NONE,4930,{}
11531,PullRequestReviewCommentEvent,2017-10-17 22:18:48+00:00,7209075,pantsbuild/pants,46740,stuhood,3065172,pantsbuild,created,70048034,73d802b96a204f46fa1437d19f047f1678a5b2bb,False,"Should probably preserve the copyright statement of copied code: ie:
```
# Copyright 2017 Pants project contributors (see CONTRIBUTORS.md).
# Copyright 2011 Twitter, Inc.
# Licensed under the Apache License, Version 2.0 (see LICENSE).
```",OWNER,4986,{}
11536,PullRequestReviewCommentEvent,2017-12-19 19:28:51+00:00,7209075,pantsbuild/pants,596358,wisechengyi,3065172,pantsbuild,created,84563679,0a57e61a3227899145252541e92ffdedacc493f3,False,api changes reverted.,CONTRIBUTOR,5133,{}
11537,PullRequestReviewCommentEvent,2018-07-13 17:58:57+00:00,7209075,pantsbuild/pants,46740,stuhood,3065172,pantsbuild,created,137132245,44de2c377072984fe9c54f0846c35aef04ee88c5,False,This isn't a good default for this arg: would recommend `0` (the unix epoch) or something...,MEMBER,6094,{}
11548,PullRequestReviewCommentEvent,2017-08-09 17:45:54+00:00,7209075,pantsbuild/pants,157586,jsirois,3065172,pantsbuild,created,55317146,c6c5564fff642efcb3ee0df5a8493f3654c52985,False,I'll leave as is and merge the green CI. Should be fixed though - agreed.,,4804,{}
11553,PullRequestReviewCommentEvent,2017-01-10 00:55:20+00:00,7209075,pantsbuild/pants,46740,stuhood,3065172,pantsbuild,created,15829361,fd39ca793f7253591428fe8a39dbef29f55ee40b,False,"This is a very expensive thing to memoize, afaict. Remember that memoizing a method treats the arguments to the method as a cache key. So you're using a very large (unsorted) tuple as a cache key here.

Instead, I think you'd want to break up the memoization so that you have per-target memoization of classnames: ie, mark a method that takes a single target `memoized_method` instead.",,4171,{}
11556,PullRequestReviewCommentEvent,2017-06-08 23:46:48+00:00,7209075,pantsbuild/pants,512764,benjyw,3065172,pantsbuild,created,43041301,b4e7e900c9316dd7b078056e7d94dec6ffb6b29f,False,Maybe give an example here?,,4661,{}
11560,PullRequestReviewCommentEvent,2018-05-18 16:10:00+00:00,7209075,pantsbuild/pants,7378,baroquebobcat,3065172,pantsbuild,created,121482090,8de762ec3ef35e5c5e9df73efb58677569d80969,False,I think it's vestigial from when we had it hardcoded. I'll xx it.,CONTRIBUTOR,5632,{}
11561,PullRequestReviewCommentEvent,2017-02-01 01:23:12+00:00,7209075,pantsbuild/pants,2474428,peiyuwang,3065172,pantsbuild,created,19466271,38d7d555753a572221ce18f7c2e2d0c7600b3ecb,False,A tuple of ... patterns,,4226,{}
11565,PullRequestReviewCommentEvent,2017-03-28 02:40:51+00:00,7209075,pantsbuild/pants,46740,stuhood,3065172,pantsbuild,created,29347158,b9b411d50c72e8a0b2fb7a762c945928f0dd7b0b,False,"Yea, makes sense. I'll see about unifying `singletons` and `tasks` in the Tasks map.",,4369,{}
11570,PullRequestReviewCommentEvent,2017-07-17 16:30:58+00:00,7209075,pantsbuild/pants,512764,benjyw,3065172,pantsbuild,created,50372594,b23d430be61d0464e9633edaed24f732e4570b1f,False,"A) Bae? Are we mining Urban Dictionary for names now? ;-)

B) Also, this should probably be SetupPyTestBae, er, Base, for uniformity (we generally assume that anything ending in `Test` tests the thing with the prefix as a name).",,4753,{}
11572,PullRequestReviewCommentEvent,2018-03-14 15:31:30+00:00,7209075,pantsbuild/pants,157586,jsirois,3065172,pantsbuild,created,103870536,e237f0607ec3e4763acd99a64c417fdaa5817bd7,False,"I like it. I'd prefer a manually abstract classmethod though that doc could be hung off of, ie:
```python
@classmethod
def default_target_types(cls):
  """"""Subclasses should ...""""""
  raise NotImplementedError()
```

That said, this is the existing style, so take it or leave it. I just went down the rabbit hole of checking `_SCALA_SOURCE_EXTENSION` - another example of this - and I find it mystifying as-is since its not defined in the subclass, not documented, but required to be defined by leaf subclasses in order to not blow up.",OWNER,5596,{}
11578,PullRequestReviewCommentEvent,2018-06-28 01:05:05+00:00,7209075,pantsbuild/pants,1883523,kwlzn,3065172,pantsbuild,created,132658566,acea5cbf1a199bdbada48fe45381d1394e94f680,False,"ah, right.",MEMBER,6023,{}
11594,PullRequestReviewCommentEvent,2016-07-19 08:46:58+00:00,18842340,Demonware/jose,1029943,yuriikonovaliuk,3213043,Demonware,created,,0698dec489e32e6189611ba93302ecf716e80349,False,@Newky Should I also change the decryption method try order?,,21,{}
11603,PullRequestReviewCommentEvent,2017-11-06 16:47:38+00:00,93721432,awslabs/sockeye,2027990,fhieber,3299148,awslabs,created,74482065,869469b257b85351887e26c0e0b75351aa4a06da,False,would it make sense to clear _lex after this loop as well?,CONTRIBUTOR,180,{}
11605,PullRequestReviewCommentEvent,2017-09-21 08:57:21+00:00,93721432,awslabs/sockeye,683589,davvil,3299148,awslabs,created,64218413,164ae20ff15827f5acee328f3a2f5ff7a8d604d2,False,"I'm ambivalent about this one. On the one hand it's good to remove the dependency of argparse. On the other hand, I find it convenient to pass the whole arguments and let the function pick what it needs. In this way we reduce the number of places that must be aware of the parameters. Think about the unpacking we would need to do for create_model_config.",COLLABORATOR,147,{}
11608,PullRequestReviewCommentEvent,2018-01-18 17:22:16+00:00,93721432,awslabs/sockeye,2027990,fhieber,3299148,awslabs,created,89863093,512346cf732c57ab52c3fbf2f9f1102030b290ee,False,I think it might be a good idea to add the factor functionality to the existing Embedding class (via arguemnts in its constructor),CONTRIBUTOR,275,{}
11609,PullRequestReviewCommentEvent,2018-06-12 07:45:56+00:00,93721432,awslabs/sockeye,683589,davvil,3299148,awslabs,created,127848531,7123783a8e53fd0c0127e0d7b5ad941f3cdb3a22,False,"Ask the german guys, but I think ""Das ist ein Test"" sounds better.",CONTRIBUTOR,433,{}
11613,PullRequestReviewCommentEvent,2018-05-16 09:25:45+00:00,93721432,awslabs/sockeye,455256,mjpost,3299148,awslabs,created,120559400,5e9dbbf0e11bfb5390700440f1103b5a88b0db8a,False,I can surround it with a check for any(num_constraints),COLLABORATOR,349,{}
11615,PullRequestReviewCommentEvent,2018-01-31 15:55:51+00:00,93721432,awslabs/sockeye,713105,logogin,3299148,awslabs,created,92975466,d86fd50b34c53c54819460901e8aca528e336884,False,"Symbol gets created once - it is static. But in general, this hack should go away as soon as mxnet will have proper matrix multiplication for float16.",CONTRIBUTOR,287,{}
11644,PullRequestReviewCommentEvent,2018-08-03 18:37:31+00:00,105830539,awslabs/mxnet-model-server,24425551,frankfliu,3299148,awslabs,created,143287143,9f103c18f5afdc655bd6ab5d0e6139c0bb67477f,False,Missing space,NONE,478,{}
11735,PullRequestReviewCommentEvent,2017-02-15 20:16:45+00:00,8372403,snowballstem/snowball,1124347,dscorbett,3676704,snowballstem,created,22099644,3c2025178a7641107288ee8e2e2286b2f472fde3,False,It is better style to include the comma even after the final item in a multiline list.,,51,{}
11812,PullRequestReviewCommentEvent,2018-02-15 15:09:05+00:00,8763405,SoCo/SoCo,15690065,ghcs27,3826649,SoCo,created,96880629,48abec4770c0027e83e34aaee36d8f3b5005b8ae,False,"Yes, since the return value is a dict.",MEMBER,573,{}
11828,PullRequestReviewCommentEvent,2016-06-30 19:47:31+00:00,49976939,learningequality/kolibri,1680573,rtibbles,3926525,learningequality,created,,b789592bd88eee99120f4da82a3e725551b24038,False,"These are not the logs you are looking for.

I have merged your logging PR to master, so you can point to the right things now!",,175,{}
11831,PullRequestReviewCommentEvent,2017-09-25 17:36:42+00:00,49976939,learningequality/kolibri,1680573,rtibbles,3926525,learningequality,created,64974537,536462986da15eb2af0322a3a70998475dea506a,False,"This is a slightly misleading variable name, as it is the number of users in the classroom, not on the device in total.",OWNER,2226,{}
11832,PullRequestReviewCommentEvent,2016-09-13 23:10:48+00:00,49976939,learningequality/kolibri,618416,jamalex,3926525,learningequality,created,,7387ab1b87ccb733d85962c24ac6f0789a5e3de6,False,Just because I'm reviewing this now doesn't mean you shouldn't be off dissertating today! ;),,513,{}
11833,PullRequestReviewCommentEvent,2017-06-13 16:42:06+00:00,49976939,learningequality/kolibri,7193975,christianmemije,3926525,learningequality,created,43784215,9280f6b5dc88f5093599c8838591c7fb8624502f,False,Typing a username and then pressing enter causes a breakage.,,1633,{}
11835,PullRequestReviewCommentEvent,2016-08-12 19:00:23+00:00,49976939,learningequality/kolibri,1680573,rtibbles,3926525,learningequality,created,,f0469c477cd0f0ba4b95ad93c62da7e0d38d8a58,False,"Yes, all Vue file strings will be extracted during JS compilation.

I did not notice a big slowdown, and I only parse the AST for vue files (however, I am parsing the AST for all Vue files already that exist, and I didn't notice any slowdown).

It is also done asynchronously, and only once the bundle itself has already been emitted, so it shouldn't interfere with the build process too much.",,385,{}
11840,PullRequestReviewCommentEvent,2016-02-01 22:48:22+00:00,49976939,learningequality/kolibri,374612,benjaoming,3926525,learningequality,created,,bc87deb02dff863b061cfb43756842f838776276,False,"Ah yes, two user models doesn't make sense, :+1: for just making the caution a little softer :)",,11,{}
11841,PullRequestReviewCommentEvent,2018-02-27 01:00:08+00:00,49976939,learningequality/kolibri,2367265,indirectlylit,3926525,learningequality,created,99526167,428cb35b46d4492f6cfbab4a7621204d2068849b,False,"This is good, but it's written in a somewhat confusing way. In particular, the `pageState.topic` assignment can be outside of the if statement since it's common to both branches. In general, you want to limit the contents of code branches to only that code which is different between the cases.

Something like this might work?

```javascript
pageState.channel = currentChannel;
if (isRoot) {
  topic.description = currentChannel.description;
}
pageState.topic = _topicState(topic, ancestors);
```
",OWNER,3258,{}
11842,PullRequestReviewCommentEvent,2017-10-03 19:53:04+00:00,49976939,learningequality/kolibri,9877852,DXCanas,3926525,learningequality,created,66876639,2df2927d49ca37fcff9864318353784b39eb8c64,False,"Mainly, yeah. The other issue was that the HTML was assigning the wrong radio value to each option",MEMBER,2329,{}
11847,PullRequestReviewCommentEvent,2016-03-09 02:15:09+00:00,49976939,learningequality/kolibri,8888020,MCGallaspy,3926525,learningequality,created,,0337691629f9bf4f88e2f6d418d762c6c5a64112,False,"> It sounds like it would be cleanest if I removed this entire MORANGO block for now

Yes, if it is not essential then remove it.",,43,{}
11851,PullRequestReviewCommentEvent,2016-08-25 17:59:39+00:00,49976939,learningequality/kolibri,6361732,ralphiee22,3926525,learningequality,created,,fef7663066c2e535acc04be526b82fc2668dbeef,False,@rtibbles @jamalex what would be a good number of logs to have before we start making recommendations? Note: this would also go for other recommendation endpoints that we will have later.,,482,{}
11855,PullRequestReviewCommentEvent,2018-06-05 15:37:17+00:00,49976939,learningequality/kolibri,1680573,rtibbles,3926525,learningequality,created,126029806,a9f5dfe5c6e3eca5e5331041ec56ed3d43eb59eb,False,"Ah, so we dynamically set the scale, based on the size of the page and the available viewport, rather than setting the viewport by the scale? Neat.",MEMBER,3760,{}
11867,PullRequestReviewCommentEvent,2016-05-20 18:42:26+00:00,49976939,learningequality/kolibri,1680573,rtibbles,3926525,learningequality,created,,2a813d28097687e80d25b0493f41a006c34130cf,False,"Ah, hadn't realized ES6 implemented the implicit return in arrow syntax.",,101,{}
11868,PullRequestReviewCommentEvent,2017-03-09 23:37:18+00:00,49976939,learningequality/kolibri,191955,aronasorman,3926525,learningequality,created,26173455,da595fadebf337e50cd4e8c9a930e0ffa6f80140,False,What do these migrations do again?,,1053,{}
11872,PullRequestReviewCommentEvent,2017-10-19 00:22:10+00:00,49976939,learningequality/kolibri,1680573,rtibbles,3926525,learningequality,created,70396389,8e28111c5107ccc225634cf5d84936b6f8cd489a,False,Ditto.,OWNER,2470,{}
11881,PullRequestReviewCommentEvent,2017-06-11 21:51:20+00:00,49976939,learningequality/kolibri,374612,benjaoming,3926525,learningequality,created,43329862,da0e6fb01b3d468eeb1a922b7a867fd2f4d1c97a,False,"This is missed by the code coverage, perhaps add a test of something that doesn't have tz info?",,1604,{}
11882,PullRequestReviewCommentEvent,2016-08-26 21:19:07+00:00,49976939,learningequality/kolibri,9877852,DXCanas,3926525,learningequality,created,,db499d5c10b66e0c22c5ced33c6e7115147db7a2,False,@rtibbles ohgodpleaseno I'll fix it.,,468,{}
11883,PullRequestReviewCommentEvent,2016-04-11 19:34:15+00:00,49976939,learningequality/kolibri,2367265,indirectlylit,3926525,learningequality,created,,c048e5d1df7b3223b4a40d2a6aaeb3f6836ad0f6,False,answering my own Q: Looks like `KolibriModule` is not a backbone model. We're also using Backbone.Events,,49,{}
11884,PullRequestReviewCommentEvent,2016-08-18 05:29:22+00:00,49976939,learningequality/kolibri,6361732,ralphiee22,3926525,learningequality,created,,5cb36774ac65904520e88cbbeb9385eee8334ebe,False,The mime type interceptor infers what type of data we are sending over? Or is it because we know we are only communicating with json?,,437,{}
11885,PullRequestReviewCommentEvent,2018-05-01 20:43:34+00:00,49976939,learningequality/kolibri,618416,jamalex,3926525,learningequality,created,116695413,a6a3f1ebf5592ea093befc25abc201b40bc75f63,False,"Yeah, it's a tradeoff, I guess -- if daemonized, could be hard to understand why the server stopped loading (e.g. after an upgrade -- although presumably we would want to always maintain back-compatibility with old ini files). I agree that bailing is probably ""safest"", though. Will wait for more opinions.",OWNER,3607,{}
11889,PullRequestReviewCommentEvent,2017-06-08 14:43:39+00:00,49976939,learningequality/kolibri,2367265,indirectlylit,3926525,learningequality,created,42912148,265910fbc822c2cbb839f4d05c863d75d2b8bfef,False,"One consideration when thinking about what tag to use is whether [the default css `display` value](https://www.w3schools.com/html/html_blocks.asp) is block-level or inline. In general, HTML is often ""cleanest"" when all sibling DOM nodes have the same default display: either all inline or all block. Otherwise, you need extra css to override the defaults.

So for example mixing `<h2>` with `<p>` or `<div>` is cleaner than mixing `<h2>` with `<span>` or `<sub>`.",,1586,{}
11891,PullRequestReviewCommentEvent,2017-01-06 08:31:15+00:00,49976939,learningequality/kolibri,2367265,indirectlylit,3926525,learningequality,created,15455874,b35367c71ac593dbd91acc931f11b07944b695c0,False,"I believe all UIDs should be strings all the time. They might look like integers, but it's an illusion ;-) Basically, we should always treat them as opaque byte strings and never do any parsing or logic on them.",,721,{}
11900,PullRequestReviewCommentEvent,2016-06-16 19:44:11+00:00,49976939,learningequality/kolibri,1680573,rtibbles,3926525,learningequality,created,,70e16beada4b5aef2fcf5fb19e55e1ac0036bf19,False,"`this.fetch` vs `fetch` happens because of the way it is necessary to inherit from a Javascript `Array`. Given the joint push for composition over inheritance, I will happily change these over to set their data on properties of the objects.",,147,{}
11902,PullRequestReviewCommentEvent,2017-10-23 21:32:03+00:00,49976939,learningequality/kolibri,1680573,rtibbles,3926525,learningequality,created,71336622,242cf29ccc389ce53cebeb30f13b0e762dce7736,False,This is also the same approach that this library takes too: https://github.com/tzulberti/django-session-idle-timeout,OWNER,2502,{}
11903,PullRequestReviewCommentEvent,2018-06-12 16:51:41+00:00,49976939,learningequality/kolibri,7193975,christianmemije,3926525,learningequality,created,128055985,950e3f1451e3e19f81f29706fa1c278f73dd6c8a,False,Added an actions slot.,MEMBER,3786,{}
11904,PullRequestReviewCommentEvent,2017-10-16 22:11:32+00:00,49976939,learningequality/kolibri,1680573,rtibbles,3926525,learningequality,created,69716171,ae5a3fa6147e45600c1b52631f196156dfc40f15,False,This is the thing @indirectlylit mentioned today in the dev meeting: https://vue-loader.vuejs.org/en/features/scoped-css.html#deep-selectors,OWNER,2337,{}
11905,PullRequestReviewCommentEvent,2016-05-11 22:52:14+00:00,49976939,learningequality/kolibri,2367265,indirectlylit,3926525,learningequality,created,,b0f8995f7cecdc441cf288f495916ba0376e51f4,False,nice,,66,{}
11906,PullRequestReviewCommentEvent,2017-11-30 16:33:25+00:00,49976939,learningequality/kolibri,1680573,rtibbles,3926525,learningequality,created,80245720,2ae880f05c52d38f614db63338eb64dca4ce793d,False,"Yeah, you have to invoke next tick and then chain from it, it returns a promise.",OWNER,2665,{}
11909,PullRequestReviewCommentEvent,2018-06-26 23:02:04+00:00,49976939,learningequality/kolibri,2367265,indirectlylit,3926525,learningequality,created,132235240,73a7f1c53691006fd2f88ec4e1bbe7cedac5e487,False,refs #2685,MEMBER,3885,{}
11912,PullRequestReviewCommentEvent,2016-08-07 04:19:57+00:00,49976939,learningequality/kolibri,5577205,66eli77,3926525,learningequality,created,,0f18ca3ae55ff57b68a9195b86a11aaaf8259b8d,False,"no, no more lintings &#9760;
I use empty lines in css to separate groups.",,332,{}
11913,PullRequestReviewCommentEvent,2017-09-18 16:36:15+00:00,49976939,learningequality/kolibri,1680573,rtibbles,3926525,learningequality,created,63412205,8db9cb93009ad327d117b317fcbe89e6ff16db58,False,"Yeah, can probably simplify this query slightly.",OWNER,2106,{}
11918,PullRequestReviewCommentEvent,2017-01-05 21:01:19+00:00,68139052,learningequality/morango,618416,jamalex,3926525,learningequality,created,15391159,42539300d9975304af7de687d80b2d3b3815a79c,False,"Yeah, I think `values` already does a `GROUP BY` when it's combined with `annotate`. :magic:

Tests would be good; can come in another PR, yep.",,5,{}
11919,PullRequestReviewCommentEvent,2017-08-22 19:38:33+00:00,68139052,learningequality/morango,618416,jamalex,3926525,learningequality,created,57384596,27fef051b3c5e38ccd5b4e383ce7c379662c96d0,False,"Looks like this tests the ""update"" case, there's also the case of the instance ID not yet existing in the RMC (""insert"").",,22,{}
11920,PullRequestReviewCommentEvent,2016-09-26 20:33:42+00:00,17405039,learningequality/le-utils,7193975,christianmemije,3926525,learningequality,created,,86ca734c9d232b31ea418dbe85ce3c71efd2fd6e,False,skill_check*,,8,{}
11925,PullRequestReviewCommentEvent,2017-03-16 00:26:04+00:00,66905525,learningequality/kolibri-exercise-perseus-plugin,2367265,indirectlylit,3926525,learningequality,created,27231707,edc5cdbb474150c7f9a02ced62fc1a209b06dd6b,False,There's some very odd whitespace stuff happening in this function. Recommend that all parens & brackets open and close at the same level of indentation.,,49,{}
11938,PullRequestReviewCommentEvent,2018-07-31 12:37:04+00:00,12426527,crate/crate-python,12958979,autophagy,4048232,crate,created,141931627,8e7406e2749c196fe27d226c94fb2d2a25c70947,False,Sure thing,MEMBER,304,{}
11939,PullRequestReviewCommentEvent,2017-12-07 07:17:50+00:00,12426527,crate/crate-python,281260,chaudum,4048232,crate,created,81763726,b260d36aa7a03e89a737450d8560fc39af260c2c,False,you could use the `make_headers()` helper from urllib3 https://github.com/shazow/urllib3/blob/release/urllib3/util/request.py#L11,MEMBER,247,{}
11940,PullRequestReviewCommentEvent,2015-11-03 10:37:06+00:00,12426527,crate/crate-python,281260,chaudum,4048232,crate,created,,ed7c8f1645bd068c0328d8943dca7cfe32e7a752,False,"see comment from removed `stop()` method.
is that not true any more?",,138,{}
11975,PullRequestReviewCommentEvent,2016-04-20 11:34:10+00:00,11681402,aldryn/aldryn-people,964646,crash843,4201738,aldryn,created,,4a6c74d02f6111dbd8794df13b37cb99f8446382,False,should we update .po files as well?,,129,{}
11998,PullRequestReviewCommentEvent,2015-07-15 21:37:29+00:00,34165184,aldryn/aldryn-translation-tools,994951,czpython,4201738,aldryn,created,,3959d7148113663051a5d5cfe3b9c1eaad237f04,False,you could use ```obj._meta.model_name``` but make sure is available in django 1.5 if we still support it.,,3,{}
12011,PullRequestReviewCommentEvent,2017-12-06 00:56:38+00:00,42324225,lyft/confidant,2908189,vivianho,4269340,lyft,created,81387924,da68dd4aab4a379d0b9854d037ddd8cf1407f216,False,Do you need to enforce that the service is in maintenance mode before doing this?,CONTRIBUTOR,160,{}
12045,PullRequestReviewCommentEvent,2018-08-10 02:41:46+00:00,53143022,oduwsdl/ipwb,65147,ibnesayeed,4416806,oduwsdl,created,145088577,0a9aac596d798a1e99b0ffc05f2cc66f35bc5f8a,False,"""no"" => ""not""",MEMBER,489,{}
12059,PullRequestReviewCommentEvent,2017-01-23 21:49:25+00:00,10475661,onespacemedia/cms,24423609,lintly-bot,4577273,onespacemedia,created,18033844,ed466b4702318155d0e7abeeae2644f31940b682,False,E501: line too long (104 > 100 characters),,123,{}
12076,PullRequestReviewCommentEvent,2017-11-17 10:15:39+00:00,58479957,juju/python-libjuju,66491,rogpeppe,4604548,juju,created,77389584,204dc7e260f3942b560b801f1abc41790e2b4012,False,"Not as far as I can see from all the examples I've found online, e.g. https://docs.python.org/3/library/unittest.html",OWNER,186,{}
12120,PullRequestReviewCommentEvent,2018-05-08 11:57:02+00:00,53160128,databricks/tensorframes,7594753,thunterdb,4998052,databricks,created,118331002,861b83bb003914e21653bc7ee0cb01a14f6db928,False,"Would you mind using this URL instead?
https://spark-packages.org/package/databricks/tensorframes",COLLABORATOR,148,{}
12133,PullRequestReviewCommentEvent,2017-01-25 18:48:43+00:00,64702698,jwplayer/jwplatform-py,1949124,TBoshoven,5090060,jwplayer,created,18471391,354a267b63fb790238bd3c3103892cc4022e950f,False,`Exception` is not necessary here.,,11,{}
12136,PullRequestReviewCommentEvent,2018-01-16 21:11:21+00:00,50359589,girder/girder_worker,555959,zachmullen,5150517,girder,created,89249650,7dcf3b53d8a9cbd2712ad9724b193b8143ba3e0a,False,"If there isn't a runtime invocation command to use, there's always the `girder-worker-config set` command that could be used here instead of `sed`.",OWNER,239,{}
12138,PullRequestReviewCommentEvent,2018-01-18 14:12:49+00:00,50359589,girder/girder_worker,1031053,cjh1,5150517,girder,created,89793267,6b4138dfc0ce7883e98ddc802308d816b3ce52b4,False,"I guess one issue with that approach is filename conflicts, where as the default of using the uuid is going to be pretty safe from that point of view.",MEMBER,246,{}
12190,PullRequestReviewCommentEvent,2018-08-08 02:58:27+00:00,48544147,LCAV/pyroomacoustics,1118133,fakufaku,5398462,LCAV,created,144252811,508412c787cec48c5c74737d7dfb024ccae0ec4c,False,Right!,MEMBER,46,{}
12200,PullRequestReviewCommentEvent,2016-07-14 16:33:15+00:00,10247874,docker/docker-py,442180,dnephin,5429470,docker,created,,267021e4535606165887760b88e75ad79542ae99,False,`stream` changed here to always `True`. Is that correct?,,1130,{}
12256,PullRequestReviewCommentEvent,2017-01-10 04:05:11+00:00,12968651,pgmpy/pgmpy,24607197,raghavg7796,5500131,pgmpy,created,15846582,a30e693c139033d2ac7f04d0d3533f40da41bf3c,False,@yashu-seth The reason was to make it consistent with the MarkovModel.get_cardinality,,814,{}
12277,PullRequestReviewCommentEvent,2015-06-06 16:56:05+00:00,12968651,pgmpy/pgmpy,1461453,ankurankan,5500131,pgmpy,created,,02de36f384f3b35be67259b2c28e01404f3a6829,False,"@palashahuja Pep8 import order: https://www.python.org/dev/peps/pep-0008/#imports
So this should be like this:
```python
from collections import OrderedDict, namedtuple

import numpy as np

from pgmpy.models import BayesianModel
from pgmpy.factors import TabularCPD, TreeCPD, RuleCPD
```",,410,{}
